A1: Έκδοση 1 | B1: ΕΞΕΤΑΣΤΙΚΗ ΣΕΠΤΕΜΒΡΙΟΥ
A2: Στις ασκησεις η βαθμολογια ειναι με ποντους με αριστα το ποσοστο της ασκησης. Στο διαγωνισμα ο βαθμος ειναι με αριστα το 10.
A3: ΕΞΕΤΑΣΤΙΚΗ ΣΕΠΤΕΜΒΡΙΟΥ
A4: ΑΜ | B4: Πρωτη | C4: Δευτερη | D4: Τριτη | E4: Διαγωνισμα | F4: Πριμ | G4: Τελικος | H4: Γραμματεια
B5: 15% | C5: 20% | D5: 15% | E5: 55% | F5: 10% | G5: 100% | H5: Στρογγυλ
A6: 511/2000005 | B6: 7 | C6: 6 | D6: 7 | E6: 5 | G6: 4,8 | H6: 5
A7: 511/2000043 | B7: 15 | C7: 16 | D7: 9 | E7: 3,6 | G7: 6,0 | H7: 6
A8: 511/2002029 | B8: 4 | E8: 4,5 | G8: 2,9 | H8: 3
A9: 511/2003034 | B9: 15 | E9: 6,5 | G9: 5,1 | H9: 5
A10: 511/2004008 | B10: 14 | D10: 9 | E10: 5,3 | G10: 5,2 | H10: 5
A11: 511/2004023 | B11: 15 | C11: 18 | D11: 12 | E11: 1,5 | G11: 5,3 | H11: 5,5
A12: 511/2004034 | B12: 9 | C12: 6 | D12: 8 | E12: 4,5 | G12: 4,8 | H12: 5
A13: 511/2004042 | B13: 13 | E13: 3,7 | G13: 3,3 | H13: 3,5
A14: 511/2004059 | B14: 8 | D14: 13 | E14: 4,9 | G14: 4,8 | H14: 5
A15: 511/2004068 | D15: 13 | E15: 4,2 | G15: 3,6 | H15: 3,5
A16: 511/2005051 | B16: 11 | C16: 3 | E16: 4,5 | G16: 3,9 | H16: 4
A17: 511/2006008 | C17: 7 | E17: 5,1 | F17: 1 | G17: 3,9 | H17: 4
A18: 511/2006042 | C18: 6 | E18: 5,9 | F18: 1 | G18: 4,2 | H18: 4
A19: 511/2006048 | B19: 11 | C19: 6 | E19: 5,7 | G19: 4,8 | H19: 5
A20: 511/2006063 | B20: 15 | C20: 12 | E20: 5 | G20: 5,5 | H20: 5,5
A21: Αθροισμα | B21: 137 | C21: 80 | D21: 71 | E21: 69,9 | F21: 2 | G21: 67,98 | H21: 69
A22: Πλήθος | B22: 12 | C22: 9 | D22: 7 | E22: 15 | F22: 2 | G22: 15 | H22: 15
A23: Μέσος όρος | B23: 11,417 | C23: 8,888889 | D23: 10,14286 | E23: 4,66 | G23: 4,532 | H23: 4,6
A24: Επιτυχόντες | H24: 9
A25: Ποσοστό επιτυχίας | H25: 60%

A1: Έκδοση 4 | B1: ΕΞΕΤΑΣΤΙΚΗ ΙΟΥΛΙΟΥ
A2: Στις ασκησεις η βαθμολογια ειναι με ποντους με αριστα το ποσοστο της ασκησης. Στο διαγωνισμα ο βαθμος ειναι με αριστα το 10.
A3: ΕΞΕΤΑΣΤΙΚΗ ΙΟΥΛΙΟΥ
A4: ΑΜ | D4: Πρωτη | E4: Δευτερη | F4: Τριτη | G4: Διαγωνισμα | H4: Πριμ | I4: Τελικος | J4: Γραμματεια
D5: 0.15 | E5: 0.2 | F5: 0.15 | G5: 0.55 | H5: 0.1 | I5: 1 | J5: Στρογγυλ
A6: 511/2000005 | B6: ΒΕΡΤΖΑΗ ΒΡΕΣΑΗ | C6: ΕΥΜΟΡΦΙΑ | G6: 4.8 | I6: =((D6+E6+F6)/10+G6*0.55) *IF(H6=1,1.1,1) -> 2.64 | J6: =IF(I6>0,ROUND(2*I6,0)/2,"") -> 2.5
A7: 511/2000031 | B7: ΚΟΡΩΝΗΣ | C7: ΓΕΩΡΓΙΟΣ | D7: 14 | E7: 10 | F7: 7 | G7: 4.5 | I7: =((D7+E7+F7)/10+G7*0.55) *IF(H7=1,1.1,1) -> 5.5750000000000002 | J7: =IF(I7>0,ROUND(2*I7,0)/2,"") -> 5.5
A8: 511/2000033 | B8: ΚΟΥΖΕΛΗ | C8: ΕΙΡΗΝΗ | I8: =((D8+E8+F8)/10+G8*0.55) *IF(H8=1,1.1,1) -> 0 | J8: =IF(I8>0,ROUND(2*I8,0)/2,"") -> 
A9: 511/2000035 | B9: ΚΟΥΛΤΟΥΚΗ | C9: ΜΑΡΙΑ ΕΛΕΝΗ | D9: 15 | E9: 19 | G9: 2.5 | I9: =((D9+E9+F9)/10+G9*0.55) *IF(H9=1,1.1,1) -> 4.7750000000000004 | J9: =IF(I9>0,ROUND(2*I9,0)/2,"") -> 5 | K9: *άσκηση Greenfoot
A10: 511/2000037 | B10: ΚΟΥΡΕΝΤΗΣ | C10: ΒΑΣΙΛΕΙΟΣ | F10: 9 | G10: 7 | I10: =((D10+E10+F10)/10+G10*0.55) *IF(H10=1,1.1,1) -> 4.75 | J10: =IF(I10>0,ROUND(2*I10,0)/2,"") -> 5 | K10: *
A11: 511/2000039 | B11: ΛΟΥΒΡΟΥ | C11: ΕΛΕΝΗ | I11: =((D11+E11+F11)/10+G11*0.55) *IF(H11=1,1.1,1) -> 0 | J11: =IF(I11>0,ROUND(2*I11,0)/2,"") -> 
A12: 511/2000043 | B12: ΜΕΛΕΤΙΟΣ | C12: ΙΩΑΝΝΗΣ | D12: 15 | E12: 16 | F12: 9 | I12: =((D12+E12+F12)/10+G12*0.55) *IF(H12=1,1.1,1) -> 4 | J12: =IF(I12>0,ROUND(2*I12,0)/2,"") -> 4
A13: 511/2000061 | B13: ΠΙΠΙΝΗΣ | C13: ΚΩΝΣΤΑΝΤΙΝΟΣ | I13: =((D13+E13+F13)/10+G13*0.55) *IF(H13=1,1.1,1) -> 0 | J13: =IF(I13>0,ROUND(2*I13,0)/2,"") -> 
A14: 511/2000066 | B14: ΣΙΟΥΡΟΥΝΗΣ | C14: ΒΑΣΙΛΕΙΟΣ | I14: =((D14+E14+F14)/10+G14*0.55) *IF(H14=1,1.1,1) -> 0 | J14: =IF(I14>0,ROUND(2*I14,0)/2,"") -> 
A15: 511/2000068 | B15: ΣΚΟΥΦΑΣ | C15: ΑΧΙΛΛΕΑΣ | I15: =((D15+E15+F15)/10+G15*0.55) *IF(H15=1,1.1,1) -> 0 | J15: =IF(I15>0,ROUND(2*I15,0)/2,"") -> 
A16: 511/2000071 | B16: ΣΤΑΘΟΠΟΥΛΟΣ | C16: ΖΑΧΑΡΙΑΣ ΠΑΝΑΓ | D16: 12 | F16: 7 | G16: 5.7 | I16: =((D16+E16+F16)/10+G16*0.55) *IF(H16=1,1.1,1) -> 5.0350000000000001 | J16: =IF(I16>0,ROUND(2*I16,0)/2,"") -> 5
A17: 511/2000073 | B17: ΣΥΡΜΗΣ | C17: ΙΩΑΝΝΗΣ | E17: 4 | F17: 7 | G17: 4 | I17: =((D17+E17+F17)/10+G17*0.55) *IF(H17=1,1.1,1) -> 3.3 | J17: =IF(I17>0,ROUND(2*I17,0)/2,"") -> 3.5
A18: 511/2000077 | B18: ΦΘΕΝΟΣ | C18: ΜΙΧΑΗΛ | D18: 15 | F18: 4 | G18: 5.2 | I18: =((D18+E18+F18)/10+G18*0.55) *IF(H18=1,1.1,1) -> 4.76 | J18: =IF(I18>0,ROUND(2*I18,0)/2,"") -> 5 | K18: *
A19: 511/2001003 | B19: ΑΠΟΣΤΟΛΑΚΗΣ | C19: ΕΥΘΥΜΙΟΣ | I19: =((D19+E19+F19)/10+G19*0.55) *IF(H19=1,1.1,1) -> 0 | J19: =IF(I19>0,ROUND(2*I19,0)/2,"") -> 
A20: 511/2001012 | B20: ΔΕΛΗΓΙΑΝΝΗ | C20: ΑΝΝΑ | D20: 15 | E20: 13 | F20: 11 | G20: 5.5 | I20: =((D20+E20+F20)/10+G20*0.55) *IF(H20=1,1.1,1) -> 6.9249999999999998 | J20: =IF(I20>0,ROUND(2*I20,0)/2,"") -> 7
A21: 511/2001019 | B21: ΚΑΣΣΕΛΑΣ | C21: ΒΑΣΙΛΕΙΟΣ | D21: 15 | E21: 15 | G21: 4.8 | I21: =((D21+E21+F21)/10+G21*0.55) *IF(H21=1,1.1,1) -> 5.64 | J21: =IF(I21>0,ROUND(2*I21,0)/2,"") -> 5.5
A22: 511/2001026 | B22: ΚΟΥΤΣΟΥΜΠΑΣ | C22: ΔΗΜΗΤΡΙΟΣ | D22: 12 | E22: 14 | G22: 4.6 | I22: =((D22+E22+F22)/10+G22*0.55) *IF(H22=1,1.1,1) -> 5.13 | J22: =IF(I22>0,ROUND(2*I22,0)/2,"") -> 5
A23: 511/2001049 | B23: ΠΑΠΑΝΙΚΟΛΑΟΥ | C23: ΓΕΩΡΓΙΑ | D23: 13 | E23: 17 | F23: 8 | G23: 5.5 | I23: =((D23+E23+F23)/10+G23*0.55) *IF(H23=1,1.1,1) -> 6.8250000000000002 | J23: =IF(I23>0,ROUND(2*I23,0)/2,"") -> 7
A24: 511/2002006 | B24: ΑΡΑΚΑΣ | C24: ΓΕΩΡΓΙΟΣ | D24: 11 | E24: 18 | F24: 12 | G24: 7.1 | I24: =((D24+E24+F24)/10+G24*0.55) *IF(H24=1,1.1,1) -> 8.0050000000000008 | J24: =IF(I24>0,ROUND(2*I24,0)/2,"") -> 8
A25: 511/2002019 | B25: ΖΗΣΗ | C25: ΟΛΥΜΠΙΑ | D25: 15 | E25: 13 | F25: 7 | G25: 4 | I25: =((D25+E25+F25)/10+G25*0.55) *IF(H25=1,1.1,1) -> 5.7 | J25: =IF(I25>0,ROUND(2*I25,0)/2,"") -> 5.5
A26: 511/2002027 | B26: ΚΟΛΟΒΟΥ | C26: ΔΕΣΠΟΙΝΑ | E26: 16 | F26: 11 | G26: 5.7 | I26: =((D26+E26+F26)/10+G26*0.55) *IF(H26=1,1.1,1) -> 5.835 | J26: =IF(I26>0,ROUND(2*I26,0)/2,"") -> 6
A27: 511/2002029 | B27: ΚΟΥΤΡΟΥΜΑΝΟΥ | C27: ΑΝΑΣΤΑΣΙΑ | D27: 4 | G27: 3.2 | I27: =((D27+E27+F27)/10+G27*0.55) *IF(H27=1,1.1,1) -> 2.16 | J27: =IF(I27>0,ROUND(2*I27,0)/2,"") -> 2
A28: 511/2002037 | B28: ΜΠΑΤΖΙΟΣ | C28: ΠΑΝΑΓΙΩΤΗΣ | D28: 13 | I28: =((D28+E28+F28)/10+G28*0.55) *IF(H28=1,1.1,1) -> 1.3 | J28: =IF(I28>0,ROUND(2*I28,0)/2,"") -> 1.5
A29: 511/2002052 | B29: ΠΟΤΙΔΗΣ | C29: ΧΡΟΝΗΣ | I29: =((D29+E29+F29)/10+G29*0.55) *IF(H29=1,1.1,1) -> 0 | J29: =IF(I29>0,ROUND(2*I29,0)/2,"") -> 
A30: 511/2003002 | B30: ΑΝΔΡΙΤΣΟΥ | C30: ΕΥΑΝΘΙΑ | D30: 15 | E30: 9 | F30: 13 | G30: 4.3 | I30: =((D30+E30+F30)/10+G30*0.55) *IF(H30=1,1.1,1) -> 6.0650000000000004 | J30: =IF(I30>0,ROUND(2*I30,0)/2,"") -> 6
A31: 511/2003005 | B31: ΒΡΕΤΤΟΣ | C31: ΠΑΝΑΓΙΩΤΗΣ | D31: 9 | I31: =((D31+E31+F31)/10+G31*0.55) *IF(H31=1,1.1,1) -> 0.9 | J31: =IF(I31>0,ROUND(2*I31,0)/2,"") -> 1
A32: 511/2003009 | B32: ΔΙΠΛΑΡΗ | C32: ΑΙΚΑΤΕΡΙΝΗ | D32: 12 | E32: 10 | F32: 4 | G32: 7.5 | I32: =((D32+E32+F32)/10+G32*0.55) *IF(H32=1,1.1,1) -> 6.7249999999999996 | J32: =IF(I32>0,ROUND(2*I32,0)/2,"") -> 6.5
A33: 511/2003014 | B33: ΘΕΟΔΩΡΑΚΗΣ | C33: ΜΙΧΑΗΛ | I33: =((D33+E33+F33)/10+G33*0.55) *IF(H33=1,1.1,1) -> 0 | J33: =IF(I33>0,ROUND(2*I33,0)/2,"") -> 
A34: 511/2003018 | B34: ΚΑΠΑΣΣΑ | C34: ΑΦΡΟΔΙΤΗ | I34: =((D34+E34+F34)/10+G34*0.55) *IF(H34=1,1.1,1) -> 0 | J34: =IF(I34>0,ROUND(2*I34,0)/2,"") -> 
A35: 511/2003023 | B35: ΜΑΚΡΟΠΟΔΗΣ | C35: ΚΩΝΣΤΑΝΤΙΝΟΣ | I35: =((D35+E35+F35)/10+G35*0.55) *IF(H35=1,1.1,1) -> 0 | J35: =IF(I35>0,ROUND(2*I35,0)/2,"") -> 
A36: 511/2003028 | B36: ΜΑΥΡΟΠΟΥΛΟΥ | C36: ΑΝΝΑ | E36: 6 | I36: =((D36+E36+F36)/10+G36*0.55) *IF(H36=1,1.1,1) -> 0.6 | J36: =IF(I36>0,ROUND(2*I36,0)/2,"") -> 0.5
A37: 511/2003034 | B37: ΝΑΥΠΛΙΩΤΟΥ | C37: ΣΤΑΥΡΟΥΛΑ | D37: 15 | I37: =((D37+E37+F37)/10+G37*0.55) *IF(H37=1,1.1,1) -> 1.5 | J37: =IF(I37>0,ROUND(2*I37,0)/2,"") -> 1.5
A38: 511/2003036 | B38: ΞΕΝΟΦΩΝΤΟΣ | C38: ΒΑΣΙΛΕΙΟΣ | I38: =((D38+E38+F38)/10+G38*0.55) *IF(H38=1,1.1,1) -> 0 | J38: =IF(I38>0,ROUND(2*I38,0)/2,"") -> 
A39: 511/2003041 | B39: ΠΑΤΕΡΑΣ | C39: ΟΡΕΣΤΗΣ | I39: =((D39+E39+F39)/10+G39*0.55) *IF(H39=1,1.1,1) -> 0 | J39: =IF(I39>0,ROUND(2*I39,0)/2,"") -> 
A40: 511/2003042 | B40: ΠΛΑΣΤΗΡΑΣ | C40: ΧΡΙΣΤΟΦΟΡΟΣ | I40: =((D40+E40+F40)/10+G40*0.55) *IF(H40=1,1.1,1) -> 0 | J40: =IF(I40>0,ROUND(2*I40,0)/2,"") -> 
A41: 511/2003046 | B41: ΣΤΥΛΙΑΡΑ | C41: ΣΑΝΑ | I41: =((D41+E41+F41)/10+G41*0.55) *IF(H41=1,1.1,1) -> 0 | J41: =IF(I41>0,ROUND(2*I41,0)/2,"") -> 
A42: 511/2003052 | B42: ΤΡΑΜΟΥΝΤΑΝΗ | C42: ΒΑΣΙΛΙΚΗ | D42: 12 | E42: 10 | F42: 8 | G42: 4.5 | I42: =((D42+E42+F42)/10+G42*0.55) *IF(H42=1,1.1,1) -> 5.4749999999999996 | J42: =IF(I42>0,ROUND(2*I42,0)/2,"") -> 5.5
A43: 511/2003056 | B43: ΤΣΙΔΕΜΙΑΔΗΣ | C43: ΔΑΜΙΑΝΟΣ | D43: 15 | F43: 8 | G43: 6.5 | I43: =((D43+E43+F43)/10+G43*0.55) *IF(H43=1,1.1,1) -> 5.875 | J43: =IF(I43>0,ROUND(2*I43,0)/2,"") -> 6
A44: 511/2003058 | B44: ΧΟΥΡΝΑΖΙΔΗΣ | C44: ΓΡΗΓΟΡΙΟΣ | I44: =((D44+E44+F44)/10+G44*0.55) *IF(H44=1,1.1,1) -> 0 | J44: =IF(I44>0,ROUND(2*I44,0)/2,"") -> 
A45: 511/2003059 | B45: ΧΡΗΣΤΙΔΗΣ | C45: ΙΩΣΗΦ | D45: 15 | E45: 8 | F45: 4 | G45: 5.6 | I45: =((D45+E45+F45)/10+G45*0.55) *IF(H45=1,1.1,1) -> 5.78 | J45: =IF(I45>0,ROUND(2*I45,0)/2,"") -> 6
A46: 511/2003061 | B46: ΧΡΥΣΙΚΟΠΟΥΛΟΣ | C46: ΑΣΗΜΑΚΗΣ | I46: =((D46+E46+F46)/10+G46*0.55) *IF(H46=1,1.1,1) -> 0 | J46: =IF(I46>0,ROUND(2*I46,0)/2,"") -> 
A47: 511/2003063 | B47: ΑΝΤΩΝΙΟΥ | C47: ΕΛΕΝΑ | I47: =((D47+E47+F47)/10+G47*0.55) *IF(H47=1,1.1,1) -> 0 | J47: =IF(I47>0,ROUND(2*I47,0)/2,"") -> 
A48: 511/2003065 | B48: ΛΟΥΗΣ | C48: ΣΑΠΡΙΝΑ | D48: 13 | E48: 7 | G48: 5.7 | I48: =((D48+E48+F48)/10+G48*0.55) *IF(H48=1,1.1,1) -> 5.1349999999999998 | J48: =IF(I48>0,ROUND(2*I48,0)/2,"") -> 5
A49: 511/2004002 | B49: ΑΝΑΣΤΑΣΙΑΔΗ | C49: ΣΤΥΛΙΑΝΗ | D49: 9 | E49: 12 | F49: 8 | G49: 6 | I49: =((D49+E49+F49)/10+G49*0.55) *IF(H49=1,1.1,1) -> 6.2 | J49: =IF(I49>0,ROUND(2*I49,0)/2,"") -> 6
A50: 511/2004004 | B50: ΑΥΓΟΥΛΗ | C50: ΡΟΥΜΠIΝΗ - ΖΩΗ | I50: =((D50+E50+F50)/10+G50*0.55) *IF(H50=1,1.1,1) -> 0 | J50: =IF(I50>0,ROUND(2*I50,0)/2,"") -> 
A51: 511/2004007 | B51: ΒΛΑΧΑΚΗ | C51: ΓΕΩΡΓΙΑ - ΙΟΥΛΙΑ | D51: 15 | F51: 12 | G51: 6.4 | I51: =((D51+E51+F51)/10+G51*0.55) *IF(H51=1,1.1,1) -> 6.22 | J51: =IF(I51>0,ROUND(2*I51,0)/2,"") -> 6
A52: 511/2004008 | B52: ΓΕΩΡΓΑΛΑ | C52: ΑΡΤΕΜΙΣ | D52: 14 | F52: 9 | G52: 3.2 | I52: =((D52+E52+F52)/10+G52*0.55) *IF(H52=1,1.1,1) -> 4.06 | J52: =IF(I52>0,ROUND(2*I52,0)/2,"") -> 4
A53: 511/2004009 | B53: ΓΙΩΤΑ | C53: ΓΕΩΡΓΙΑ | I53: =((D53+E53+F53)/10+G53*0.55) *IF(H53=1,1.1,1) -> 0 | J53: =IF(I53>0,ROUND(2*I53,0)/2,"") -> 
A54: 511/2004010 | B54: ΓΩΓΟΣ | C54: ΔΗΜΗΤΡΙΟΣ | I54: =((D54+E54+F54)/10+G54*0.55) *IF(H54=1,1.1,1) -> 0 | J54: =IF(I54>0,ROUND(2*I54,0)/2,"") -> 
A55: 511/2004013 | B55: ΚΑΚΛΙΔΗ | C55: ΑΝΤΙΓΟΝΗ | D55: 14 | E55: 10 | F55: 14 | G55: 4.4 | I55: =((D55+E55+F55)/10+G55*0.55) *IF(H55=1,1.1,1) -> 6.22 | J55: =IF(I55>0,ROUND(2*I55,0)/2,"") -> 6
A56: 511/2004014 | B56: ΚΑΛΟΖΟΥΜΗ | C56: ΜΑΡΙΑ | D56: 13 | I56: =((D56+E56+F56)/10+G56*0.55) *IF(H56=1,1.1,1) -> 1.3 | J56: =IF(I56>0,ROUND(2*I56,0)/2,"") -> 1.5
A57: 511/2004015 | B57: ΚΑΝΗΣ | C57: ΣΥΜΕΩΝ | I57: =((D57+E57+F57)/10+G57*0.55) *IF(H57=1,1.1,1) -> 0 | J57: =IF(I57>0,ROUND(2*I57,0)/2,"") -> 
A58: 511/2004018 | B58: ΚΙΤΣΑΚΗΣ | C58: ΒΑΙΟΣ | I58: =((D58+E58+F58)/10+G58*0.55) *IF(H58=1,1.1,1) -> 0 | J58: =IF(I58>0,ROUND(2*I58,0)/2,"") -> 
A59: 511/2004022 | B59: ΚΟΥΝΑΔΗΣ | C59: ΚΩΝΣΤΑΝΤΙΝΟΣ | D59: 14 | E59: 19 | F59: 15 | G59: 7.1 | I59: =((D59+E59+F59)/10+G59*0.55) *IF(H59=1,1.1,1) -> 8.7050000000000001 | J59: =IF(I59>0,ROUND(2*I59,0)/2,"") -> 8.5
A60: 511/2004023 | B60: ΚΡΗΤΙΚΑΚΗΣ | C60: ΒΑΣΙΛΕΙΟΣ | D60: 15 | E60: 18 | G60: 1.5 | I60: =((D60+E60+F60)/10+G60*0.55) *IF(H60=1,1.1,1) -> 4.125 | J60: =IF(I60>0,ROUND(2*I60,0)/2,"") -> 4
A61: 511/2004027 | B61: ΛΥΚΟΥ | C61: ΒΕΡΟΝΙΚΑ | D61: 15 | E61: 13 | F61: 14 | G61: 3.3 | I61: =((D61+E61+F61)/10+G61*0.55) *IF(H61=1,1.1,1) -> 6.0149999999999997 | J61: =IF(I61>0,ROUND(2*I61,0)/2,"") -> 6
A62: 511/2004031 | B62: ΝΤΕΡΡ | C62: ΚΟΡΙΝΑ | D62: 14 | E62: 17 | F62: 12 | G62: 6.3 | H62: 1 | I62: =((D62+E62+F62)/10+G62*0.55) *IF(H62=1,1.1,1) -> 8.541500000000001 | J62: =IF(I62>0,ROUND(2*I62,0)/2,"") -> 8.5
A63: 511/2004034 | B63: ΠΑΝΤΑΖΗ | C63: ΑΝΘΟΥΛΑ | D63: 9 | E63: 6 | F63: 8 | G63: 2.4 | I63: =((D63+E63+F63)/10+G63*0.55) *IF(H63=1,1.1,1) -> 3.62 | J63: =IF(I63>0,ROUND(2*I63,0)/2,"") -> 3.5
A64: 511/2004035 | B64: ΠΑΠΑΔΗΜΗΤΡΙΟΥ | C64: ΓΕΩΡΓΙΑ | I64: =((D64+E64+F64)/10+G64*0.55) *IF(H64=1,1.1,1) -> 0 | J64: =IF(I64>0,ROUND(2*I64,0)/2,"") -> 
A65: 511/2004037 | B65: ΠΑΡΑΣΧΟΣ | C65: ΙΩΑΝΝΗΣ | I65: =((D65+E65+F65)/10+G65*0.55) *IF(H65=1,1.1,1) -> 0 | J65: =IF(I65>0,ROUND(2*I65,0)/2,"") -> 
A66: 511/2004042 | B66: ΠΛΑΚΟΠΟΥΛΟΣ | C66: ΕΥΣΤΑΘΙΟΣ | D66: 13 | I66: =((D66+E66+F66)/10+G66*0.55) *IF(H66=1,1.1,1) -> 1.3 | J66: =IF(I66>0,ROUND(2*I66,0)/2,"") -> 1.5
A67: 511/2004050 | B67: ΣΠΑΝΙΔΟΥ | C67: ΗΛΙΑΝΝΑ | I67: =((D67+E67+F67)/10+G67*0.55) *IF(H67=1,1.1,1) -> 0 | J67: =IF(I67>0,ROUND(2*I67,0)/2,"") -> 
A68: 511/2004054 | B68: ΤΣΑΚΩΝΑΣ | C68: ΙΩΑΝΝΗΣ | I68: =((D68+E68+F68)/10+G68*0.55) *IF(H68=1,1.1,1) -> 0 | J68: =IF(I68>0,ROUND(2*I68,0)/2,"") -> 
A69: 511/2004059 | B69: ΧΑΣΑΝΙΔΟΥ | C69: ΑΛΕΞΑΝΔΡΑ | D69: 8 | F69: 13 | G69: 2 | I69: =((D69+E69+F69)/10+G69*0.55) *IF(H69=1,1.1,1) -> 3.2 | J69: =IF(I69>0,ROUND(2*I69,0)/2,"") -> 3
A70: 511/2004068 | B70: ΖΗΣΙΜΟΠΟΥΛΟΥ | C70: ΕΙΡΗΝΗ - ΘΕΑΝΩ | F70: 13 | I70: =((D70+E70+F70)/10+G70*0.55) *IF(H70=1,1.1,1) -> 1.3 | J70: =IF(I70>0,ROUND(2*I70,0)/2,"") -> 1.5
A71: 511/2005003 | B71: ΒΑΣΙΛΟΠΟΥΛΟΥ | C71: ΔΗΜΗΤΡΑ | D71: 14 | E71: 7 | F71: 4 | G71: 7 | I71: =((D71+E71+F71)/10+G71*0.55) *IF(H71=1,1.1,1) -> 6.35 | J71: =IF(I71>0,ROUND(2*I71,0)/2,"") -> 6.5
A72: 511/2005006 | B72: ΓΟΡΓΟΓΙΑΝΝΗ | C72: ΚΩΝΣΤΑΝΤΙΝΑ | D72: 8 | E72: 13 | F72: 9 | G72: 3.3 | I72: =((D72+E72+F72)/10+G72*0.55) *IF(H72=1,1.1,1) -> 4.8150000000000004 | J72: =IF(I72>0,ROUND(2*I72,0)/2,"") -> 5
A73: 511/2005012 | B73: ΚΑΠΡΑΛΟΣ | C73: ΛΕΩΝΙΔΑΣ | D73: 13 | E73: 10 | G73: 5.8 | I73: =((D73+E73+F73)/10+G73*0.55) *IF(H73=1,1.1,1) -> 5.49 | J73: =IF(I73>0,ROUND(2*I73,0)/2,"") -> 5.5
A74: 511/2005020 | B74: ΛΑΤΙΝΟΣ | C74: ΘΩΜΑΣ | D74: 15 | I74: =((D74+E74+F74)/10+G74*0.55) *IF(H74=1,1.1,1) -> 1.5 | J74: =IF(I74>0,ROUND(2*I74,0)/2,"") -> 1.5
A75: 511/2005021 | B75: ΛΕΝΤΖΑ | C75: ΝΙΚΟΛΙΝΑ | D75: 13 | E75: 14 | F75: 8 | G75: 7.2 | I75: =((D75+E75+F75)/10+G75*0.55) *IF(H75=1,1.1,1) -> 7.46 | J75: =IF(I75>0,ROUND(2*I75,0)/2,"") -> 7.5
A76: 511/2005027 | B76: ΜΠΑΣΙΑ | C76: ΜΑΡΙΑ | D76: 15 | E76: 15 | F76: 9 | G76: 5.3 | I76: =((D76+E76+F76)/10+G76*0.55) *IF(H76=1,1.1,1) -> 6.8150000000000004 | J76: =IF(I76>0,ROUND(2*I76,0)/2,"") -> 7
A77: 511/2005029 | B77: ΜΠΟΦΥΛΑΤΟΣ | C77: ΣΠΥΡΙΔΩΝ | D77: 14 | E77: 14 | F77: 6 | G77: 3.8 | H77: 1 | I77: =((D77+E77+F77)/10+G77*0.55) *IF(H77=1,1.1,1) -> 6.0390000000000006 | J77: =IF(I77>0,ROUND(2*I77,0)/2,"") -> 6
A78: 511/2005035 | B78: ΟΡΦΑΝΟΥΔΑΚΗ | C78: ΑΙΚΑΤΕΡΙΝΗ | I78: =((D78+E78+F78)/10+G78*0.55) *IF(H78=1,1.1,1) -> 0 | J78: =IF(I78>0,ROUND(2*I78,0)/2,"") -> 
A79: 511/2005039 | B79: ΡΑΥΤΟΠΟΥΛΟΥ | C79: ΜΑΡΙΑΝΘΗ | D79: 10 | E79: 7 | F79: 4 | G79: 6.6 | I79: =((D79+E79+F79)/10+G79*0.55) *IF(H79=1,1.1,1) -> 5.73 | J79: =IF(I79>0,ROUND(2*I79,0)/2,"") -> 5.5
A80: 511/2005040 | B80: ΣΑΒΒΟΠΟΥΛΟΣ | C80: ΘΩΜΑΣ | D80: 13 | E80: 11 | F80: 9 | G80: 5.1 | I80: =((D80+E80+F80)/10+G80*0.55) *IF(H80=1,1.1,1) -> 6.1050000000000004 | J80: =IF(I80>0,ROUND(2*I80,0)/2,"") -> 6
A81: 511/2005047 | B81: ΤΖΟΥΜΕΡΚΙΩΤΗ | C81: ΒΑΣΙΛΙΚΗ | D81: 11 | E81: 17 | F81: 8 | G81: 6.1 | I81: =((D81+E81+F81)/10+G81*0.55) *IF(H81=1,1.1,1) -> 6.9550000000000001 | J81: =IF(I81>0,ROUND(2*I81,0)/2,"") -> 7
A82: 511/2005050 | B82: ΤΣΕΡΚΕΖΗ | C82: ΧΡΙΣΤΙΝΑ | I82: =((D82+E82+F82)/10+G82*0.55) *IF(H82=1,1.1,1) -> 0 | J82: =IF(I82>0,ROUND(2*I82,0)/2,"") -> 
A83: 511/2005051 | B83: ΦΩΚΑΣ | C83: ΕΥΘΥΜΙΟΣ | D83: 11 | E83: 3 | G83: 2.4 | I83: =((D83+E83+F83)/10+G83*0.55) *IF(H83=1,1.1,1) -> 2.72 | J83: =IF(I83>0,ROUND(2*I83,0)/2,"") -> 2.5
A84: 511/2005052 | B84: ΧΑΛΑΣ | C84: ΓΕΩΡΓΙΟΣ | D84: 14 | E84: 20 | F84: 14 | G84: 8.4 | I84: =((D84+E84+F84)/10+G84*0.55) *IF(H84=1,1.1,1) -> 9.42 | J84: =IF(I84>0,ROUND(2*I84,0)/2,"") -> 9.5
A85: 511/2005067 | B85: ΠΙΤΑΟΥΛΗ | C85: ΕΙΡΗΝΗ | D85: 14 | E85: 18 | F85: 13 | G85: 7 | I85: =((D85+E85+F85)/10+G85*0.55) *IF(H85=1,1.1,1) -> 8.35 | J85: =IF(I85>0,ROUND(2*I85,0)/2,"") -> 8.5
A86: 511/2006002 | B86: ΑΝΤΩΝΕΛΛΗ | C86: ΕΥΑΓΓΕΛΙΑ | D86: 13 | I86: =((D86+E86+F86)/10+G86*0.55) *IF(H86=1,1.1,1) -> 1.3 | J86: =IF(I86>0,ROUND(2*I86,0)/2,"") -> 1.5
A87: 511/2006004 | B87: ΑΡΓΥΡΗΣ | C87: ΑΝΤΩΝΙΟΣ | I87: =((D87+E87+F87)/10+G87*0.55) *IF(H87=1,1.1,1) -> 0 | J87: =IF(I87>0,ROUND(2*I87,0)/2,"") -> 
A88: 511/2006005 | B88: ΑΡΚΟΥΔΑΚΗ | C88: ΣΟΦΙΑ | D88: 13 | E88: 14 | F88: 7 | G88: 6.5 | H88: 1 | I88: =((D88+E88+F88)/10+G88*0.55) *IF(H88=1,1.1,1) -> 7.6725000000000003 | J88: =IF(I88>0,ROUND(2*I88,0)/2,"") -> 7.5
A89: 511/2006006 | B89: ΑΡΚΟΥΔΑΡΗ | C89: ΔΗΜΗΤΡΑ | I89: =((D89+E89+F89)/10+G89*0.55) *IF(H89=1,1.1,1) -> 0 | J89: =IF(I89>0,ROUND(2*I89,0)/2,"") -> 
A90: 511/2006007 | B90: ΒΑΓΙΑΚΟΥ | C90: ΓΙΑΣΕΜΗ | D90: 11 | E90: 5 | F90: 4 | G90: 5.4 | I90: =((D90+E90+F90)/10+G90*0.55) *IF(H90=1,1.1,1) -> 4.97 | J90: =IF(I90>0,ROUND(2*I90,0)/2,"") -> 5
A91: 511/2006008 | B91: ΒΑΣΙΛΕΙΟΥ | C91: ΣΤΑΥΡΟΥΛΑ | E91: 7 | G91: 3 | H91: 1 | I91: =((D91+E91+F91)/10+G91*0.55) *IF(H91=1,1.1,1) -> 2.585 | J91: =IF(I91>0,ROUND(2*I91,0)/2,"") -> 2.5
A92: 511/2006009 | B92: ΒΑΣΙΛΟΣ | C92: ΘΩΜΑΣ | I92: =((D92+E92+F92)/10+G92*0.55) *IF(H92=1,1.1,1) -> 0 | J92: =IF(I92>0,ROUND(2*I92,0)/2,"") -> 
A93: 511/2006012 | B93: ΒΛΑΣΣΟΠΟΥΛΟΥ | C93: ΑΙΚΑΤΕΡΙΝΗ | I93: =((D93+E93+F93)/10+G93*0.55) *IF(H93=1,1.1,1) -> 0 | J93: =IF(I93>0,ROUND(2*I93,0)/2,"") -> 
A94: 511/2006013 | B94: ΓΕΩΡΓΙΟΥ | C94: ΒΑΣΙΛΙΚΗ | I94: =((D94+E94+F94)/10+G94*0.55) *IF(H94=1,1.1,1) -> 0 | J94: =IF(I94>0,ROUND(2*I94,0)/2,"") -> 
A95: 511/2006014 | B95: ΓΕΩΡΝΤΑΜΙΛΗΣ | C95: ΜΑΡΙΟΣ | I95: =((D95+E95+F95)/10+G95*0.55) *IF(H95=1,1.1,1) -> 0 | J95: =IF(I95>0,ROUND(2*I95,0)/2,"") -> 
A96: 511/2006017 | B96: ΘΩΜΑ | C96: ΕΛΕΝΗ | I96: =((D96+E96+F96)/10+G96*0.55) *IF(H96=1,1.1,1) -> 0 | J96: =IF(I96>0,ROUND(2*I96,0)/2,"") -> 
A97: 511/2006018 | B97: ΚΑΛΟΜΟΙΡΗ | C97: ΑΘΗΝΑ | I97: =((D97+E97+F97)/10+G97*0.55) *IF(H97=1,1.1,1) -> 0 | J97: =IF(I97>0,ROUND(2*I97,0)/2,"") -> 
A98: 511/2006019 | B98: ΚΑΠΕΡΩΝΗ | C98: ΕΥΘΥΜΙΑ | I98: =((D98+E98+F98)/10+G98*0.55) *IF(H98=1,1.1,1) -> 0 | J98: =IF(I98>0,ROUND(2*I98,0)/2,"") -> 
A99: 511/2006022 | B99: ΚΑΤΡΑΝΙΔΗΣ | C99: ΒΑΣΙΛΕΙΟΣ | I99: =((D99+E99+F99)/10+G99*0.55) *IF(H99=1,1.1,1) -> 0 | J99: =IF(I99>0,ROUND(2*I99,0)/2,"") -> 
A100: 511/2006023 | B100: ΚΑΤΣΑΝΑΚΗΣ | C100: ΙΩΑΝΝΗΣ | I100: =((D100+E100+F100)/10+G100*0.55) *IF(H100=1,1.1,1) -> 0 | J100: =IF(I100>0,ROUND(2*I100,0)/2,"") -> 
A101: 511/2006024 | B101: ΚΟΝΣΟΛΙΔΗΣ | C101: ΓΕΩΡΓΙΟΣ | I101: =((D101+E101+F101)/10+G101*0.55) *IF(H101=1,1.1,1) -> 0 | J101: =IF(I101>0,ROUND(2*I101,0)/2,"") -> 
A102: 511/2006025 | B102: ΚΟΝΤΑΚΗΣ | C102: ΠΕΤΡΟΣ | I102: =((D102+E102+F102)/10+G102*0.55) *IF(H102=1,1.1,1) -> 0 | J102: =IF(I102>0,ROUND(2*I102,0)/2,"") -> 
A103: 511/2006026 | B103: ΛΑΜΠΡΙΔΗΣ | C103: ΚΩΝΣΤΑΝΤΙΝΟΣ | I103: =((D103+E103+F103)/10+G103*0.55) *IF(H103=1,1.1,1) -> 0 | J103: =IF(I103>0,ROUND(2*I103,0)/2,"") -> 
A104: 511/2006027 | B104: ΛΕΚΑΤΗ | C104: ΑΙΚΑΤΕΡΙΝΗ | I104: =((D104+E104+F104)/10+G104*0.55) *IF(H104=1,1.1,1) -> 0 | J104: =IF(I104>0,ROUND(2*I104,0)/2,"") -> 
A105: 511/2006028 | B105: ΛΟΜΠΟΤΕΣΗ | C105: ΠΗΓΗ | D105: 11 | E105: 9 | F105: 7 | G105: 6.1 | I105: =((D105+E105+F105)/10+G105*0.55) *IF(H105=1,1.1,1) -> 6.0549999999999997 | J105: =IF(I105>0,ROUND(2*I105,0)/2,"") -> 6
A106: 511/2006029 | B106: ΜΑΡΚΑΚΗΣ | C106: ΙΩΑΝΝΗΣ | D106: 15 | E106: 7 | F106: 4 | G106: 5.6 | I106: =((D106+E106+F106)/10+G106*0.55) *IF(H106=1,1.1,1) -> 5.68 | J106: =IF(I106>0,ROUND(2*I106,0)/2,"") -> 5.5
A107: 511/2006031 | B107: ΜΙΧΟΠΟΥΛΟΥ | C107: ΕΛΕΝΗ | I107: =((D107+E107+F107)/10+G107*0.55) *IF(H107=1,1.1,1) -> 0 | J107: =IF(I107>0,ROUND(2*I107,0)/2,"") -> 
A108: 511/2006032 | B108: ΜΩΡΑΚΗΣ | C108: ΔΗΜΗΤΡΙΟΣ | I108: =((D108+E108+F108)/10+G108*0.55) *IF(H108=1,1.1,1) -> 0 | J108: =IF(I108>0,ROUND(2*I108,0)/2,"") -> 
A109: 511/2006033 | B109: ΠΑΝΟΥΣΙΕΡΗ | C109: ΑΡΤΕΜΙΣ | I109: =((D109+E109+F109)/10+G109*0.55) *IF(H109=1,1.1,1) -> 0 | J109: =IF(I109>0,ROUND(2*I109,0)/2,"") -> 
A110: 511/2006034 | B110: ΠΑΠΑΓΕΩΡΓΙΟΥ | C110: ΑΛΚΗΣΤΙΣ | D110: 10 | I110: =((D110+E110+F110)/10+G110*0.55) *IF(H110=1,1.1,1) -> 1 | J110: =IF(I110>0,ROUND(2*I110,0)/2,"") -> 1
A111: 511/2006037 | B111: ΠΑΠΠΑ | C111: ΜΑΡΙΑΝΝΑ | D111: 13 | E111: 7 | F111: 8 | G111: 8.1 | I111: =((D111+E111+F111)/10+G111*0.55) *IF(H111=1,1.1,1) -> 7.2549999999999999 | J111: =IF(I111>0,ROUND(2*I111,0)/2,"") -> 7.5
A112: 511/2006038 | B112: ΠΕΤΑΛΟΥΔΗΣ | C112: ΠΑΝΑΓΙΩΤΗΣ | H112: 1 | I112: =((D112+E112+F112)/10+G112*0.55) *IF(H112=1,1.1,1) -> 0 | J112: =IF(I112>0,ROUND(2*I112,0)/2,"") -> 
A113: 511/2006039 | B113: ΠΕΤΚΙΔΗΣ | C113: ΧΡΗΣΤΟΣ | I113: =((D113+E113+F113)/10+G113*0.55) *IF(H113=1,1.1,1) -> 0 | J113: =IF(I113>0,ROUND(2*I113,0)/2,"") -> 
A114: 511/2006042 | B114: ΣΑΧΝΙΚΑΣ | C114: ΝΙΚΟΛΑΟΣ-ΜΗΝΑΣ | E114: 6 | G114: 4 | H114: 1 | I114: =((D114+E114+F114)/10+G114*0.55) *IF(H114=1,1.1,1) -> 3.08 | J114: =IF(I114>0,ROUND(2*I114,0)/2,"") -> 3
A115: 511/2006043 | B115: ΣΚΑΝΔΑΛΗΣ | C115: ΒΑΣΙΛΕΙΟΣ | I115: =((D115+E115+F115)/10+G115*0.55) *IF(H115=1,1.1,1) -> 0 | J115: =IF(I115>0,ROUND(2*I115,0)/2,"") -> 
A116: 511/2006044 | B116: ΣΟΥΡΛΑΝΤΖΗ | C116: ΔΗΜΗΤΡΑ | D116: 10 | I116: =((D116+E116+F116)/10+G116*0.55) *IF(H116=1,1.1,1) -> 1 | J116: =IF(I116>0,ROUND(2*I116,0)/2,"") -> 1
A117: 511/2006045 | B117: ΣΤΑΜΑΤΗΣ | C117: ΔΗΜΗΤΡΙΟΣ | D117: 15 | G117: 5.1 | H117: 1 | I117: =((D117+E117+F117)/10+G117*0.55) *IF(H117=1,1.1,1) -> 4.7355 | J117: =IF(I117>0,ROUND(2*I117,0)/2,"") -> 4.5
A118: 511/2006046 | B118: ΤΣΑΓΚΟΣ | C118: ΔΗΜΗΤΡΙΟΣ | D118: 7 | I118: =((D118+E118+F118)/10+G118*0.55) *IF(H118=1,1.1,1) -> 0.7 | J118: =IF(I118>0,ROUND(2*I118,0)/2,"") -> 0.5
A119: 511/2006047 | B119: ΤΣΑΜΠΙΚΑΚΗΣ | C119: ΕΛΕΥΘΕΡΙΟΣ | D119: 7 | I119: =((D119+E119+F119)/10+G119*0.55) *IF(H119=1,1.1,1) -> 0.7 | J119: =IF(I119>0,ROUND(2*I119,0)/2,"") -> 0.5
A120: 511/2006048 | B120: ΤΣΑΝΤΗΡΑΚΗ | C120: ΕΥΑΓΓΕΛΙΑ | D120: 11 | E120: 6 | I120: =((D120+E120+F120)/10+G120*0.55) *IF(H120=1,1.1,1) -> 1.7 | J120: =IF(I120>0,ROUND(2*I120,0)/2,"") -> 1.5
A121: 511/2006050 | B121: ΤΣΙΡΟΖΙΔΗΣ | C121: ΚΩΝΣΤΑΝΤΙΝΟΣ | D121: 9 | E121: 19 | G121: 4.7 | I121: =((D121+E121+F121)/10+G121*0.55) *IF(H121=1,1.1,1) -> 5.3849999999999998 | J121: =IF(I121>0,ROUND(2*I121,0)/2,"") -> 5.5
A122: 511/2006051 | B122: ΤΣΟΥΝΗ | C122: ΔΑΝΑΗ | I122: =((D122+E122+F122)/10+G122*0.55) *IF(H122=1,1.1,1) -> 0 | J122: =IF(I122>0,ROUND(2*I122,0)/2,"") -> 
A123: 511/2006052 | B123: ΤΣΟΥΠΡΑ | C123: ΑΓΓΕΛΙΚΗ | I123: =((D123+E123+F123)/10+G123*0.55) *IF(H123=1,1.1,1) -> 0 | J123: =IF(I123>0,ROUND(2*I123,0)/2,"") -> 
A124: 511/2006053 | B124: ΦΕΛΟΥΤΖΗ | C124: ΧΡΙΣΤΙΝΑ | I124: =((D124+E124+F124)/10+G124*0.55) *IF(H124=1,1.1,1) -> 0 | J124: =IF(I124>0,ROUND(2*I124,0)/2,"") -> 
A125: 511/2006055 | B125: ΦΡΑΓΚΟΥΛΗ | C125: ΑΡΓΥΡΩ | I125: =((D125+E125+F125)/10+G125*0.55) *IF(H125=1,1.1,1) -> 0 | J125: =IF(I125>0,ROUND(2*I125,0)/2,"") -> 
A126: 511/2006057 | B126: ΧΑΣΑΠΟΠΟΥΛΟΥ | C126: ΗΡΩ | I126: =((D126+E126+F126)/10+G126*0.55) *IF(H126=1,1.1,1) -> 0 | J126: =IF(I126>0,ROUND(2*I126,0)/2,"") -> 
A127: 511/2006058 | B127: ΧΑΤΖΗΛΙΑΣ | C127: ΝΙΚΟΛΑΟΣ | I127: =((D127+E127+F127)/10+G127*0.55) *IF(H127=1,1.1,1) -> 0 | J127: =IF(I127>0,ROUND(2*I127,0)/2,"") -> 
A128: 511/2006059 | B128: ΧΑΤΖΟΠΟΥΛΟΥ | C128: ΕΙΡΗΝΗ | I128: =((D128+E128+F128)/10+G128*0.55) *IF(H128=1,1.1,1) -> 0 | J128: =IF(I128>0,ROUND(2*I128,0)/2,"") -> 
A129: 511/2006063 | B129: ΕΥΑΓΓΕΛΟΥ | C129: ΦΙΛΙΠΠΟΣ | D129: 15 | E129: 12 | G129: 3.4 | I129: =((D129+E129+F129)/10+G129*0.55) *IF(H129=1,1.1,1) -> 4.57 | J129: =IF(I129>0,ROUND(2*I129,0)/2,"") -> 4.5
A130: 511/2006065 | B130: ΤΖΙΟΒΑ | C130: ΠΑΝΑΓΙΩΤΑ | D130: 14 | E130: 15 | F130: 14 | G130: 3.9 | I130: =((D130+E130+F130)/10+G130*0.55) *IF(H130=1,1.1,1) -> 6.4450000000000003 | J130: =IF(I130>0,ROUND(2*I130,0)/2,"") -> 6.5
A131: Αθροισμα | B131: ΑΘΡΟΙΣΜΑ | D131: =SUM(D6:D130) -> 767 | E131: =SUM(E6:E130) -> 556 | F131: =SUM(F6:F130) -> 375 | G131: =SUM(G6:G130) -> 274.6 | H131: =SUM(H6:H130) -> 7 | I131: =SUM(I6:I130) -> 323.79850000000005 | J131: =SUM(J6:J130) -> 323
A132: Πλήθος | B132: ΠΛΗΘΟΣ | D132: =COUNT(D6:D130) -> 61 | E132: =COUNT(E6:E130) -> 47 | F132: =COUNT(F6:F130) -> 42 | G132: =COUNT(G6:G130) -> 54 | H132: =COUNT(H6:H130) -> 7 | I132: =COUNTIF(I6:I130,">0") -> 69 | J132: =COUNTIF(J6:J130,">0") -> 69
A133: Μέσος όρος | B133: ΜΕΣΟΣ ΟΡΟΣ | D133: =D131/D132 -> 12.573770491803279 | E133: =E131/E132 -> 11.829787234042554 | F133: =F131/F132 -> 8.9285714285714288 | G133: =G131/G132 -> 5.0851851851851855 | I133: =I131/I132 -> 4.6927318840579719 | J133: =J131/J132 -> 4.6811594202898554
A134: Επιτυχόντες | J134: =COUNTIF(J6:J130,">=5") -> 42
A135: Ποσοστό επιτυχίας | J135: =J134/J132 -> 0.60869565217391308