A1: Έκδοση 12 | B1: ΕΞΕΤΑΣΤΙΚΗ ΙΟΥΛΙΟΥ
A3: ΑΜ | B3: Πρωτη | C3: Δευτερη | D3: Τριτη | E3: Διαγωνισμα | F3: Πριμ | G3: Τελικος | H3: Γραμματεια
B4: 0.15 | C4: 0.15 | D4: 0.15 | E4: 0.55 | F4: 0.1 | G4: 1 | H4: Στρογγυλ
A5: 511/2000002 | B5: 1.05 | C5: 0 | D5: 0 | E5: 3.2 | G5: =IF(F5="ΝΑΙ",1.1,1)*(B5+C5+D5+$E$4*E5) -> 2.81 | H5: =ROUND(2*G5,0)/2 -> 3
A6: 511/2000005 | B6: 0.8 | C6: 0 | D6: 0 | E6: 3.2 | G6: =IF(F6="ΝΑΙ",1.1,1)*(B6+C6+D6+$E$4*E6) -> 2.56 | H6: =ROUND(2*G6,0)/2 -> 2.5
A7: 511/2000020 | C7: 0 | D7: 0 | G7: =IF(F7="ΝΑΙ",1.1,1)*(B7+C7+D7+$E$4*E7) -> 0 | H7: =ROUND(2*G7,0)/2 -> 0
A8: 511/2000031 | B8: 0.5 | C8: 0.2 | D8: 0 | G8: =IF(F8="ΝΑΙ",1.1,1)*(B8+C8+D8+$E$4*E8) -> 0.7 | H8: =ROUND(2*G8,0)/2 -> 0.5
A9: 511/2000033 | C9: 0 | D9: 0 | G9: =IF(F9="ΝΑΙ",1.1,1)*(B9+C9+D9+$E$4*E9) -> 0 | H9: =ROUND(2*G9,0)/2 -> 0
A10: 511/2000035 | C10: 0 | D10: 0 | G10: =IF(F10="ΝΑΙ",1.1,1)*(B10+C10+D10+$E$4*E10) -> 0 | H10: =ROUND(2*G10,0)/2 -> 0
A11: 511/2000037 | B11: 1.2 | C11: 0 | D11: 0 | E11: 3.5 | G11: =IF(F11="ΝΑΙ",1.1,1)*(B11+C11+D11+$E$4*E11) -> 3.125 | H11: =ROUND(2*G11,0)/2 -> 3
A12: 511/2000039 | C12: 0 | D12: 0 | G12: =IF(F12="ΝΑΙ",1.1,1)*(B12+C12+D12+$E$4*E12) -> 0 | H12: =ROUND(2*G12,0)/2 -> 0
A13: 511/2000043 | C13: 0.2 | D13: 0 | E13: 2.6 | G13: =IF(F13="ΝΑΙ",1.1,1)*(B13+C13+D13+$E$4*E13) -> 1.63 | H13: =ROUND(2*G13,0)/2 -> 1.5
A14: 511/2000044 | B14: 1.2 | C14: 1.05 | D14: 1.5 | E14: 2.3 | G14: =IF(F14="ΝΑΙ",1.1,1)*(B14+C14+D14+$E$4*E14) -> 5.0149999999999997 | H14: =ROUND(2*G14,0)/2 -> 5
A15: 511/2000053 | C15: 0.4 | D15: 0 | E15: 1.3 | G15: =IF(F15="ΝΑΙ",1.1,1)*(B15+C15+D15+$E$4*E15) -> 1.115 | H15: =ROUND(2*G15,0)/2 -> 1
A16: 511/2000061 | C16: 0 | D16: 0 | G16: =IF(F16="ΝΑΙ",1.1,1)*(B16+C16+D16+$E$4*E16) -> 0 | H16: =ROUND(2*G16,0)/2 -> 0
A17: 511/2000066 | C17: 0 | D17: 0 | G17: =IF(F17="ΝΑΙ",1.1,1)*(B17+C17+D17+$E$4*E17) -> 0 | H17: =ROUND(2*G17,0)/2 -> 0
A18: 511/2000071 | C18: 0 | D18: 0 | G18: =IF(F18="ΝΑΙ",1.1,1)*(B18+C18+D18+$E$4*E18) -> 0 | H18: =ROUND(2*G18,0)/2 -> 0
A19: 511/2000077 | C19: 0 | D19: 0 | G19: =IF(F19="ΝΑΙ",1.1,1)*(B19+C19+D19+$E$4*E19) -> 0 | H19: =ROUND(2*G19,0)/2 -> 0
A20: 511/2000083 | B20: 1 | C20: 0.6 | D20: 0 | E20: 5.9 | G20: =IF(F20="ΝΑΙ",1.1,1)*(B20+C20+D20+$E$4*E20) -> 4.8449999999999998 | H20: =ROUND(2*G20,0)/2 -> 5
A21: 511/2001003 | B21: 1.4 | C21: 0 | D21: 0 | G21: =IF(F21="ΝΑΙ",1.1,1)*(B21+C21+D21+$E$4*E21) -> 1.4 | H21: =ROUND(2*G21,0)/2 -> 1.5
A22: 511/2001012 | C22: 0 | D22: 0 | G22: =IF(F22="ΝΑΙ",1.1,1)*(B22+C22+D22+$E$4*E22) -> 0 | H22: =ROUND(2*G22,0)/2 -> 0
A23: 511/2001019 | C23: 0 | D23: 0 | G23: =IF(F23="ΝΑΙ",1.1,1)*(B23+C23+D23+$E$4*E23) -> 0 | H23: =ROUND(2*G23,0)/2 -> 0
A24: 511/2001026 | B24: 0 | C24: 0 | D24: 0 | G24: =IF(F24="ΝΑΙ",1.1,1)*(B24+C24+D24+$E$4*E24) -> 0 | H24: =ROUND(2*G24,0)/2 -> 0
A25: 511/2001034 | B25: 1.2 | C25: 1.05 | D25: 0.9 | E25: 4.5 | G25: =IF(F25="ΝΑΙ",1.1,1)*(B25+C25+D25+$E$4*E25) -> 5.625 | H25: =ROUND(2*G25,0)/2 -> 5.5
A26: 511/2001037 | B26: 1 | C26: 0.5 | D26: 1.35 | E26: 4.9 | G26: =IF(F26="ΝΑΙ",1.1,1)*(B26+C26+D26+$E$4*E26) -> 5.5449999999999999 | H26: =ROUND(2*G26,0)/2 -> 5.5
A27: 511/2001049 | C27: 0.6 | D27: 0 | E27: 2.3 | G27: =IF(F27="ΝΑΙ",1.1,1)*(B27+C27+D27+$E$4*E27) -> 1.865 | H27: =ROUND(2*G27,0)/2 -> 2
A28: 511/2001051 | B28: 0.8 | C28: 0.75 | D28: 0.5 | E28: 2.8 | G28: =IF(F28="ΝΑΙ",1.1,1)*(B28+C28+D28+$E$4*E28) -> 3.59 | H28: =ROUND(2*G28,0)/2 -> 3.5
A29: 511/2001053 | B29: 0.7 | C29: 0.6 | D29: 0.3 | E29: 4.2 | G29: =IF(F29="ΝΑΙ",1.1,1)*(B29+C29+D29+$E$4*E29) -> 3.91 | H29: =ROUND(2*G29,0)/2 -> 4
A30: 511/2001062 | B30: 1.2 | C30: 1.2 | D30: 0 | E30: 6.1 | G30: =IF(F30="ΝΑΙ",1.1,1)*(B30+C30+D30+$E$4*E30) -> 5.7549999999999999 | H30: =ROUND(2*G30,0)/2 -> 6
A31: 511/2001067 | B31: 0.7 | C31: 0 | D31: 0 | G31: =IF(F31="ΝΑΙ",1.1,1)*(B31+C31+D31+$E$4*E31) -> 0.7 | H31: =ROUND(2*G31,0)/2 -> 0.5
A32: 511/2001068 | B32: 1.35 | C32: 1.5 | D32: 1.05 | E32: 3.9 | G32: =IF(F32="ΝΑΙ",1.1,1)*(B32+C32+D32+$E$4*E32) -> 6.0449999999999999 | H32: =ROUND(2*G32,0)/2 -> 6
A33: 511/2001069 | B33: 1.2 | C33: 0 | D33: 0.2 | E33: 5 | G33: =IF(F33="ΝΑΙ",1.1,1)*(B33+C33+D33+$E$4*E33) -> 4.15 | H33: =ROUND(2*G33,0)/2 -> 4
A34: 511/2001075 | C34: 0 | D34: 0 | G34: =IF(F34="ΝΑΙ",1.1,1)*(B34+C34+D34+$E$4*E34) -> 0 | H34: =ROUND(2*G34,0)/2 -> 0
A35: 511/2002019 | B35: 0.8 | C35: 0 | D35: 0 | G35: =IF(F35="ΝΑΙ",1.1,1)*(B35+C35+D35+$E$4*E35) -> 0.8 | H35: =ROUND(2*G35,0)/2 -> 1
A36: 511/2002022 | B36: 1 | C36: 1.1 | D36: 0 | E36: 2 | G36: =IF(F36="ΝΑΙ",1.1,1)*(B36+C36+D36+$E$4*E36) -> 3.2 | H36: =ROUND(2*G36,0)/2 -> 3
A37: 511/2002026 | B37: 1.3 | C37: 1.5 | D37: 0 | E37: 8.9 | G37: =IF(F37="ΝΑΙ",1.1,1)*(B37+C37+D37+$E$4*E37) -> 7.6950000000000003 | H37: =ROUND(2*G37,0)/2 -> 7.5
A38: 511/2002027 | B38: 0.9 | C38: 0.75 | D38: 0 | G38: =IF(F38="ΝΑΙ",1.1,1)*(B38+C38+D38+$E$4*E38) -> 1.65 | H38: =ROUND(2*G38,0)/2 -> 1.5
A39: 511/2002029 | D39: 0 | E39: 2.3 | G39: =IF(F39="ΝΑΙ",1.1,1)*(B39+C39+D39+$E$4*E39) -> 1.2649999999999999 | H39: =ROUND(2*G39,0)/2 -> 1.5
A40: 511/2002037 | B40: 0.6 | C40: 1.2 | D40: 0 | E40: 3.4 | G40: =IF(F40="ΝΑΙ",1.1,1)*(B40+C40+D40+$E$4*E40) -> 3.67 | H40: =ROUND(2*G40,0)/2 -> 3.5
A41: 511/2002047 | C41: 0.6 | D41: 0 | G41: =IF(F41="ΝΑΙ",1.1,1)*(B41+C41+D41+$E$4*E41) -> 0.6 | H41: =ROUND(2*G41,0)/2 -> 0.5
A42: 511/2002050 | B42: 1.2 | C42: 0.75 | D42: 0.6 | E42: 4.7 | G42: =IF(F42="ΝΑΙ",1.1,1)*(B42+C42+D42+$E$4*E42) -> 5.1349999999999998 | H42: =ROUND(2*G42,0)/2 -> 5
A43: 511/2002052 | C43: 0 | D43: 0 | G43: =IF(F43="ΝΑΙ",1.1,1)*(B43+C43+D43+$E$4*E43) -> 0 | H43: =ROUND(2*G43,0)/2 -> 0
A44: 511/2002062 | B44: 0.75 | C44: 0.6 | D44: 0.6 | E44: 5.9 | G44: =IF(F44="ΝΑΙ",1.1,1)*(B44+C44+D44+$E$4*E44) -> 5.1950000000000003 | H44: =ROUND(2*G44,0)/2 -> 5
A45: 511/2003006 | B45: 1.05 | C45: 0.75 | D45: 0.6 | E45: 4.3 | G45: =IF(F45="ΝΑΙ",1.1,1)*(B45+C45+D45+$E$4*E45) -> 4.7649999999999997 | H45: =ROUND(2*G45,0)/2 -> 5
A46: 511/2003009 | B46: 0.5 | C46: 0.3 | D46: 0 | E46: 3.7 | G46: =IF(F46="ΝΑΙ",1.1,1)*(B46+C46+D46+$E$4*E46) -> 2.835 | H46: =ROUND(2*G46,0)/2 -> 3
A47: 511/2003018 | B47: 1.05 | C47: 0.6 | D47: 0 | E47: 2.2 | G47: =IF(F47="ΝΑΙ",1.1,1)*(B47+C47+D47+$E$4*E47) -> 2.86 | H47: =ROUND(2*G47,0)/2 -> 3
A48: 511/2003029 | B48: 0.9 | C48: 1.05 | D48: 0.6 | E48: 4.9 | G48: =IF(F48="ΝΑΙ",1.1,1)*(B48+C48+D48+$E$4*E48) -> 5.2450000000000001 | H48: =ROUND(2*G48,0)/2 -> 5
A49: 511/2003030 | B49: 1.2 | C49: 1.5 | D49: 0 | E49: 7.8 | F49: ΝΑΙ | G49: =IF(F49="ΝΑΙ",1.1,1)*(B49+C49+D49+$E$4*E49) -> 7.6890000000000009 | H49: =ROUND(2*G49,0)/2 -> 7.5
A50: 511/2003038 | B50: 1.2 | C50: 1.05 | D50: 0 | E50: 1.6 | G50: =IF(F50="ΝΑΙ",1.1,1)*(B50+C50+D50+$E$4*E50) -> 3.13 | H50: =ROUND(2*G50,0)/2 -> 3
A51: 511/2003048 | B51: 1.35 | C51: 1.2 | D51: 0 | E51: 5.1 | G51: =IF(F51="ΝΑΙ",1.1,1)*(B51+C51+D51+$E$4*E51) -> 5.3550000000000004 | H51: =ROUND(2*G51,0)/2 -> 5.5
A52: 511/2003053 | B52: 1.05 | C52: 0.6 | D52: 0.3 | E52: 3.7 | G52: =IF(F52="ΝΑΙ",1.1,1)*(B52+C52+D52+$E$4*E52) -> 3.9849999999999999 | H52: =ROUND(2*G52,0)/2 -> 4
A53: 511/2003054 | B53: 1.35 | C53: 1.35 | D53: 0 | E53: 8.6 | F53: ΝΑΙ | G53: =IF(F53="ΝΑΙ",1.1,1)*(B53+C53+D53+$E$4*E53) -> 8.1730000000000018 | H53: =ROUND(2*G53,0)/2 -> 8
A54: 511/2003061 | C54: 0 | D54: 0 | G54: =IF(F54="ΝΑΙ",1.1,1)*(B54+C54+D54+$E$4*E54) -> 0 | H54: =ROUND(2*G54,0)/2 -> 0
A55: 511/2003068 | B55: 1 | C55: 0.6 | D55: 1.2 | E55: 3.6 | G55: =IF(F55="ΝΑΙ",1.1,1)*(B55+C55+D55+$E$4*E55) -> 4.78 | H55: =ROUND(2*G55,0)/2 -> 5
A56: 511/2003070 | B56: 1 | C56: 1.1 | D56: 0.6 | E56: 4.8 | G56: =IF(F56="ΝΑΙ",1.1,1)*(B56+C56+D56+$E$4*E56) -> 5.34 | H56: =ROUND(2*G56,0)/2 -> 5.5
A57: 511/2004007 | B57: 1.2 | C57: 0 | D57: 0 | E57: 3.8 | G57: =IF(F57="ΝΑΙ",1.1,1)*(B57+C57+D57+$E$4*E57) -> 3.29 | H57: =ROUND(2*G57,0)/2 -> 3.5
A58: 511/2004010 | C58: 0 | D58: 0 | G58: =IF(F58="ΝΑΙ",1.1,1)*(B58+C58+D58+$E$4*E58) -> 0 | H58: =ROUND(2*G58,0)/2 -> 0
A59: 511/2004011 | B59: 1 | C59: 0.3 | D59: 0 | E59: 3.5 | G59: =IF(F59="ΝΑΙ",1.1,1)*(B59+C59+D59+$E$4*E59) -> 3.2250000000000001 | H59: =ROUND(2*G59,0)/2 -> 3
A60: 511/2004013 | B60: 0.5 | C60: 0 | D60: 0 | E60: 2.5 | G60: =IF(F60="ΝΑΙ",1.1,1)*(B60+C60+D60+$E$4*E60) -> 1.875 | H60: =ROUND(2*G60,0)/2 -> 2
A61: 511/2004023 | B61: 1 | C61: 1.3 | D61: 0 | E61: 1.3 | G61: =IF(F61="ΝΑΙ",1.1,1)*(B61+C61+D61+$E$4*E61) -> 3.0150000000000001 | H61: =ROUND(2*G61,0)/2 -> 3
A62: 511/2004026 | B62: 1 | C62: 0.6 | D62: 0 | E62: 4.5 | G62: =IF(F62="ΝΑΙ",1.1,1)*(B62+C62+D62+$E$4*E62) -> 4.0750000000000002 | H62: =ROUND(2*G62,0)/2 -> 4
A63: 511/2004030 | B63: 1.35 | C63: 1.35 | D63: 1.5 | E63: 3 | G63: =IF(F63="ΝΑΙ",1.1,1)*(B63+C63+D63+$E$4*E63) -> 5.85 | H63: =ROUND(2*G63,0)/2 -> 6
A64: 511/2004034 | C64: 0 | D64: 0 | G64: =IF(F64="ΝΑΙ",1.1,1)*(B64+C64+D64+$E$4*E64) -> 0 | H64: =ROUND(2*G64,0)/2 -> 0
A65: 511/2004035 | B65: 0.8 | C65: 0 | D65: 0 | E65: 1.8 | G65: =IF(F65="ΝΑΙ",1.1,1)*(B65+C65+D65+$E$4*E65) -> 1.79 | H65: =ROUND(2*G65,0)/2 -> 2
A66: 511/2004038 | B66: 1.05 | C66: 1.2 | D66: 0.6 | E66: 4 | G66: =IF(F66="ΝΑΙ",1.1,1)*(B66+C66+D66+$E$4*E66) -> 5.05 | H66: =ROUND(2*G66,0)/2 -> 5
A67: 511/2004050 | B67: 1 | C67: 0.6 | D67: 0 | E67: 3.8 | G67: =IF(F67="ΝΑΙ",1.1,1)*(B67+C67+D67+$E$4*E67) -> 3.69 | H67: =ROUND(2*G67,0)/2 -> 3.5
A68: 511/2004054 | B68: 0.8 | C68: 0.6 | D68: 0.75 | E68: 3.2 | G68: =IF(F68="ΝΑΙ",1.1,1)*(B68+C68+D68+$E$4*E68) -> 3.91 | H68: =ROUND(2*G68,0)/2 -> 4
A69: 511/2004056 | B69: 0.8 | C69: 1.2 | D69: 0.75 | E69: 4.5 | G69: =IF(F69="ΝΑΙ",1.1,1)*(B69+C69+D69+$E$4*E69) -> 5.2249999999999996 | H69: =ROUND(2*G69,0)/2 -> 5
A70: 511/2004058 | B70: 1 | C70: 0.6 | D70: 0 | E70: 1 | G70: =IF(F70="ΝΑΙ",1.1,1)*(B70+C70+D70+$E$4*E70) -> 2.15 | H70: =ROUND(2*G70,0)/2 -> 2
A71: 511/2004061 | B71: 0.5 | C71: 0.75 | D71: 0 | E71: 1.6 | G71: =IF(F71="ΝΑΙ",1.1,1)*(B71+C71+D71+$E$4*E71) -> 2.13 | H71: =ROUND(2*G71,0)/2 -> 2
A72: 511/2004068 | C72: 0 | D72: 0 | G72: =IF(F72="ΝΑΙ",1.1,1)*(B72+C72+D72+$E$4*E72) -> 0 | H72: =ROUND(2*G72,0)/2 -> 0
A73: 511/2005001 | B73: 1 | C73: 1.3 | D73: 0 | E73: 5.4 | G73: =IF(F73="ΝΑΙ",1.1,1)*(B73+C73+D73+$E$4*E73) -> 5.27 | H73: =ROUND(2*G73,0)/2 -> 5.5
A74: 511/2005002 | B74: 1.5 | C74: 1.425 | D74: 0.75 | E74: 8.2 | F74: ΝΑΙ | G74: =IF(F74="ΝΑΙ",1.1,1)*(B74+C74+D74+$E$4*E74) -> 9.0034999999999989 | H74: =ROUND(2*G74,0)/2 -> 9
A75: 511/2005003 | B75: 1 | C75: 0.6 | D75: 0 | E75: 4.3 | G75: =IF(F75="ΝΑΙ",1.1,1)*(B75+C75+D75+$E$4*E75) -> 3.9649999999999999 | H75: =ROUND(2*G75,0)/2 -> 4
A76: 511/2005004 | C76: 0 | D76: 0 | G76: =IF(F76="ΝΑΙ",1.1,1)*(B76+C76+D76+$E$4*E76) -> 0 | H76: =ROUND(2*G76,0)/2 -> 0
A77: 511/2005006 | B77: 0.7 | C77: 0 | D77: 0 | E77: 3 | G77: =IF(F77="ΝΑΙ",1.1,1)*(B77+C77+D77+$E$4*E77) -> 2.35 | H77: =ROUND(2*G77,0)/2 -> 2.5
A78: 511/2005007 | B78: 1.35 | C78: 0.75 | D78: 0 | E78: 3.7 | G78: =IF(F78="ΝΑΙ",1.1,1)*(B78+C78+D78+$E$4*E78) -> 4.1349999999999998 | H78: =ROUND(2*G78,0)/2 -> 4
A79: 511/2005008 | C79: 0 | D79: 0 | G79: =IF(F79="ΝΑΙ",1.1,1)*(B79+C79+D79+$E$4*E79) -> 0 | H79: =ROUND(2*G79,0)/2 -> 0
A80: 511/2005009 | B80: 1 | C80: 0 | D80: 0 | E80: 0 | G80: =IF(F80="ΝΑΙ",1.1,1)*(B80+C80+D80+$E$4*E80) -> 1 | H80: =ROUND(2*G80,0)/2 -> 1
A81: 511/2005010 | B81: 1 | C81: 0.8 | D81: 0.75 | E81: 4.1 | G81: =IF(F81="ΝΑΙ",1.1,1)*(B81+C81+D81+$E$4*E81) -> 4.8049999999999997 | H81: =ROUND(2*G81,0)/2 -> 5
A82: 511/2005011 | B82: 1 | C82: 0.9 | D82: 1.35 | E82: 3.1 | G82: =IF(F82="ΝΑΙ",1.1,1)*(B82+C82+D82+$E$4*E82) -> 4.9550000000000001 | H82: =ROUND(2*G82,0)/2 -> 5
A83: 511/2005012 | B83: 1 | C83: 0.75 | D83: 0 | E83: 1.9 | G83: =IF(F83="ΝΑΙ",1.1,1)*(B83+C83+D83+$E$4*E83) -> 2.7949999999999999 | H83: =ROUND(2*G83,0)/2 -> 3
A84: 511/2005013 | B84: 0.8 | C84: 1.5 | D84: 0 | E84: 5.3 | G84: =IF(F84="ΝΑΙ",1.1,1)*(B84+C84+D84+$E$4*E84) -> 5.2149999999999999 | H84: =ROUND(2*G84,0)/2 -> 5
A85: 511/2005014 | B85: 1.35 | C85: 1.425 | D85: 0 | E85: 7.8 | F85: ΝΑΙ | G85: =IF(F85="ΝΑΙ",1.1,1)*(B85+C85+D85+$E$4*E85) -> 7.7715000000000014 | H85: =ROUND(2*G85,0)/2 -> 8
A86: 511/2005015 | B86: 1.2 | C86: 0 | D86: 0 | E86: 3.3 | G86: =IF(F86="ΝΑΙ",1.1,1)*(B86+C86+D86+$E$4*E86) -> 3.0150000000000001 | H86: =ROUND(2*G86,0)/2 -> 3
A87: 511/2005018 | C87: 0 | D87: 0 | G87: =IF(F87="ΝΑΙ",1.1,1)*(B87+C87+D87+$E$4*E87) -> 0 | H87: =ROUND(2*G87,0)/2 -> 0
A88: 511/2005021 | B88: 1 | C88: 0.6 | D88: 0 | E88: 3.4 | G88: =IF(F88="ΝΑΙ",1.1,1)*(B88+C88+D88+$E$4*E88) -> 3.47 | H88: =ROUND(2*G88,0)/2 -> 3.5
A89: 511/2005022 | B89: 1.35 | C89: 0.6 | D89: 0 | E89: 3.4 | G89: =IF(F89="ΝΑΙ",1.1,1)*(B89+C89+D89+$E$4*E89) -> 3.82 | H89: =ROUND(2*G89,0)/2 -> 4
A90: 511/2005023 | B90: 1.2 | C90: 0.3 | D90: 0 | E90: 5.7 | F90: ΝΑΙ | G90: =IF(F90="ΝΑΙ",1.1,1)*(B90+C90+D90+$E$4*E90) -> 5.0985000000000005 | H90: =ROUND(2*G90,0)/2 -> 5
A91: 511/2005025 | B91: 1 | C91: 1.2 | D91: 0 | E91: 5.9 | F91: ΝΑΙ | G91: =IF(F91="ΝΑΙ",1.1,1)*(B91+C91+D91+$E$4*E91) -> 5.9895000000000005 | H91: =ROUND(2*G91,0)/2 -> 6
A92: 511/2005026 | C92: 0 | D92: 0 | E92: 2.1 | G92: =IF(F92="ΝΑΙ",1.1,1)*(B92+C92+D92+$E$4*E92) -> 1.155 | H92: =ROUND(2*G92,0)/2 -> 1
A93: 511/2005027 | B93: 0.7 | C93: 0 | D93: 0 | E93: 2.2 | G93: =IF(F93="ΝΑΙ",1.1,1)*(B93+C93+D93+$E$4*E93) -> 1.91 | H93: =ROUND(2*G93,0)/2 -> 2
A94: 511/2005028 | C94: 0 | D94: 0 | G94: =IF(F94="ΝΑΙ",1.1,1)*(B94+C94+D94+$E$4*E94) -> 0 | H94: =ROUND(2*G94,0)/2 -> 0
A95: 511/2005029 | B95: 1 | C95: 0.8 | D95: 0 | E95: 4.1 | G95: =IF(F95="ΝΑΙ",1.1,1)*(B95+C95+D95+$E$4*E95) -> 4.0549999999999997 | H95: =ROUND(2*G95,0)/2 -> 4
A96: 511/2005030 | B96: 0.7 | C96: 0.9 | D96: 0.75 | E96: 7.6 | G96: =IF(F96="ΝΑΙ",1.1,1)*(B96+C96+D96+$E$4*E96) -> 6.53 | H96: =ROUND(2*G96,0)/2 -> 6.5
A97: 511/2005032 | B97: 1 | C97: 0.75 | D97: 0 | E97: 5.5 | G97: =IF(F97="ΝΑΙ",1.1,1)*(B97+C97+D97+$E$4*E97) -> 4.7750000000000004 | H97: =ROUND(2*G97,0)/2 -> 5
A98: 511/2005033 | B98: 0 | C98: 0 | D98: 0 | G98: =IF(F98="ΝΑΙ",1.1,1)*(B98+C98+D98+$E$4*E98) -> 0 | H98: =ROUND(2*G98,0)/2 -> 0
A99: 511/2005034 | C99: 0 | D99: 0 | G99: =IF(F99="ΝΑΙ",1.1,1)*(B99+C99+D99+$E$4*E99) -> 0 | H99: =ROUND(2*G99,0)/2 -> 0
A100: 511/2005035 | C100: 0 | D100: 0 | G100: =IF(F100="ΝΑΙ",1.1,1)*(B100+C100+D100+$E$4*E100) -> 0 | H100: =ROUND(2*G100,0)/2 -> 0
A101: 511/2005036 | C101: 0 | D101: 0 | G101: =IF(F101="ΝΑΙ",1.1,1)*(B101+C101+D101+$E$4*E101) -> 0 | H101: =ROUND(2*G101,0)/2 -> 0
A102: 511/2005037 | B102: 1.2 | C102: 1.3 | D102: 0.5 | E102: 7.3 | F102: ΝΑΙ | G102: =IF(F102="ΝΑΙ",1.1,1)*(B102+C102+D102+$E$4*E102) -> 7.7165000000000017 | H102: =ROUND(2*G102,0)/2 -> 7.5
A103: 511/2005038 | B103: 0.7 | C103: 1.05 | D103: 0.9 | E103: 5.1 | G103: =IF(F103="ΝΑΙ",1.1,1)*(B103+C103+D103+$E$4*E103) -> 5.4550000000000001 | H103: =ROUND(2*G103,0)/2 -> 5.5
A104: 511/2005039 | B104: 1 | C104: 0.6 | D104: 0 | E104: 4.6 | G104: =IF(F104="ΝΑΙ",1.1,1)*(B104+C104+D104+$E$4*E104) -> 4.13 | H104: =ROUND(2*G104,0)/2 -> 4
A105: 511/2005040 | B105: 0.8 | C105: 0.3 | D105: 0.9 | E105: 3.1 | G105: =IF(F105="ΝΑΙ",1.1,1)*(B105+C105+D105+$E$4*E105) -> 3.7050000000000001 | H105: =ROUND(2*G105,0)/2 -> 3.5
A106: 511/2005041 | C106: 0 | D106: 0 | G106: =IF(F106="ΝΑΙ",1.1,1)*(B106+C106+D106+$E$4*E106) -> 0 | H106: =ROUND(2*G106,0)/2 -> 0
A107: 511/2005042 | B107: 1.05 | C107: 1.2 | D107: 0 | E107: 7.1 | F107: ΝΑΙ | G107: =IF(F107="ΝΑΙ",1.1,1)*(B107+C107+D107+$E$4*E107) -> 6.7705000000000011 | H107: =ROUND(2*G107,0)/2 -> 7
A108: 511/2005043 | B108: 1.2 | C108: 1.2 | D108: 0 | E108: 5.8 | G108: =IF(F108="ΝΑΙ",1.1,1)*(B108+C108+D108+$E$4*E108) -> 5.59 | H108: =ROUND(2*G108,0)/2 -> 5.5
A109: 511/2005046 | B109: 1.35 | C109: 0.6 | D109: 0 | E109: 1 | G109: =IF(F109="ΝΑΙ",1.1,1)*(B109+C109+D109+$E$4*E109) -> 2.5 | H109: =ROUND(2*G109,0)/2 -> 2.5
A110: 511/2005047 | B110: 1 | C110: 0.3 | D110: 0 | E110: 3.1 | G110: =IF(F110="ΝΑΙ",1.1,1)*(B110+C110+D110+$E$4*E110) -> 3.0049999999999999 | H110: =ROUND(2*G110,0)/2 -> 3
A111: 511/2005048 | B111: 1.35 | C111: 1.35 | D111: 0.6 | E111: 5.3 | G111: =IF(F111="ΝΑΙ",1.1,1)*(B111+C111+D111+$E$4*E111) -> 6.2149999999999999 | H111: =ROUND(2*G111,0)/2 -> 6
A112: 511/2005049 | B112: 0.5 | C112: 0 | D112: 0 | E112: 0 | G112: =IF(F112="ΝΑΙ",1.1,1)*(B112+C112+D112+$E$4*E112) -> 0.5 | H112: =ROUND(2*G112,0)/2 -> 0.5
A113: 511/2005050 | B113: 0.8 | C113: 0 | D113: 0 | G113: =IF(F113="ΝΑΙ",1.1,1)*(B113+C113+D113+$E$4*E113) -> 0.8 | H113: =ROUND(2*G113,0)/2 -> 1
A114: 511/2005051 | B114: 0.8 | C114: 0.7 | D114: 0 | E114: 2.6 | G114: =IF(F114="ΝΑΙ",1.1,1)*(B114+C114+D114+$E$4*E114) -> 2.93 | H114: =ROUND(2*G114,0)/2 -> 3
A115: 511/2005052 | B115: 0.5 | C115: 1.425 | D115: 0 | E115: 4.1 | G115: =IF(F115="ΝΑΙ",1.1,1)*(B115+C115+D115+$E$4*E115) -> 4.18 | H115: =ROUND(2*G115,0)/2 -> 4
A116: 511/2005053 | B116: 1.2 | C116: 0.6 | D116: 0 | E116: 4.6 | F116: ΝΑΙ | G116: =IF(F116="ΝΑΙ",1.1,1)*(B116+C116+D116+$E$4*E116) -> 4.7630000000000008 | H116: =ROUND(2*G116,0)/2 -> 5
A117: 511/2005054 | B117: 1.2 | C117: 0 | D117: 0 | E117: 5.1 | G117: =IF(F117="ΝΑΙ",1.1,1)*(B117+C117+D117+$E$4*E117) -> 4.0049999999999999 | H117: =ROUND(2*G117,0)/2 -> 4
A118: 511/2005056 | B118: 0.8 | C118: 0.5 | D118: 0.6 | E118: 5.4 | G118: =IF(F118="ΝΑΙ",1.1,1)*(B118+C118+D118+$E$4*E118) -> 4.87 | H118: =ROUND(2*G118,0)/2 -> 5
A119: 511/2005058 | C119: 0 | D119: 0 | G119: =IF(F119="ΝΑΙ",1.1,1)*(B119+C119+D119+$E$4*E119) -> 0 | H119: =ROUND(2*G119,0)/2 -> 0
A120: 511/2005059 | B120: 0.7 | C120: 0 | D120: 0.7 | E120: 4.3 | G120: =IF(F120="ΝΑΙ",1.1,1)*(B120+C120+D120+$E$4*E120) -> 3.7650000000000001 | H120: =ROUND(2*G120,0)/2 -> 4
A121: 511/2005063 | C121: 0 | D121: 0 | G121: =IF(F121="ΝΑΙ",1.1,1)*(B121+C121+D121+$E$4*E121) -> 0 | H121: =ROUND(2*G121,0)/2 -> 0
A122: 511/2005068 | C122: 0 | D122: 0.75 | G122: =IF(F122="ΝΑΙ",1.1,1)*(B122+C122+D122+$E$4*E122) -> 0.75 | H122: =ROUND(2*G122,0)/2 -> 1
B123: =SUM(B5:B122) -> 82.5 | C123: =SUM(C5:C122) -> 59.475000000000001 | D123: =SUM(D5:D122) -> 22.45 | E123: =SUM(E5:E122) -> 330.2 | F123: =SUM(F5:F122) -> 0 | G123: =SUM(G5:G122) -> 351.76 | H123: =SUM(H5:H122) -> 352
B124: =COUNT(B5:B122) -> 85 | C124: =COUNT(C5:C122) -> 117 | D124: =COUNT(D5:D122) -> 118 | E124: =COUNT(E5:E122) -> 82 | F124: =COUNTA(F5:F122) -> 9 | H124: =COUNTIF(H5:H122,">=5") -> 36
B125: =B123/B124 -> 0.97058823529411764 | C125: =C123/C124 -> 0.5083333333333333 | D125: =D123/D124 -> 0.19025423728813559 | E125: =E123/E124 -> 4.0268292682926861 | H125: =H123/E124 -> 4.2926829268292686
A127: Έκδοση 12 | B127: ΕΞΕΤΑΣΤΙΚΗ ΣΕΠΤΕΜΒΡΙΟΥ
A129: ΑΜ | B129: Πρωτη | C129: Δευτερη | D129: Τριτη | E129: Διαγωνισμα | F129: Πριμ | G129: Τελικος | H129: Γραμματεια
B130: 0.15 | C130: 0.15 | D130: 0.15 | E130: 0.55 | F130: 0.1 | G130: 1 | H130: Στρογγυλ
A131: 511/2000002 | B131: 1.05 | C131: 0 | D131: 0 | E131: 7.3 | G131: =IF(F131="ΝΑΙ",1.1,1)*(B131+C131+D131+$E$4*E131) -> 5.0650000000000004 | H131: =ROUND(2*G131,0)/2 -> 5
A132: 511/2000053 | C132: 0.4 | D132: 0 | E132: 6 | G132: =IF(F132="ΝΑΙ",1.1,1)*(B132+C132+D132+$E$4*E132) -> 3.7 | H132: =ROUND(2*G132,0)/2 -> 3.5
A133: 511/2001003 | B133: 1.4 | C133: 0 | D133: 0 | E133: 3 | G133: =IF(F133="ΝΑΙ",1.1,1)*(B133+C133+D133+$E$4*E133) -> 3.05 | H133: =ROUND(2*G133,0)/2 -> 3
A134: 511/2001019 | C134: 0 | D134: 0 | E134: 0 | G134: =IF(F134="ΝΑΙ",1.1,1)*(B134+C134+D134+$E$4*E134) -> 0 | H134: =ROUND(2*G134,0)/2 -> 0
A135: 511/2001051 | B135: 0.8 | C135: 0.75 | D135: 0.5 | E135: 5.6 | G135: =IF(F135="ΝΑΙ",1.1,1)*(B135+C135+D135+$E$4*E135) -> 5.13 | H135: =ROUND(2*G135,0)/2 -> 5
A136: 511/2001053 | B136: 0.7 | C136: 0.6 | D136: 0.3 | E136: 5.8 | G136: =IF(F136="ΝΑΙ",1.1,1)*(B136+C136+D136+$E$4*E136) -> 4.79 | H136: =ROUND(2*G136,0)/2 -> 5
A137: 511/2001069 | B137: 1.2 | C137: 0 | D137: 0.2 | E137: 6.1 | G137: =IF(F137="ΝΑΙ",1.1,1)*(B137+C137+D137+$E$4*E137) -> 4.7549999999999999 | H137: =ROUND(2*G137,0)/2 -> 5
A138: 511/2002022 | B138: 1 | C138: 1.1 | D138: 0 | E138: 4.9 | G138: =IF(F138="ΝΑΙ",1.1,1)*(B138+C138+D138+$E$4*E138) -> 4.7949999999999999 | H138: =ROUND(2*G138,0)/2 -> 5
A139: 511/2002027 | B139: 0.9 | C139: 0.75 | D139: 0 | E139: 3.3 | G139: =IF(F139="ΝΑΙ",1.1,1)*(B139+C139+D139+$E$4*E139) -> 3.4649999999999999 | H139: =ROUND(2*G139,0)/2 -> 3.5
A140: 511/2002037 | B140: 0.6 | C140: 1.2 | D140: 0 | E140: 2 | G140: =IF(F140="ΝΑΙ",1.1,1)*(B140+C140+D140+$E$4*E140) -> 2.9 | H140: =ROUND(2*G140,0)/2 -> 3
A141: 511/2003009 | B141: 0.5 | C141: 0.3 | D141: 0 | E141: 3 | G141: =IF(F141="ΝΑΙ",1.1,1)*(B141+C141+D141+$E$4*E141) -> 2.45 | H141: =ROUND(2*G141,0)/2 -> 2.5
A142: 511/2003018 | B142: 1.05 | C142: 0.6 | D142: 0 | E142: 1.9 | G142: =IF(F142="ΝΑΙ",1.1,1)*(B142+C142+D142+$E$4*E142) -> 2.6949999999999998 | H142: =ROUND(2*G142,0)/2 -> 2.5
A143: 511/2003038 | B143: 1.2 | C143: 1.05 | D143: 0 | E143: 6.2 | G143: =IF(F143="ΝΑΙ",1.1,1)*(B143+C143+D143+$E$4*E143) -> 5.66 | H143: =ROUND(2*G143,0)/2 -> 5.5
A144: 511/2003053 | B144: 1.05 | C144: 0.6 | D144: 0.3 | E144: 5.4 | G144: =IF(F144="ΝΑΙ",1.1,1)*(B144+C144+D144+$E$4*E144) -> 4.92 | H144: =ROUND(2*G144,0)/2 -> 5
A145: 511/2003068 | B145: 1 | C145: 0.6 | D145: 1.2 | E145: 3.9 | G145: =IF(F145="ΝΑΙ",1.1,1)*(B145+C145+D145+$E$4*E145) -> 4.9450000000000003 | H145: =ROUND(2*G145,0)/2 -> 5
A146: 511/2004013 | B146: 0.5 | C146: 0 | D146: 0 | E146: 0 | G146: =IF(F146="ΝΑΙ",1.1,1)*(B146+C146+D146+$E$4*E146) -> 0.5 | H146: =ROUND(2*G146,0)/2 -> 0.5
A147: 511/2004035 | B147: 0.8 | C147: 0 | D147: 0 | E147: 0 | G147: =IF(F147="ΝΑΙ",1.1,1)*(B147+C147+D147+$E$4*E147) -> 0.8 | H147: =ROUND(2*G147,0)/2 -> 1
A148: 511/2004050 | B148: 1 | C148: 0.6 | D148: 0 | E148: 4.8 | G148: =IF(F148="ΝΑΙ",1.1,1)*(B148+C148+D148+$E$4*E148) -> 4.24 | H148: =ROUND(2*G148,0)/2 -> 4
A149: 511/2004054 | B149: 0.8 | C149: 0.6 | D149: 0.75 | E149: 0 | G149: =IF(F149="ΝΑΙ",1.1,1)*(B149+C149+D149+$E$4*E149) -> 2.15 | H149: =ROUND(2*G149,0)/2 -> 2
A150: 511/2004061 | B150: 0.5 | C150: 0.75 | D150: 0 | E150: 0.5 | G150: =IF(F150="ΝΑΙ",1.1,1)*(B150+C150+D150+$E$4*E150) -> 1.5249999999999999 | H150: =ROUND(2*G150,0)/2 -> 1.5
A151: 511/2005003 | B151: 1 | C151: 0.6 | D151: 0 | E151: 3.4 | G151: =IF(F151="ΝΑΙ",1.1,1)*(B151+C151+D151+$E$4*E151) -> 3.47 | H151: =ROUND(2*G151,0)/2 -> 3.5
A152: 511/2005007 | B152: 1.35 | C152: 0.75 | D152: 0 | E152: 4.9 | G152: =IF(F152="ΝΑΙ",1.1,1)*(B152+C152+D152+$E$4*E152) -> 4.7949999999999999 | H152: =ROUND(2*G152,0)/2 -> 5
A153: 511/2005012 | B153: 1 | C153: 0.75 | D153: 0 | E153: 1 | G153: =IF(F153="ΝΑΙ",1.1,1)*(B153+C153+D153+$E$4*E153) -> 2.3 | H153: =ROUND(2*G153,0)/2 -> 2.5
A154: 511/2005021 | B154: 1 | C154: 0.6 | D154: 0 | E154: 3.5 | G154: =IF(F154="ΝΑΙ",1.1,1)*(B154+C154+D154+$E$4*E154) -> 3.5249999999999999 | H154: =ROUND(2*G154,0)/2 -> 3.5
A155: 511/2005022 | B155: 1.35 | C155: 0.6 | D155: 0 | E155: 0.9 | G155: =IF(F155="ΝΑΙ",1.1,1)*(B155+C155+D155+$E$4*E155) -> 2.4449999999999998 | H155: =ROUND(2*G155,0)/2 -> 2.5
A156: 511/2005029 | B156: 1 | C156: 0.8 | D156: 0 | E156: 1.5 | G156: =IF(F156="ΝΑΙ",1.1,1)*(B156+C156+D156+$E$4*E156) -> 2.625 | H156: =ROUND(2*G156,0)/2 -> 2.5
A157: 511/2005032 | B157: 1 | C157: 0.75 | D157: 0 | E157: 2.6 | G157: =IF(F157="ΝΑΙ",1.1,1)*(B157+C157+D157+$E$4*E157) -> 3.18 | H157: =ROUND(2*G157,0)/2 -> 3
A158: 511/2005039 | B158: 1 | C158: 0.6 | D158: 0 | E158: 3.4 | G158: =IF(F158="ΝΑΙ",1.1,1)*(B158+C158+D158+$E$4*E158) -> 3.47 | H158: =ROUND(2*G158,0)/2 -> 3.5
A159: 511/2005040 | B159: 0.8 | C159: 0.3 | D159: 0.9 | E159: 3.2 | G159: =IF(F159="ΝΑΙ",1.1,1)*(B159+C159+D159+$E$4*E159) -> 3.76 | H159: =ROUND(2*G159,0)/2 -> 4
A160: 511/2005051 | B160: 0.8 | C160: 0.7 | D160: 0 | E160: 3.9 | G160: =IF(F160="ΝΑΙ",1.1,1)*(B160+C160+D160+$E$4*E160) -> 3.645 | H160: =ROUND(2*G160,0)/2 -> 3.5
A161: 511/2005052 | B161: 0.5 | C161: 1.425 | D161: 0 | E161: 2.1 | G161: =IF(F161="ΝΑΙ",1.1,1)*(B161+C161+D161+$E$4*E161) -> 3.08 | H161: =ROUND(2*G161,0)/2 -> 3
A162: 511/2005053 | B162: 1.2 | C162: 0.6 | D162: 0 | E162: 7.3 | F162: ΝΑΙ | G162: =IF(F162="ΝΑΙ",1.1,1)*(B162+C162+D162+$E$4*E162) -> 6.3965000000000005 | H162: =ROUND(2*G162,0)/2 -> 6.5
A163: 511/2005059 | B163: 0.7 | C163: 0 | D163: 0.7 | E163: 6.1 | G163: =IF(F163="ΝΑΙ",1.1,1)*(B163+C163+D163+$E$4*E163) -> 4.7549999999999999 | H163: =ROUND(2*G163,0)/2 -> 5
A164: 511/2005068 | C164: 1.35 | D164: 0.75 | E164: 5.6 | G164: =IF(F164="ΝΑΙ",1.1,1)*(B164+C164+D164+$E$4*E164) -> 5.18 | H164: =ROUND(2*G164,0)/2 -> 5
B165: =SUM(B131:B164) -> 28.75 | C165: =SUM(C131:C164) -> 19.725000000000001 | D165: =SUM(D131:D164) -> 5.6 | E165: =SUM(E131:E164) -> 119.1 | F165: =SUM(F131:F164) -> 0 | G165: =SUM(G131:G164) -> 120.16150000000002 | H165: =SUM(H131:H164) -> 120.5
B166: =COUNT(B131:B164) -> 31 | C166: =COUNT(C131:C164) -> 34 | D166: =COUNT(D131:D164) -> 34 | E166: =COUNT(E131:E164) -> 34 | F166: =COUNTA(F131:F164) -> 1 | H166: =COUNTIF(H131:H164,">=5") -> 12
B167: =B165/B166 -> 0.92741935483870985 | C167: =C165/C166 -> 0.58014705882352946 | D167: =D165/D166 -> 0.1647058823529412 | E167: =E165/E166 -> 3.5029411764705882 | H167: =H165/E166 -> 3.5441176470588234