A1: Ενημερώθηκε: | C1: =NOW() -> 40230.98451076389
A3: ΑρΜητρ | B3: Ασκ1 | C3: Ασκ2 | D3: ΔιαγΙαν | E3: Βαθμός | F3: Πριμ | G3: Τελικός
B4: 0.2 | C4: 0.2 | D4: 0.6 | E4: 1 | F4: ="+10%" -> +10% | G4: βαθμός
A5: 2000042 | B5: 7 | C5: 5 | D5: 4.1 | E5: =B5*$B$4+C5*$C$4+D5*$D$4 -> 4.86 | G5: =ROUND(2*(E5+F5),0)/2 -> 5
A6: 2001003 | B6: 5 | E6: =B6*$B$4+C6*$C$4+D6*$D$4 -> 1 | G6: =ROUND(2*(E6+F6),0)/2 -> 1
A7: 2001019 | B7: 4 | C7: 5 | D7: 4.1 | E7: =B7*$B$4+C7*$C$4+D7*$D$4 -> 4.26 | G7: =ROUND(2*(E7+F7),0)/2 -> 4.5
A8: 2001034 | C8: 5 | D8: 3.3 | E8: =B8*$B$4+C8*$C$4+D8*$D$4 -> 2.98 | G8: =ROUND(2*(E8+F8),0)/2 -> 3
A9: 2002024 | B9: 5.5 | C9: 5.5 | E9: =B9*$B$4+C9*$C$4+D9*$D$4 -> 2.2 | G9: =ROUND(2*(E9+F9),0)/2 -> 2
A10: 2003034 | B10: 7.5 | C10: 6.5 | D10: 4.5 | E10: =B10*$B$4+C10*$C$4+D10*$D$4 -> 5.5 | G10: =ROUND(2*(E10+F10),0)/2 -> 5.5
A11: 2003036 | B11: 7.5 | C11: 6.5 | D11: 2.5 | E11: =B11*$B$4+C11*$C$4+D11*$D$4 -> 4.3 | G11: =ROUND(2*(E11+F11),0)/2 -> 4.5
A12: 2003061 | B12: 6 | C12: 6 | D12: 4.1 | E12: =B12*$B$4+C12*$C$4+D12*$D$4 -> 4.86 | G12: =ROUND(2*(E12+F12),0)/2 -> 5
A13: 2003065 | B13: 7.5 | C13: 6.5 | E13: =B13*$B$4+C13*$C$4+D13*$D$4 -> 2.8 | G13: =ROUND(2*(E13+F13),0)/2 -> 3
A14: 2003068 | B14: 8.5 | C14: 7 | D14: 3.6 | E14: =B14*$B$4+C14*$C$4+D14*$D$4 -> 5.26 | G14: =ROUND(2*(E14+F14),0)/2 -> 5.5
A15: 2004018 | B15: 5.5 | E15: =B15*$B$4+C15*$C$4+D15*$D$4 -> 1.1 | G15: =ROUND(2*(E15+F15),0)/2 -> 1
A16: 2004033 | B16: 7.5 | C16: 6 | E16: =B16*$B$4+C16*$C$4+D16*$D$4 -> 2.7 | G16: =ROUND(2*(E16+F16),0)/2 -> 2.5
A17: 2004061 | B17: 5.5 | C17: 7.5 | D17: 2.5 | E17: =B17*$B$4+C17*$C$4+D17*$D$4 -> 4.1 | G17: =ROUND(2*(E17+F17),0)/2 -> 4
A18: 2004067 | B18: 5.5 | C18: 5.5 | D18: 0 | E18: =B18*$B$4+C18*$C$4+D18*$D$4 -> 2.2 | G18: =ROUND(2*(E18+F18),0)/2 -> 2
A19: 2005017 | B19: 6 | C19: 6 | D19: 4.5 | E19: =B19*$B$4+C19*$C$4+D19*$D$4 -> 5.1 | G19: =ROUND(2*(E19+F19),0)/2 -> 5
A20: 2005028 | B20: 4 | C20: 5 | D20: 2.9 | E20: =B20*$B$4+C20*$C$4+D20*$D$4 -> 3.54 | G20: =ROUND(2*(E20+F20),0)/2 -> 3.5
A21: 2005035 | B21: 9 | C21: 7 | D21: 5.3 | E21: =B21*$B$4+C21*$C$4+D21*$D$4 -> 6.38 | G21: =ROUND(2*(E21+F21),0)/2 -> 6.5
A22: 2005041 | B22: 6 | C22: 6 | D22: 3.9 | E22: =B22*$B$4+C22*$C$4+D22*$D$4 -> 4.74 | G22: =ROUND(2*(E22+F22),0)/2 -> 4.5
A23: 2005056 | B23: 4 | C23: 7 | D23: 5.2 | E23: =B23*$B$4+C23*$C$4+D23*$D$4 -> 5.32 | G23: =ROUND(2*(E23+F23),0)/2 -> 5.5
A24: 2005067 | B24: 9 | C24: 7 | D24: 6.2 | E24: =B24*$B$4+C24*$C$4+D24*$D$4 -> 6.92 | G24: =ROUND(2*(E24+F24),0)/2 -> 7
A25: 2006002 | B25: 8.5 | E25: =B25*$B$4+C25*$C$4+D25*$D$4 -> 1.7 | G25: =ROUND(2*(E25+F25),0)/2 -> 1.5
A26: 2006005 | B26: 7.5 | C26: 7 | D26: 7.6 | E26: =B26*$B$4+C26*$C$4+D26*$D$4 -> 7.46 | G26: =ROUND(2*(E26+F26),0)/2 -> 7.5
A27: 2006006 | B27: 9 | C27: 7 | D27: 6.5 | E27: =B27*$B$4+C27*$C$4+D27*$D$4 -> 7.1 | G27: =ROUND(2*(E27+F27),0)/2 -> 7
A28: 2006007 | B28: 8.5 | C28: 7 | D28: 7.1 | E28: =B28*$B$4+C28*$C$4+D28*$D$4 -> 7.36 | G28: =ROUND(2*(E28+F28),0)/2 -> 7.5
A29: 2006008 | B29: 7.5 | C29: 7 | D29: 5 | E29: =B29*$B$4+C29*$C$4+D29*$D$4 -> 5.9 | G29: =ROUND(2*(E29+F29),0)/2 -> 6
A30: 2006009 | B30: 7.5 | E30: =B30*$B$4+C30*$C$4+D30*$D$4 -> 1.5 | G30: =ROUND(2*(E30+F30),0)/2 -> 1.5
A31: 2006012 | B31: 9 | C31: 7 | D31: 7.2 | E31: =B31*$B$4+C31*$C$4+D31*$D$4 -> 7.52 | G31: =ROUND(2*(E31+F31),0)/2 -> 7.5
A32: 2006013 | B32: 9 | C32: 7 | D32: 6.1 | E32: =B32*$B$4+C32*$C$4+D32*$D$4 -> 6.86 | G32: =ROUND(2*(E32+F32),0)/2 -> 7
A33: 2006014 | B33: 6.5 | C33: 6 | D33: 4.5 | E33: =B33*$B$4+C33*$C$4+D33*$D$4 -> 5.2 | G33: =ROUND(2*(E33+F33),0)/2 -> 5
A34: 2006015 | B34: 7.5 | C34: 7 | D34: 5 | E34: =B34*$B$4+C34*$C$4+D34*$D$4 -> 5.9 | G34: =ROUND(2*(E34+F34),0)/2 -> 6
A35: 2006017 | B35: 7.5 | C35: 6 | E35: =B35*$B$4+C35*$C$4+D35*$D$4 -> 2.7 | G35: =ROUND(2*(E35+F35),0)/2 -> 2.5
A36: 2006018 | B36: 9 | E36: =B36*$B$4+C36*$C$4+D36*$D$4 -> 1.8 | G36: =ROUND(2*(E36+F36),0)/2 -> 2
A37: 2006019 | B37: 9 | C37: 7 | D37: 6.3 | E37: =B37*$B$4+C37*$C$4+D37*$D$4 -> 6.98 | G37: =ROUND(2*(E37+F37),0)/2 -> 7
A38: 2006022 | B38: 7 | E38: =B38*$B$4+C38*$C$4+D38*$D$4 -> 1.4 | G38: =ROUND(2*(E38+F38),0)/2 -> 1.5
A39: 2006024 | B39: 7.5 | C39: 6 | D39: 2.3 | E39: =B39*$B$4+C39*$C$4+D39*$D$4 -> 4.08 | G39: =ROUND(2*(E39+F39),0)/2 -> 4
A40: 2006025 | B40: 7 | C40: 6.5 | D40: 2.8 | E40: =B40*$B$4+C40*$C$4+D40*$D$4 -> 4.38 | G40: =ROUND(2*(E40+F40),0)/2 -> 4.5
A41: 2006026 | B41: 6.5 | C41: 6 | D41: 3.7 | E41: =B41*$B$4+C41*$C$4+D41*$D$4 -> 4.72 | G41: =ROUND(2*(E41+F41),0)/2 -> 4.5
A42: 2006027 | B42: 9 | C42: 5 | D42: 3.3 | E42: =B42*$B$4+C42*$C$4+D42*$D$4 -> 4.78 | G42: =ROUND(2*(E42+F42),0)/2 -> 5
A43: 2006028 | B43: 7 | C43: 6.5 | D43: 5.5 | E43: =B43*$B$4+C43*$C$4+D43*$D$4 -> 6 | G43: =ROUND(2*(E43+F43),0)/2 -> 6
A44: 2006029 | B44: 8.5 | C44: 7 | D44: 5.9 | E44: =B44*$B$4+C44*$C$4+D44*$D$4 -> 6.64 | G44: =ROUND(2*(E44+F44),0)/2 -> 6.5
A45: 2006031 | B45: 7.5 | C45: 7 | D45: 5 | E45: =B45*$B$4+C45*$C$4+D45*$D$4 -> 5.9 | G45: =ROUND(2*(E45+F45),0)/2 -> 6
A46: 2006032 | B46: 7 | C46: 7 | D46: 4.7 | E46: =B46*$B$4+C46*$C$4+D46*$D$4 -> 5.62 | G46: =ROUND(2*(E46+F46),0)/2 -> 5.5
A47: 2006033 | B47: 7.5 | C47: 7 | D47: 5.9 | E47: =B47*$B$4+C47*$C$4+D47*$D$4 -> 6.44 | G47: =ROUND(2*(E47+F47),0)/2 -> 6.5
A48: 2006034 | B48: 8.5 | E48: =B48*$B$4+C48*$C$4+D48*$D$4 -> 1.7 | G48: =ROUND(2*(E48+F48),0)/2 -> 1.5
A49: 2006037 | B49: 7.5 | C49: 7 | D49: 6.1 | E49: =B49*$B$4+C49*$C$4+D49*$D$4 -> 6.56 | G49: =ROUND(2*(E49+F49),0)/2 -> 6.5
A50: 2006038 | B50: 7 | E50: =B50*$B$4+C50*$C$4+D50*$D$4 -> 1.4 | G50: =ROUND(2*(E50+F50),0)/2 -> 1.5
A51: 2006042 | B51: 9 | E51: =B51*$B$4+C51*$C$4+D51*$D$4 -> 1.8 | G51: =ROUND(2*(E51+F51),0)/2 -> 2
A52: 2006043 | B52: 9 | C52: 7.5 | D52: 4.2 | E52: =B52*$B$4+C52*$C$4+D52*$D$4 -> 5.82 | G52: =ROUND(2*(E52+F52),0)/2 -> 6
A53: 2006044 | B53: 7.5 | C53: 7 | D53: 6.4 | E53: =B53*$B$4+C53*$C$4+D53*$D$4 -> 6.74 | G53: =ROUND(2*(E53+F53),0)/2 -> 6.5
A54: 2006045 | B54: 9 | C54: 7.5 | D54: 3.6 | E54: =B54*$B$4+C54*$C$4+D54*$D$4 -> 5.46 | G54: =ROUND(2*(E54+F54),0)/2 -> 5.5
A55: 2006046 | B55: 8.5 | E55: =B55*$B$4+C55*$C$4+D55*$D$4 -> 1.7 | G55: =ROUND(2*(E55+F55),0)/2 -> 1.5
A56: 2006047 | B56: 9 | C56: 7.5 | D56: 4 | E56: =B56*$B$4+C56*$C$4+D56*$D$4 -> 5.7 | G56: =ROUND(2*(E56+F56),0)/2 -> 5.5
A57: 2006048 | B57: 7 | C57: 6.5 | D57: 5.1 | E57: =B57*$B$4+C57*$C$4+D57*$D$4 -> 5.76 | G57: =ROUND(2*(E57+F57),0)/2 -> 6
A58: 2006050 | B58: 9 | C58: 7.5 | D58: 4.6 | E58: =B58*$B$4+C58*$C$4+D58*$D$4 -> 6.06 | G58: =ROUND(2*(E58+F58),0)/2 -> 6
A59: 2006051 | B59: 7.5 | C59: 7 | D59: 5.8 | E59: =B59*$B$4+C59*$C$4+D59*$D$4 -> 6.38 | G59: =ROUND(2*(E59+F59),0)/2 -> 6.5
A60: 2006052 | B60: 6.5 | C60: 7 | D60: 6.4 | E60: =B60*$B$4+C60*$C$4+D60*$D$4 -> 6.54 | G60: =ROUND(2*(E60+F60),0)/2 -> 6.5
A61: 2006053 | B61: 7 | C61: 7 | D61: 3.1 | E61: =B61*$B$4+C61*$C$4+D61*$D$4 -> 4.66 | G61: =ROUND(2*(E61+F61),0)/2 -> 4.5
A62: 2006055 | B62: 7.5 | C62: 7 | D62: 5 | E62: =B62*$B$4+C62*$C$4+D62*$D$4 -> 5.9 | G62: =ROUND(2*(E62+F62),0)/2 -> 6
A63: 2006057 | B63: 7 | C63: 7 | D63: 2.8 | E63: =B63*$B$4+C63*$C$4+D63*$D$4 -> 4.48 | G63: =ROUND(2*(E63+F63),0)/2 -> 4.5
A64: 2006058 | C64: 6 | D64: 3 | E64: =B64*$B$4+C64*$C$4+D64*$D$4 -> 3 | G64: =ROUND(2*(E64+F64),0)/2 -> 3
A65: 2006059 | B65: 9 | C65: 7 | D65: 4.5 | E65: =B65*$B$4+C65*$C$4+D65*$D$4 -> 5.9 | G65: =ROUND(2*(E65+F65),0)/2 -> 6
A66: 2006063 | B66: 7 | C66: 6.5 | D66: 4 | E66: =B66*$B$4+C66*$C$4+D66*$D$4 -> 5.1 | G66: =ROUND(2*(E66+F66),0)/2 -> 5
A67: 2006065 | B67: 9 | C67: 6.5 | D67: 6.6 | E67: =B67*$B$4+C67*$C$4+D67*$D$4 -> 7.06 | G67: =ROUND(2*(E67+F67),0)/2 -> 7
A68: 2007001 | B68: 6.5 | C68: 5.5 | D68: 4 | E68: =B68*$B$4+C68*$C$4+D68*$D$4 -> 4.8 | G68: =ROUND(2*(E68+F68),0)/2 -> 5
A69: 2007004 | B69: 4 | C69: 5 | D69: 4.3 | E69: =B69*$B$4+C69*$C$4+D69*$D$4 -> 4.38 | G69: =ROUND(2*(E69+F69),0)/2 -> 4.5
A70: 2007006 | B70: 8 | C70: 6.5 | D70: 3.6 | E70: =B70*$B$4+C70*$C$4+D70*$D$4 -> 5.06 | G70: =ROUND(2*(E70+F70),0)/2 -> 5
A71: 2007008 | B71: 6.5 | D71: 5.3 | E71: =B71*$B$4+C71*$C$4+D71*$D$4 -> 4.48 | G71: =ROUND(2*(E71+F71),0)/2 -> 4.5
A72: 2007009 | B72: 4 | E72: =B72*$B$4+C72*$C$4+D72*$D$4 -> 0.8 | G72: =ROUND(2*(E72+F72),0)/2 -> 1
A73: 2007010 | B73: 6.5 | C73: 5 | D73: 3.8 | E73: =B73*$B$4+C73*$C$4+D73*$D$4 -> 4.58 | G73: =ROUND(2*(E73+F73),0)/2 -> 4.5
A74: 2007012 | B74: 7.5 | C74: 6 | E74: =B74*$B$4+C74*$C$4+D74*$D$4 -> 2.7 | G74: =ROUND(2*(E74+F74),0)/2 -> 2.5
A75: 2007013 | B75: 6 | C75: 5.5 | D75: 5.1 | E75: =B75*$B$4+C75*$C$4+D75*$D$4 -> 5.36 | G75: =ROUND(2*(E75+F75),0)/2 -> 5.5
A76: 2007014 | B76: 4 | C76: 6 | D76: 3.2 | E76: =B76*$B$4+C76*$C$4+D76*$D$4 -> 3.92 | G76: =ROUND(2*(E76+F76),0)/2 -> 4
A77: 2007015 | B77: 5 | C77: 5 | E77: =B77*$B$4+C77*$C$4+D77*$D$4 -> 2 | G77: =ROUND(2*(E77+F77),0)/2 -> 2
A78: 2007016 | B78: 6.5 | C78: 5 | D78: 5.5 | E78: =B78*$B$4+C78*$C$4+D78*$D$4 -> 5.6 | G78: =ROUND(2*(E78+F78),0)/2 -> 5.5
A79: 2007017 | B79: 5.5 | E79: =B79*$B$4+C79*$C$4+D79*$D$4 -> 1.1 | G79: =ROUND(2*(E79+F79),0)/2 -> 1
A80: 2007018 | B80: 7 | C80: 5.5 | D80: 4.4 | E80: =B80*$B$4+C80*$C$4+D80*$D$4 -> 5.14 | G80: =ROUND(2*(E80+F80),0)/2 -> 5
A81: 2007019 | B81: 4 | C81: 6 | D81: 6.3 | E81: =B81*$B$4+C81*$C$4+D81*$D$4 -> 5.78 | G81: =ROUND(2*(E81+F81),0)/2 -> 6
A82: 2007021 | B82: 5.5 | E82: =B82*$B$4+C82*$C$4+D82*$D$4 -> 1.1 | G82: =ROUND(2*(E82+F82),0)/2 -> 1
A83: 2007023 | B83: 6 | C83: 5.5 | D83: 5.3 | E83: =B83*$B$4+C83*$C$4+D83*$D$4 -> 5.48 | G83: =ROUND(2*(E83+F83),0)/2 -> 5.5
A84: 2007024 | B84: 7 | C84: 5.5 | D84: 3.3 | E84: =B84*$B$4+C84*$C$4+D84*$D$4 -> 4.48 | G84: =ROUND(2*(E84+F84),0)/2 -> 4.5
A85: 2007025 | B85: 5.5 | E85: =B85*$B$4+C85*$C$4+D85*$D$4 -> 1.1 | G85: =ROUND(2*(E85+F85),0)/2 -> 1
A86: 2007026 | B86: 5.5 | E86: =B86*$B$4+C86*$C$4+D86*$D$4 -> 1.1 | G86: =ROUND(2*(E86+F86),0)/2 -> 1
A87: 2007029 | B87: 7 | C87: 6 | D87: 4.3 | E87: =B87*$B$4+C87*$C$4+D87*$D$4 -> 5.18 | G87: =ROUND(2*(E87+F87),0)/2 -> 5
A88: 2007031 | B88: 7 | C88: 5 | D88: 4.4 | E88: =B88*$B$4+C88*$C$4+D88*$D$4 -> 5.04 | G88: =ROUND(2*(E88+F88),0)/2 -> 5
A89: 2007032 | B89: 6 | C89: 5.5 | D89: 5 | E89: =B89*$B$4+C89*$C$4+D89*$D$4 -> 5.3 | G89: =ROUND(2*(E89+F89),0)/2 -> 5.5
A90: 2007033 | B90: 7 | C90: 5.5 | D90: 5.3 | E90: =B90*$B$4+C90*$C$4+D90*$D$4 -> 5.68 | G90: =ROUND(2*(E90+F90),0)/2 -> 5.5
A91: 2007034 | B91: 8 | C91: 6.5 | D91: 6.5 | E91: =B91*$B$4+C91*$C$4+D91*$D$4 -> 6.8 | G91: =ROUND(2*(E91+F91),0)/2 -> 7
A92: 2007035 | B92: 5 | C92: 5 | E92: =B92*$B$4+C92*$C$4+D92*$D$4 -> 2 | G92: =ROUND(2*(E92+F92),0)/2 -> 2
A93: 2007036 | B93: 6.5 | C93: 5 | D93: 5.6 | E93: =B93*$B$4+C93*$C$4+D93*$D$4 -> 5.66 | G93: =ROUND(2*(E93+F93),0)/2 -> 5.5
A94: 2007037 | B94: 7.5 | C94: 6 | E94: =B94*$B$4+C94*$C$4+D94*$D$4 -> 2.7 | G94: =ROUND(2*(E94+F94),0)/2 -> 2.5
A95: 2007038 | B95: 5 | C95: 5 | D95: 6.2 | E95: =B95*$B$4+C95*$C$4+D95*$D$4 -> 5.72 | G95: =ROUND(2*(E95+F95),0)/2 -> 5.5
A96: 2007040 | B96: 6.5 | E96: =B96*$B$4+C96*$C$4+D96*$D$4 -> 1.3 | G96: =ROUND(2*(E96+F96),0)/2 -> 1.5
A97: 2007042 | B97: 7.5 | C97: 6 | D97: 3.3 | E97: =B97*$B$4+C97*$C$4+D97*$D$4 -> 4.68 | G97: =ROUND(2*(E97+F97),0)/2 -> 4.5
A98: 2007043 | B98: 6 | C98: 5.5 | D98: 1.9 | E98: =B98*$B$4+C98*$C$4+D98*$D$4 -> 3.44 | G98: =ROUND(2*(E98+F98),0)/2 -> 3.5
A99: 2007044 | B99: 6.5 | C99: 5.5 | E99: =B99*$B$4+C99*$C$4+D99*$D$4 -> 2.4 | G99: =ROUND(2*(E99+F99),0)/2 -> 2.5
A100: 2007045 | B100: 5.5 | E100: =B100*$B$4+C100*$C$4+D100*$D$4 -> 1.1 | G100: =ROUND(2*(E100+F100),0)/2 -> 1
A101: 2007046 | B101: 7 | C101: 7 | E101: =B101*$B$4+C101*$C$4+D101*$D$4 -> 2.8 | G101: =ROUND(2*(E101+F101),0)/2 -> 3
A102: 2007047 | B102: 7 | C102: 6 | D102: 4.5 | E102: =B102*$B$4+C102*$C$4+D102*$D$4 -> 5.3 | G102: =ROUND(2*(E102+F102),0)/2 -> 5.5
A103: 2007049 | B103: 7 | C103: 5 | D103: 5.7 | E103: =B103*$B$4+C103*$C$4+D103*$D$4 -> 5.82 | G103: =ROUND(2*(E103+F103),0)/2 -> 6
A104: 2007051 | B104: 6.5 | C104: 5 | D104: 3 | E104: =B104*$B$4+C104*$C$4+D104*$D$4 -> 4.1 | G104: =ROUND(2*(E104+F104),0)/2 -> 4
A105: 2007053 | B105: 6 | C105: 5.5 | D105: 5.6 | E105: =B105*$B$4+C105*$C$4+D105*$D$4 -> 5.66 | G105: =ROUND(2*(E105+F105),0)/2 -> 5.5
A106: 2007059 | B106: 4 | D106: 3.6 | E106: =B106*$B$4+C106*$C$4+D106*$D$4 -> 2.96 | G106: =ROUND(2*(E106+F106),0)/2 -> 3
A107: 2007060 | B107: 5.5 | C107: 5.5 | D107: 6.4 | E107: =B107*$B$4+C107*$C$4+D107*$D$4 -> 6.04 | G107: =ROUND(2*(E107+F107),0)/2 -> 6
A108: 2007061 | B108: 5 | D108: 1.6 | E108: =B108*$B$4+C108*$C$4+D108*$D$4 -> 1.96 | G108: =ROUND(2*(E108+F108),0)/2 -> 2
A109: 2007062 | B109: 6 | C109: 5.5 | D109: 4.5 | E109: =B109*$B$4+C109*$C$4+D109*$D$4 -> 5 | G109: =ROUND(2*(E109+F109),0)/2 -> 5
A110: 2007066 | B110: 5 | D110: 4.8 | E110: =B110*$B$4+C110*$C$4+D110*$D$4 -> 3.88 | G110: =ROUND(2*(E110+F110),0)/2 -> 4
B111: =COUNTA(B5:B109) -> 103 | C111: =COUNTA(C5:C109) -> 85 | D111: =COUNTA(D5:D109) -> 78 | E111: =AVERAGE(E5:E110) -> 4.3892452830188713 | G111: =COUNTIF(G5:G109,">=5") -> 55 | H111: =SUM(G5:G109) -> 461.5
B112: Πλήθος | C112: Πλήθος | D112: Πλήθος | E112: Μέσος όρος βαθμολογίας | F112: Προσαύξηση | G112: Πλήθος προβιβασθέντων