A1: Βαθμολογία
A3: ΑΜ | B3: Άσκηση 1 | C3: Άσκηση 2 | D3: Διαγώνισμα | E3: Πριμ | F3: Τελ. Βαθμός | H3: Διαγ Σεπτ | I3: Τελ. Βαθμ Σεπτ
B4: 0.1 | C4: 0.15 | D4: 0.75 | E4: 0.05 | F4: 1 | H4: 0.75 | I4: 1
A5: 00002 | B5: 5 | F5: =ROUND(2*(B5*$B$4+C5*$C$4+D5*$D$4*IF(E5="Ν",1.05,1)),0)/2 -> 0.5 | I5: =IF(H5>0,ROUND(2*(B5*$B$4+C5*$C$4+H5*$H$4*IF(E5="Ν",1.05,1)),0)/2,"") -> 
A6: 00011 | B6: 9 | C6: 2 | D6: 2.4 | F6: =ROUND(2*(B6*$B$4+C6*$C$4+D6*$D$4*IF(E6="Ν",1.05,1)),0)/2 -> 3 | H6: 5.4 | I6: =IF(H6>0,ROUND(2*(B6*$B$4+C6*$C$4+H6*$H$4*IF(E6="Ν",1.05,1)),0)/2,"") -> 5.5
A7: 00019 | B7: 7 | C7: 6 | D7: 2.1 | F7: =ROUND(2*(B7*$B$4+C7*$C$4+D7*$D$4*IF(E7="Ν",1.05,1)),0)/2 -> 3 | H7: 5.3 | I7: =IF(H7>0,ROUND(2*(B7*$B$4+C7*$C$4+H7*$H$4*IF(E7="Ν",1.05,1)),0)/2,"") -> 5.5
A8: 00020 | H8: 2.7 | I8: =IF(H8>0,ROUND(2*(B8*$B$4+C8*$C$4+H8*$H$4*IF(E8="Ν",1.05,1)),0)/2,"") -> 2
A9: 00031 | B9: 5 | C9: 6 | D9: 2.6 | F9: =ROUND(2*(B9*$B$4+C9*$C$4+D9*$D$4*IF(E9="Ν",1.05,1)),0)/2 -> 3.5 | G9: αλλαγή 5/9 | H9: 3.7 | I9: =IF(H9>0,ROUND(2*(B9*$B$4+C9*$C$4+H9*$H$4*IF(E9="Ν",1.05,1)),0)/2,"") -> 4
A10: 00037 | B10: 7 | D10: 1.5 | F10: =ROUND(2*(B10*$B$4+C10*$C$4+D10*$D$4*IF(E10="Ν",1.05,1)),0)/2 -> 2 | H10: 1.9 | I10: =IF(H10>0,ROUND(2*(B10*$B$4+C10*$C$4+H10*$H$4*IF(E10="Ν",1.05,1)),0)/2,"") -> 2
A11: 00043 | B11: 10 | F11: =ROUND(2*(B11*$B$4+C11*$C$4+D11*$D$4*IF(E11="Ν",1.05,1)),0)/2 -> 1 | H11: 4 | I11: =IF(H11>0,ROUND(2*(B11*$B$4+C11*$C$4+H11*$H$4*IF(E11="Ν",1.05,1)),0)/2,"") -> 4
A12: 00044 | B12: 4 | F12: =ROUND(2*(B12*$B$4+C12*$C$4+D12*$D$4*IF(E12="Ν",1.05,1)),0)/2 -> 0.5 | I12: =IF(H12>0,ROUND(2*(B12*$B$4+C12*$C$4+H12*$H$4*IF(E12="Ν",1.05,1)),0)/2,"") -> 
A13: 00053 | B13: 4 | D13: 2.2 | F13: =ROUND(2*(B13*$B$4+C13*$C$4+D13*$D$4*IF(E13="Ν",1.05,1)),0)/2 -> 2 | H13: 2.3 | I13: =IF(H13>0,ROUND(2*(B13*$B$4+C13*$C$4+H13*$H$4*IF(E13="Ν",1.05,1)),0)/2,"") -> 2
A14: 00066 | B14: 6 | D14: 0 | F14: =ROUND(2*(B14*$B$4+C14*$C$4+D14*$D$4*IF(E14="Ν",1.05,1)),0)/2 -> 0.5 | I14: =IF(H14>0,ROUND(2*(B14*$B$4+C14*$C$4+H14*$H$4*IF(E14="Ν",1.05,1)),0)/2,"") -> 
A15: 00067 | B15: 8 | D15: 2.6 | F15: =ROUND(2*(B15*$B$4+C15*$C$4+D15*$D$4*IF(E15="Ν",1.05,1)),0)/2 -> 3 | H15: 6 | I15: =IF(H15>0,ROUND(2*(B15*$B$4+C15*$C$4+H15*$H$4*IF(E15="Ν",1.05,1)),0)/2,"") -> 5.5
A16: 00075 | B16: 10 | C16: 6.5 | D16: 3.7 | F16: =ROUND(2*(B16*$B$4+C16*$C$4+D16*$D$4*IF(E16="Ν",1.05,1)),0)/2 -> 5 | I16: =IF(H16>0,ROUND(2*(B16*$B$4+C16*$C$4+H16*$H$4*IF(E16="Ν",1.05,1)),0)/2,"") -> 
A17: 00078 | C17: 6 | D17: 2.8 | F17: =ROUND(2*(B17*$B$4+C17*$C$4+D17*$D$4*IF(E17="Ν",1.05,1)),0)/2 -> 3 | G17: αλλαγή 8/9 | H17: 6.9 | I17: =IF(H17>0,ROUND(2*(B17*$B$4+C17*$C$4+H17*$H$4*IF(E17="Ν",1.05,1)),0)/2,"") -> 6
A18: 00083 | B18: 8 | D18: 3.1 | F18: =ROUND(2*(B18*$B$4+C18*$C$4+D18*$D$4*IF(E18="Ν",1.05,1)),0)/2 -> 3 | H18: 3.2 | I18: =IF(H18>0,ROUND(2*(B18*$B$4+C18*$C$4+H18*$H$4*IF(E18="Ν",1.05,1)),0)/2,"") -> 3
A19: 01001 | B19: 5 | D19: 4.1 | F19: =ROUND(2*(B19*$B$4+C19*$C$4+D19*$D$4*IF(E19="Ν",1.05,1)),0)/2 -> 3.5 | H19: 6.2 | I19: =IF(H19>0,ROUND(2*(B19*$B$4+C19*$C$4+H19*$H$4*IF(E19="Ν",1.05,1)),0)/2,"") -> 5
A20: 01026 | B20: 5 | F20: =ROUND(2*(B20*$B$4+C20*$C$4+D20*$D$4*IF(E20="Ν",1.05,1)),0)/2 -> 0.5 | I20: =IF(H20>0,ROUND(2*(B20*$B$4+C20*$C$4+H20*$H$4*IF(E20="Ν",1.05,1)),0)/2,"") -> 
A21: 01034 | B21: 7 | F21: =ROUND(2*(B21*$B$4+C21*$C$4+D21*$D$4*IF(E21="Ν",1.05,1)),0)/2 -> 0.5 | I21: =IF(H21>0,ROUND(2*(B21*$B$4+C21*$C$4+H21*$H$4*IF(E21="Ν",1.05,1)),0)/2,"") -> 
A22: 01037 | B22: 4 | F22: =ROUND(2*(B22*$B$4+C22*$C$4+D22*$D$4*IF(E22="Ν",1.05,1)),0)/2 -> 0.5 | I22: =IF(H22>0,ROUND(2*(B22*$B$4+C22*$C$4+H22*$H$4*IF(E22="Ν",1.05,1)),0)/2,"") -> 
A23: 01047 | B23: 7.5 | C23: 9 | D23: 5.4 | F23: =ROUND(2*(B23*$B$4+C23*$C$4+D23*$D$4*IF(E23="Ν",1.05,1)),0)/2 -> 6 | I23: =IF(H23>0,ROUND(2*(B23*$B$4+C23*$C$4+H23*$H$4*IF(E23="Ν",1.05,1)),0)/2,"") -> 
A24: 01049 | B24: 7 | D24: 0 | F24: =ROUND(2*(B24*$B$4+C24*$C$4+D24*$D$4*IF(E24="Ν",1.05,1)),0)/2 -> 0.5 | I24: =IF(H24>0,ROUND(2*(B24*$B$4+C24*$C$4+H24*$H$4*IF(E24="Ν",1.05,1)),0)/2,"") -> 
A25: 01051 | D25: 0 | F25: =ROUND(2*(B25*$B$4+C25*$C$4+D25*$D$4*IF(E25="Ν",1.05,1)),0)/2 -> 0 | H25: 3.5 | I25: =IF(H25>0,ROUND(2*(B25*$B$4+C25*$C$4+H25*$H$4*IF(E25="Ν",1.05,1)),0)/2,"") -> 2.5
A26: 01053 | H26: 1.1 | I26: =IF(H26>0,ROUND(2*(B26*$B$4+C26*$C$4+H26*$H$4*IF(E26="Ν",1.05,1)),0)/2,"") -> 1
A27: 01062 | B27: 6.5 | F27: =ROUND(2*(B27*$B$4+C27*$C$4+D27*$D$4*IF(E27="Ν",1.05,1)),0)/2 -> 0.5 | I27: =IF(H27>0,ROUND(2*(B27*$B$4+C27*$C$4+H27*$H$4*IF(E27="Ν",1.05,1)),0)/2,"") -> 
A28: 01067 | B28: 7.5 | F28: =ROUND(2*(B28*$B$4+C28*$C$4+D28*$D$4*IF(E28="Ν",1.05,1)),0)/2 -> 1 | I28: =IF(H28>0,ROUND(2*(B28*$B$4+C28*$C$4+H28*$H$4*IF(E28="Ν",1.05,1)),0)/2,"") -> 
A29: 01068 | B29: 4 | F29: =ROUND(2*(B29*$B$4+C29*$C$4+D29*$D$4*IF(E29="Ν",1.05,1)),0)/2 -> 0.5 | I29: =IF(H29>0,ROUND(2*(B29*$B$4+C29*$C$4+H29*$H$4*IF(E29="Ν",1.05,1)),0)/2,"") -> 
A30: 02001 | B30: 4 | C30: 5 | D30: 4.1 | F30: =ROUND(2*(B30*$B$4+C30*$C$4+D30*$D$4*IF(E30="Ν",1.05,1)),0)/2 -> 4 | H30: 6.7 | I30: =IF(H30>0,ROUND(2*(B30*$B$4+C30*$C$4+H30*$H$4*IF(E30="Ν",1.05,1)),0)/2,"") -> 6
A31: 02008 | B31: 8 | C31: 10 | D31: 5 | F31: =ROUND(2*(B31*$B$4+C31*$C$4+D31*$D$4*IF(E31="Ν",1.05,1)),0)/2 -> 6 | G31: αλλαγή 8/9 | I31: =IF(H31>0,ROUND(2*(B31*$B$4+C31*$C$4+H31*$H$4*IF(E31="Ν",1.05,1)),0)/2,"") -> 
A32: 02011 | B32: 9.5 | C32: 5 | D32: 2.5 | F32: =ROUND(2*(B32*$B$4+C32*$C$4+D32*$D$4*IF(E32="Ν",1.05,1)),0)/2 -> 3.5 | H32: 7 | I32: =IF(H32>0,ROUND(2*(B32*$B$4+C32*$C$4+H32*$H$4*IF(E32="Ν",1.05,1)),0)/2,"") -> 7
A33: 02015 | B33: 10 | C33: 9 | D33: 3.4 | F33: =ROUND(2*(B33*$B$4+C33*$C$4+D33*$D$4*IF(E33="Ν",1.05,1)),0)/2 -> 5 | H33: 6.4 | I33: =IF(H33>0,ROUND(2*(B33*$B$4+C33*$C$4+H33*$H$4*IF(E33="Ν",1.05,1)),0)/2,"") -> 7
A34: 02017 | B34: 4 | D34: 4 | F34: =ROUND(2*(B34*$B$4+C34*$C$4+D34*$D$4*IF(E34="Ν",1.05,1)),0)/2 -> 3.5 | H34: 6.9 | I34: =IF(H34>0,ROUND(2*(B34*$B$4+C34*$C$4+H34*$H$4*IF(E34="Ν",1.05,1)),0)/2,"") -> 5.5
A35: 02021 | B35: 9 | C35: 9.5 | D35: 0 | F35: =ROUND(2*(B35*$B$4+C35*$C$4+D35*$D$4*IF(E35="Ν",1.05,1)),0)/2 -> 2.5 | H35: 5.7 | I35: =IF(H35>0,ROUND(2*(B35*$B$4+C35*$C$4+H35*$H$4*IF(E35="Ν",1.05,1)),0)/2,"") -> 6.5
A36: 02026 | B36: 4 | C36: 0 | D36: 4.8 | F36: =ROUND(2*(B36*$B$4+C36*$C$4+D36*$D$4*IF(E36="Ν",1.05,1)),0)/2 -> 4 | H36: 4.8 | I36: =IF(H36>0,ROUND(2*(B36*$B$4+C36*$C$4+H36*$H$4*IF(E36="Ν",1.05,1)),0)/2,"") -> 4
A37: 02032 | B37: 7.5 | C37: 10 | D37: 3.2 | F37: =ROUND(2*(B37*$B$4+C37*$C$4+D37*$D$4*IF(E37="Ν",1.05,1)),0)/2 -> 4.5 | G37: αλλαγή 8/9 | H37: 3.5 | I37: =IF(H37>0,ROUND(2*(B37*$B$4+C37*$C$4+H37*$H$4*IF(E37="Ν",1.05,1)),0)/2,"") -> 5
A38: 02041 | B38: 7.5 | C38: 7.5 | D38: 0 | E38: Ν | F38: =ROUND(2*(B38*$B$4+C38*$C$4+D38*$D$4*IF(E38="Ν",1.05,1)),0)/2 -> 2 | H38: 5.4 | I38: =IF(H38>0,ROUND(2*(B38*$B$4+C38*$C$4+H38*$H$4*IF(E38="Ν",1.05,1)),0)/2,"") -> 6
A39: 02052 | B39: 5 | F39: =ROUND(2*(B39*$B$4+C39*$C$4+D39*$D$4*IF(E39="Ν",1.05,1)),0)/2 -> 0.5 | I39: =IF(H39>0,ROUND(2*(B39*$B$4+C39*$C$4+H39*$H$4*IF(E39="Ν",1.05,1)),0)/2,"") -> 
A40: 02066 | B40: 9 | C40: 9 | D40: 0 | F40: =ROUND(2*(B40*$B$4+C40*$C$4+D40*$D$4*IF(E40="Ν",1.05,1)),0)/2 -> 2.5 | H40: 4 | I40: =IF(H40>0,ROUND(2*(B40*$B$4+C40*$C$4+H40*$H$4*IF(E40="Ν",1.05,1)),0)/2,"") -> 5.5
A41: 02071 | B41: 8 | C41: 10 | D41: 2.4 | F41: =ROUND(2*(B41*$B$4+C41*$C$4+D41*$D$4*IF(E41="Ν",1.05,1)),0)/2 -> 4 | G41: αλλαγή 8/9 | H41: 5.2 | I41: =IF(H41>0,ROUND(2*(B41*$B$4+C41*$C$4+H41*$H$4*IF(E41="Ν",1.05,1)),0)/2,"") -> 6
A42: 03006 | B42: 7 | D42: 1.3 | F42: =ROUND(2*(B42*$B$4+C42*$C$4+D42*$D$4*IF(E42="Ν",1.05,1)),0)/2 -> 1.5 | I42: =IF(H42>0,ROUND(2*(B42*$B$4+C42*$C$4+H42*$H$4*IF(E42="Ν",1.05,1)),0)/2,"") -> 
A43: 03018 | B43: 7.5 | F43: =ROUND(2*(B43*$B$4+C43*$C$4+D43*$D$4*IF(E43="Ν",1.05,1)),0)/2 -> 1 | I43: =IF(H43>0,ROUND(2*(B43*$B$4+C43*$C$4+H43*$H$4*IF(E43="Ν",1.05,1)),0)/2,"") -> 
A44: 03021 | B44: 5 | F44: =ROUND(2*(B44*$B$4+C44*$C$4+D44*$D$4*IF(E44="Ν",1.05,1)),0)/2 -> 0.5 | I44: =IF(H44>0,ROUND(2*(B44*$B$4+C44*$C$4+H44*$H$4*IF(E44="Ν",1.05,1)),0)/2,"") -> 
A45: 03027 | B45: 10 | C45: 7 | D45: 6.8 | E45: Ν | F45: =ROUND(2*(B45*$B$4+C45*$C$4+D45*$D$4*IF(E45="Ν",1.05,1)),0)/2 -> 7.5 | I45: =IF(H45>0,ROUND(2*(B45*$B$4+C45*$C$4+H45*$H$4*IF(E45="Ν",1.05,1)),0)/2,"") -> 
A46: 03045 | B46: 6 | C46: 8 | E46: Ν | F46: =ROUND(2*(B46*$B$4+C46*$C$4+D46*$D$4*IF(E46="Ν",1.05,1)),0)/2 -> 2 | H46: 4.8 | I46: =IF(H46>0,ROUND(2*(B46*$B$4+C46*$C$4+H46*$H$4*IF(E46="Ν",1.05,1)),0)/2,"") -> 5.5
A47: 03053 | B47: 7 | D47: 1.9 | F47: =ROUND(2*(B47*$B$4+C47*$C$4+D47*$D$4*IF(E47="Ν",1.05,1)),0)/2 -> 2 | I47: =IF(H47>0,ROUND(2*(B47*$B$4+C47*$C$4+H47*$H$4*IF(E47="Ν",1.05,1)),0)/2,"") -> 
A48: 03059 | B48: 7 | F48: =ROUND(2*(B48*$B$4+C48*$C$4+D48*$D$4*IF(E48="Ν",1.05,1)),0)/2 -> 0.5 | I48: =IF(H48>0,ROUND(2*(B48*$B$4+C48*$C$4+H48*$H$4*IF(E48="Ν",1.05,1)),0)/2,"") -> 
A49: 03070 | B49: 7 | D49: 1.9 | F49: =ROUND(2*(B49*$B$4+C49*$C$4+D49*$D$4*IF(E49="Ν",1.05,1)),0)/2 -> 2 | I49: =IF(H49>0,ROUND(2*(B49*$B$4+C49*$C$4+H49*$H$4*IF(E49="Ν",1.05,1)),0)/2,"") -> 
A50: 03071 | B50: 10 | D50: 5 | F50: =ROUND(2*(B50*$B$4+C50*$C$4+D50*$D$4*IF(E50="Ν",1.05,1)),0)/2 -> 5 | I50: =IF(H50>0,ROUND(2*(B50*$B$4+C50*$C$4+H50*$H$4*IF(E50="Ν",1.05,1)),0)/2,"") -> 
A51: 03072 | B51: 10 | C51: 10 | D51: 7.6 | F51: =ROUND(2*(B51*$B$4+C51*$C$4+D51*$D$4*IF(E51="Ν",1.05,1)),0)/2 -> 8 | I51: =IF(H51>0,ROUND(2*(B51*$B$4+C51*$C$4+H51*$H$4*IF(E51="Ν",1.05,1)),0)/2,"") -> 
A52: 04002 | B52: 9 | D52: 2.9 | F52: =ROUND(2*(B52*$B$4+C52*$C$4+D52*$D$4*IF(E52="Ν",1.05,1)),0)/2 -> 3 | H52: 2 | I52: =IF(H52>0,ROUND(2*(B52*$B$4+C52*$C$4+H52*$H$4*IF(E52="Ν",1.05,1)),0)/2,"") -> 2.5
A53: 04003 | B53: 7 | F53: =ROUND(2*(B53*$B$4+C53*$C$4+D53*$D$4*IF(E53="Ν",1.05,1)),0)/2 -> 0.5 | H53: 6.6 | I53: =IF(H53>0,ROUND(2*(B53*$B$4+C53*$C$4+H53*$H$4*IF(E53="Ν",1.05,1)),0)/2,"") -> 5.5
A54: 04004 | B54: 4 | F54: =ROUND(2*(B54*$B$4+C54*$C$4+D54*$D$4*IF(E54="Ν",1.05,1)),0)/2 -> 0.5 | I54: =IF(H54>0,ROUND(2*(B54*$B$4+C54*$C$4+H54*$H$4*IF(E54="Ν",1.05,1)),0)/2,"") -> 
A55: 04006 | B55: 9 | C55: 10 | D55: 6.6 | F55: =ROUND(2*(B55*$B$4+C55*$C$4+D55*$D$4*IF(E55="Ν",1.05,1)),0)/2 -> 7.5 | I55: =IF(H55>0,ROUND(2*(B55*$B$4+C55*$C$4+H55*$H$4*IF(E55="Ν",1.05,1)),0)/2,"") -> 
A56: 04008 | B56: 7 | D56: 0 | F56: =ROUND(2*(B56*$B$4+C56*$C$4+D56*$D$4*IF(E56="Ν",1.05,1)),0)/2 -> 0.5 | H56: 4.6 | I56: =IF(H56>0,ROUND(2*(B56*$B$4+C56*$C$4+H56*$H$4*IF(E56="Ν",1.05,1)),0)/2,"") -> 4
A57: 04014 | D57: 1.3 | F57: =ROUND(2*(B57*$B$4+C57*$C$4+D57*$D$4*IF(E57="Ν",1.05,1)),0)/2 -> 1 | I57: =IF(H57>0,ROUND(2*(B57*$B$4+C57*$C$4+H57*$H$4*IF(E57="Ν",1.05,1)),0)/2,"") -> 
A58: 04015 | B58: 7 | D58: 3.5 | F58: =ROUND(2*(B58*$B$4+C58*$C$4+D58*$D$4*IF(E58="Ν",1.05,1)),0)/2 -> 3.5 | H58: 3.6 | I58: =IF(H58>0,ROUND(2*(B58*$B$4+C58*$C$4+H58*$H$4*IF(E58="Ν",1.05,1)),0)/2,"") -> 3.5
A59: 04016 | D59: 0 | F59: =ROUND(2*(B59*$B$4+C59*$C$4+D59*$D$4*IF(E59="Ν",1.05,1)),0)/2 -> 0 | H59: 2.9 | I59: =IF(H59>0,ROUND(2*(B59*$B$4+C59*$C$4+H59*$H$4*IF(E59="Ν",1.05,1)),0)/2,"") -> 2
A60: 04017 | B60: 4 | D60: 1.6 | F60: =ROUND(2*(B60*$B$4+C60*$C$4+D60*$D$4*IF(E60="Ν",1.05,1)),0)/2 -> 1.5 | H60: 4.5 | I60: =IF(H60>0,ROUND(2*(B60*$B$4+C60*$C$4+H60*$H$4*IF(E60="Ν",1.05,1)),0)/2,"") -> 4
A61: 04019 | B61: 6 | D61: 3.2 | F61: =ROUND(2*(B61*$B$4+C61*$C$4+D61*$D$4*IF(E61="Ν",1.05,1)),0)/2 -> 3 | H61: 6 | I61: =IF(H61>0,ROUND(2*(B61*$B$4+C61*$C$4+H61*$H$4*IF(E61="Ν",1.05,1)),0)/2,"") -> 5
A62: 04022 | B62: 9 | F62: =ROUND(2*(B62*$B$4+C62*$C$4+D62*$D$4*IF(E62="Ν",1.05,1)),0)/2 -> 1 | I62: =IF(H62>0,ROUND(2*(B62*$B$4+C62*$C$4+H62*$H$4*IF(E62="Ν",1.05,1)),0)/2,"") -> 
A63: 04024 | B63: 9 | D63: 0 | F63: =ROUND(2*(B63*$B$4+C63*$C$4+D63*$D$4*IF(E63="Ν",1.05,1)),0)/2 -> 1 | I63: =IF(H63>0,ROUND(2*(B63*$B$4+C63*$C$4+H63*$H$4*IF(E63="Ν",1.05,1)),0)/2,"") -> 
A64: 04025 | B64: 10 | C64: 8 | D64: 5.3 | F64: =ROUND(2*(B64*$B$4+C64*$C$4+D64*$D$4*IF(E64="Ν",1.05,1)),0)/2 -> 6 | H64: 7.4 | I64: =IF(H64>0,ROUND(2*(B64*$B$4+C64*$C$4+H64*$H$4*IF(E64="Ν",1.05,1)),0)/2,"") -> 8
A65: 04026 | B65: 5 | D65: 3.3 | F65: =ROUND(2*(B65*$B$4+C65*$C$4+D65*$D$4*IF(E65="Ν",1.05,1)),0)/2 -> 3 | H65: 4.5 | I65: =IF(H65>0,ROUND(2*(B65*$B$4+C65*$C$4+H65*$H$4*IF(E65="Ν",1.05,1)),0)/2,"") -> 4
A66: 04030 | B66: 7 | D66: 3.2 | F66: =ROUND(2*(B66*$B$4+C66*$C$4+D66*$D$4*IF(E66="Ν",1.05,1)),0)/2 -> 3 | H66: 4.7 | I66: =IF(H66>0,ROUND(2*(B66*$B$4+C66*$C$4+H66*$H$4*IF(E66="Ν",1.05,1)),0)/2,"") -> 4
A67: 04031 | B67: 6.5 | C67: 6 | D67: 2.3 | F67: =ROUND(2*(B67*$B$4+C67*$C$4+D67*$D$4*IF(E67="Ν",1.05,1)),0)/2 -> 3.5 | H67: 3.2 | I67: =IF(H67>0,ROUND(2*(B67*$B$4+C67*$C$4+H67*$H$4*IF(E67="Ν",1.05,1)),0)/2,"") -> 4
A68: 04032 | B68: 10 | D68: 3.8 | F68: =ROUND(2*(B68*$B$4+C68*$C$4+D68*$D$4*IF(E68="Ν",1.05,1)),0)/2 -> 4 | H68: 6.3 | I68: =IF(H68>0,ROUND(2*(B68*$B$4+C68*$C$4+H68*$H$4*IF(E68="Ν",1.05,1)),0)/2,"") -> 5.5
A69: 04034 | B69: 8 | D69: 2.5 | F69: =ROUND(2*(B69*$B$4+C69*$C$4+D69*$D$4*IF(E69="Ν",1.05,1)),0)/2 -> 2.5 | H69: 4.5 | I69: =IF(H69>0,ROUND(2*(B69*$B$4+C69*$C$4+H69*$H$4*IF(E69="Ν",1.05,1)),0)/2,"") -> 4
A70: 04035 | B70: 8 | D70: 3.6 | F70: =ROUND(2*(B70*$B$4+C70*$C$4+D70*$D$4*IF(E70="Ν",1.05,1)),0)/2 -> 3.5 | I70: =IF(H70>0,ROUND(2*(B70*$B$4+C70*$C$4+H70*$H$4*IF(E70="Ν",1.05,1)),0)/2,"") -> 
A71: 04039 | B71: 6 | D71: 3.2 | F71: =ROUND(2*(B71*$B$4+C71*$C$4+D71*$D$4*IF(E71="Ν",1.05,1)),0)/2 -> 3 | H71: 7.1 | I71: =IF(H71>0,ROUND(2*(B71*$B$4+C71*$C$4+H71*$H$4*IF(E71="Ν",1.05,1)),0)/2,"") -> 6
A72: 04040 | B72: 9 | D72: 2.2 | F72: =ROUND(2*(B72*$B$4+C72*$C$4+D72*$D$4*IF(E72="Ν",1.05,1)),0)/2 -> 2.5 | H72: 6.4 | I72: =IF(H72>0,ROUND(2*(B72*$B$4+C72*$C$4+H72*$H$4*IF(E72="Ν",1.05,1)),0)/2,"") -> 5.5
A73: 04041 | B73: 9 | D73: 3.6 | F73: =ROUND(2*(B73*$B$4+C73*$C$4+D73*$D$4*IF(E73="Ν",1.05,1)),0)/2 -> 3.5 | H73: 6.8 | I73: =IF(H73>0,ROUND(2*(B73*$B$4+C73*$C$4+H73*$H$4*IF(E73="Ν",1.05,1)),0)/2,"") -> 6
A74: 04044 | B74: 10 | C74: 10 | D74: 0 | E74: Ν | F74: =ROUND(2*(B74*$B$4+C74*$C$4+D74*$D$4*IF(E74="Ν",1.05,1)),0)/2 -> 2.5 | H74: 5.6 | I74: =IF(H74>0,ROUND(2*(B74*$B$4+C74*$C$4+H74*$H$4*IF(E74="Ν",1.05,1)),0)/2,"") -> 7
A75: 04046 | B75: 7.5 | C75: 6 | D75: 5.4 | F75: =ROUND(2*(B75*$B$4+C75*$C$4+D75*$D$4*IF(E75="Ν",1.05,1)),0)/2 -> 5.5 | H75: 4.2 | I75: =IF(H75>0,ROUND(2*(B75*$B$4+C75*$C$4+H75*$H$4*IF(E75="Ν",1.05,1)),0)/2,"") -> 5
A76: 04048 | B76: 8 | D76: 2.7 | F76: =ROUND(2*(B76*$B$4+C76*$C$4+D76*$D$4*IF(E76="Ν",1.05,1)),0)/2 -> 3 | H76: 6.3 | I76: =IF(H76>0,ROUND(2*(B76*$B$4+C76*$C$4+H76*$H$4*IF(E76="Ν",1.05,1)),0)/2,"") -> 5.5
A77: 04050 | D77: 1.4 | F77: =ROUND(2*(B77*$B$4+C77*$C$4+D77*$D$4*IF(E77="Ν",1.05,1)),0)/2 -> 1 | H77: 5.1 | I77: =IF(H77>0,ROUND(2*(B77*$B$4+C77*$C$4+H77*$H$4*IF(E77="Ν",1.05,1)),0)/2,"") -> 4
A78: 04051 | B78: 8.5 | C78: 7.5 | D78: 3.6 | F78: =ROUND(2*(B78*$B$4+C78*$C$4+D78*$D$4*IF(E78="Ν",1.05,1)),0)/2 -> 4.5 | H78: 6.8 | I78: =IF(H78>0,ROUND(2*(B78*$B$4+C78*$C$4+H78*$H$4*IF(E78="Ν",1.05,1)),0)/2,"") -> 7
A79: 04053 | B79: 9 | D79: 4.5 | E79: Ν | F79: =ROUND(2*(B79*$B$4+C79*$C$4+D79*$D$4*IF(E79="Ν",1.05,1)),0)/2 -> 4.5 | H79: 6.5 | I79: =IF(H79>0,ROUND(2*(B79*$B$4+C79*$C$4+H79*$H$4*IF(E79="Ν",1.05,1)),0)/2,"") -> 6
A80: 04061 | H80: 2.5 | I80: =IF(H80>0,ROUND(2*(B80*$B$4+C80*$C$4+H80*$H$4*IF(E80="Ν",1.05,1)),0)/2,"") -> 2
A81: 04065 | B81: 6 | F81: =ROUND(2*(B81*$B$4+C81*$C$4+D81*$D$4*IF(E81="Ν",1.05,1)),0)/2 -> 0.5 | I81: =IF(H81>0,ROUND(2*(B81*$B$4+C81*$C$4+H81*$H$4*IF(E81="Ν",1.05,1)),0)/2,"") -> 
A82: 04066 | B82: 7 | C82: 7 | D82: 1.9 | F82: =ROUND(2*(B82*$B$4+C82*$C$4+D82*$D$4*IF(E82="Ν",1.05,1)),0)/2 -> 3 | H82: 4 | I82: =IF(H82>0,ROUND(2*(B82*$B$4+C82*$C$4+H82*$H$4*IF(E82="Ν",1.05,1)),0)/2,"") -> 5
A83: 04068 | B83: 6 | D83: 1.7 | F83: =ROUND(2*(B83*$B$4+C83*$C$4+D83*$D$4*IF(E83="Ν",1.05,1)),0)/2 -> 2 | H83: 4.4 | I83: =IF(H83>0,ROUND(2*(B83*$B$4+C83*$C$4+H83*$H$4*IF(E83="Ν",1.05,1)),0)/2,"") -> 4
A84: 04069 | B84: 4 | C84: 2 | F84: =ROUND(2*(B84*$B$4+C84*$C$4+D84*$D$4*IF(E84="Ν",1.05,1)),0)/2 -> 0.5 | I84: =IF(H84>0,ROUND(2*(B84*$B$4+C84*$C$4+H84*$H$4*IF(E84="Ν",1.05,1)),0)/2,"") -> 
A85: Πλήθος | B85: =COUNTA(B5:B84) -> 72 | C85: =COUNTA(C5:C84) -> 27 | D85: =COUNTA(D5:D84) -> 58 | E85: =COUNTA(E5:E84) -> 5 | F85: =COUNTA(F5:F84) -> 77 | I85: =SUM(I5:I84) -> 231