A1: ΑρΜητρ | B1: Ασκ1 | D1: Ασκ2 | E1: ΔιαγΙαν | F1: Βαθμός | G1: Τελικός
B2: 0.2 | D2: 0.2 | E2: 0.6 | F2: 1 | G2: βαθμός
A3: 511/2000002 | D3: 8 | E3: 6 | F3: =B3*$B$2+D3*$D$2+E3*$E$2 -> 5.2 | G3: =ROUND(2*F3,0)/2 -> 5
A4: 511/2000037 | D4: 9 | E4: 5.1 | F4: =B4*$B$2+D4*$D$2+E4*$E$2 -> 4.86 | G4: =ROUND(2*F4,0)/2 -> 5
A5: 511/2000042 | E5: 4.2 | F5: =B5*$B$2+D5*$D$2+E5*$E$2 -> 2.52 | G5: =ROUND(2*F5,0)/2 -> 2.5
A6: 511/2000043 | B6: 5.5 | C6: Μικρο, φτωχο | D6: 7 | E6: 6 | F6: =B6*$B$2+D6*$D$2+E6*$E$2 -> 6.1 | G6: =ROUND(2*F6,0)/2 -> 6
A7: 511/2000066 | B7: 3.5 | C7: Εκτός θέματος, χωρις πηγες, χωρις ΠΠΤ | F7: =B7*$B$2+D7*$D$2+E7*$E$2 -> 0.7 | G7: =ROUND(2*F7,0)/2 -> 0.5
A8: 511/2000067 | B8: 5 | C8: , όχι εντυπη | D8: 8.5 | E8: 4.1 | F8: =B8*$B$2+D8*$D$2+E8*$E$2 -> 5.16 | G8: =ROUND(2*F8,0)/2 -> 5
A9: 511/2000068 | F9: =B9*$B$2+D9*$D$2+E9*$E$2 -> 0 | G9: =ROUND(2*F9,0)/2 -> 0
A10: 511/2000071 | D10: 8.5 | E10: 5.9 | F10: =B10*$B$2+D10*$D$2+E10*$E$2 -> 5.24 | G10: =ROUND(2*F10,0)/2 -> 5
A11: 511/2000073 | F11: =B11*$B$2+D11*$D$2+E11*$E$2 -> 0 | G11: =ROUND(2*F11,0)/2 -> 0
A12: 511/2000077 | F12: =B12*$B$2+D12*$D$2+E12*$E$2 -> 0 | G12: =ROUND(2*F12,0)/2 -> 0
A13: 511/2001003 | D13: 7 | E13: 4.5 | F13: =B13*$B$2+D13*$D$2+E13*$E$2 -> 4.1 | G13: =ROUND(2*F13,0)/2 -> 4
A14: 511/2001006 | B14: 6.5 | C14: , όχι εντυπη | D14: 6.5 | E14: 5.3 | F14: =B14*$B$2+D14*$D$2+E14*$E$2 -> 5.78 | G14: =ROUND(2*F14,0)/2 -> 6
A15: 511/2001009 | B15: 9.5 | D15: 7.5 | E15: 2.8 | F15: =B15*$B$2+D15*$D$2+E15*$E$2 -> 5.08 | G15: =ROUND(2*F15,0)/2 -> 5
A16: 511/2001012 | B16: 6.5 | C16: σε δυο εμαιλ, όχι εντυπη | D16: 8.5 | E16: 5.1 | F16: =B16*$B$2+D16*$D$2+E16*$E$2 -> 6.06 | G16: =ROUND(2*F16,0)/2 -> 6
A17: 511/2001019 | F17: =B17*$B$2+D17*$D$2+E17*$E$2 -> 0 | G17: =ROUND(2*F17,0)/2 -> 0
A18: 511/2001026 | B18: 8.5 | C18: Εντός θέματος, φτωχο ΠΠΤ | D18: 7 | E18: 3.6 | F18: =B18*$B$2+D18*$D$2+E18*$E$2 -> 5.26 | G18: =ROUND(2*F18,0)/2 -> 5.5
A19: 511/2001034 | F19: =B19*$B$2+D19*$D$2+E19*$E$2 -> 0 | G19: =ROUND(2*F19,0)/2 -> 0
A20: 511/2001037 | B20: 7.5 | D20: 7 | E20: 6.7 | F20: =B20*$B$2+D20*$D$2+E20*$E$2 -> 6.92 | G20: =ROUND(2*F20,0)/2 -> 7
A21: 511/2001038 | B21: 7.5 | D21: 7 | E21: 4.5 | F21: =B21*$B$2+D21*$D$2+E21*$E$2 -> 5.6 | G21: =ROUND(2*F21,0)/2 -> 5.5
A22: 511/2001047 | B22: 9 | D22: 9 | E22: 5.8 | F22: =B22*$B$2+D22*$D$2+E22*$E$2 -> 7.08 | G22: =ROUND(2*F22,0)/2 -> 7
A23: 511/2001049 | B23: 9 | D23: 7 | E23: 5.1 | F23: =B23*$B$2+D23*$D$2+E23*$E$2 -> 6.26 | G23: =ROUND(2*F23,0)/2 -> 6.5
A24: 511/2001056 | B24: 8.5 | C24: , όχι εντυπη | D24: 6.5 | E24: 5 | F24: =B24*$B$2+D24*$D$2+E24*$E$2 -> 6 | G24: =ROUND(2*F24,0)/2 -> 6
A25: 511/2001069 | B25: 4 | C25: διορθώσεις στις σημειώσεις | D25: 7 | E25: 5.1 | F25: =B25*$B$2+D25*$D$2+E25*$E$2 -> 5.26 | G25: =ROUND(2*F25,0)/2 -> 5.5
A26: 511/2001074 | D26: 6.5 | E26: 5.5 | F26: =B26*$B$2+D26*$D$2+E26*$E$2 -> 4.6 | G26: =ROUND(2*F26,0)/2 -> 4.5
A27: 511/2002022 | F27: =B27*$B$2+D27*$D$2+E27*$E$2 -> 0 | G27: =ROUND(2*F27,0)/2 -> 0
A28: 511/2002024 | F28: =B28*$B$2+D28*$D$2+E28*$E$2 -> 0 | G28: =ROUND(2*F28,0)/2 -> 0
A29: 511/2002029 | B29: 8 | D29: 8.5 | E29: 5 | F29: =B29*$B$2+D29*$D$2+E29*$E$2 -> 6.3 | G29: =ROUND(2*F29,0)/2 -> 6.5
A30: 511/2002031 | B30: 8.5 | D30: 8.5 | E30: 3.8 | F30: =B30*$B$2+D30*$D$2+E30*$E$2 -> 5.68 | G30: =ROUND(2*F30,0)/2 -> 5.5
A31: 511/2002037 | B31: 8.5 | D31: 9 | E31: 5.1 | F31: =B31*$B$2+D31*$D$2+E31*$E$2 -> 6.56 | G31: =ROUND(2*F31,0)/2 -> 6.5
A32: 511/2002038 | B32: 5.5 | C32: Καλογραμμένη, αλλά εκτός θέματος, επικεντρώθηκε στην πειρατία που υπάρχει νομοθεσία, όχι εντυπη | D32: 5 | E32: 4.5 | F32: =B32*$B$2+D32*$D$2+E32*$E$2 -> 4.8 | G32: =ROUND(2*F32,0)/2 -> 5
A33: 511/2002047 | B33: 1.5 | C33: , όχι εντυπη | F33: =B33*$B$2+D33*$D$2+E33*$E$2 -> 0.3 | G33: =ROUND(2*F33,0)/2 -> 0.5
A34: 511/2002060 | D34: 8 | E34: 8.4 | F34: =B34*$B$2+D34*$D$2+E34*$E$2 -> 6.64 | G34: =ROUND(2*F34,0)/2 -> 6.5
A35: 511/2002065 | B35: 9 | C35: Εντός θέματος, φτωχο ΠΠΤ | D35: 8 | E35: 4.2 | F35: =B35*$B$2+D35*$D$2+E35*$E$2 -> 5.92 | G35: =ROUND(2*F35,0)/2 -> 6
A36: 511/2002066 | B36: 8 | D36: 9 | E36: 4.7 | F36: =B36*$B$2+D36*$D$2+E36*$E$2 -> 6.22 | G36: =ROUND(2*F36,0)/2 -> 6
A37: 511/2002067 | F37: =B37*$B$2+D37*$D$2+E37*$E$2 -> 0 | G37: =ROUND(2*F37,0)/2 -> 0
A38: 511/2003007 | F38: =B38*$B$2+D38*$D$2+E38*$E$2 -> 0 | G38: =ROUND(2*F38,0)/2 -> 0
A39: 511/2003009 | B39: 8.5 | D39: 7 | E39: 4.3 | F39: =B39*$B$2+D39*$D$2+E39*$E$2 -> 5.68 | G39: =ROUND(2*F39,0)/2 -> 5.5
A40: 511/2003023 | B40: 6.5 | D40: 7 | E40: 4.4 | F40: =B40*$B$2+D40*$D$2+E40*$E$2 -> 5.34 | G40: =ROUND(2*F40,0)/2 -> 5.5
A41: 511/2003028 | B41: 7 | D41: 7 | E41: 4.6 | F41: =B41*$B$2+D41*$D$2+E41*$E$2 -> 5.56 | G41: =ROUND(2*F41,0)/2 -> 5.5
A42: 511/2003041 | B42: 6.5 | E42: 1.5 | F42: =B42*$B$2+D42*$D$2+E42*$E$2 -> 2.2 | G42: =ROUND(2*F42,0)/2 -> 2
A43: 511/2003045 | B43: 8.5 | C43: Μονο το μεγεθος | D43: 7 | E43: 4.5 | F43: =B43*$B$2+D43*$D$2+E43*$E$2 -> 5.8 | G43: =ROUND(2*F43,0)/2 -> 6
A44: 511/2003058 | B44: 6.5 | D44: 7 | E44: 4.6 | F44: =B44*$B$2+D44*$D$2+E44*$E$2 -> 5.46 | G44: =ROUND(2*F44,0)/2 -> 5.5
A45: 511/2003061 | B45: 6 | C45: Εκτός θέματος | F45: =B45*$B$2+D45*$D$2+E45*$E$2 -> 1.2 | G45: =ROUND(2*F45,0)/2 -> 1
A46: 511/2003068 | F46: =B46*$B$2+D46*$D$2+E46*$E$2 -> 0 | G46: =ROUND(2*F46,0)/2 -> 0
A47: 511/2003071 | D47: 7.5 | E47: 6.3 | F47: =B47*$B$2+D47*$D$2+E47*$E$2 -> 5.28 | G47: =ROUND(2*F47,0)/2 -> 5.5
A48: 511/2003072 | B48: 9 | E48: 6.1 | F48: =B48*$B$2+D48*$D$2+E48*$E$2 -> 5.46 | G48: =ROUND(2*F48,0)/2 -> 5.5
A49: 511/2004002 | B49: 7.5 | C49: Περισσοτερο ψαξιμο | D49: 6 | E49: 7.2 | F49: =B49*$B$2+D49*$D$2+E49*$E$2 -> 7.02 | G49: =ROUND(2*F49,0)/2 -> 7
A50: 511/2004003 | B50: 5.5 | C50: μικρη | E50: 1.4 | F50: =B50*$B$2+D50*$D$2+E50*$E$2 -> 1.94 | G50: =ROUND(2*F50,0)/2 -> 2
A51: 511/2004004 | F51: =B51*$B$2+D51*$D$2+E51*$E$2 -> 0 | G51: =ROUND(2*F51,0)/2 -> 0
A52: 511/2004006 | B52: 8 | D52: 6 | E52: 5.4 | F52: =B52*$B$2+D52*$D$2+E52*$E$2 -> 6.04 | G52: =ROUND(2*F52,0)/2 -> 6
A53: 511/2004007 | F53: =B53*$B$2+D53*$D$2+E53*$E$2 -> 0 | G53: =ROUND(2*F53,0)/2 -> 0
A54: 511/2004008 | B54: 7.5 | C54: Ελαφρως εκτός θεματος, μεγεθος | D54: 7.5 | E54: 6.9 | F54: =B54*$B$2+D54*$D$2+E54*$E$2 -> 7.14 | G54: =ROUND(2*F54,0)/2 -> 7
A55: 511/2004009 | B55: 5.5 | C55: Μικρο, φτωχο | D55: 7 | E55: 4.2 | F55: =B55*$B$2+D55*$D$2+E55*$E$2 -> 5.02 | G55: =ROUND(2*F55,0)/2 -> 5
A56: 511/2004011 | B56: 7 | C56: Καλο, μεγαλο, χωρις πηγες και βγαινει και εκτος θεματος | E56: 4.1 | F56: =B56*$B$2+D56*$D$2+E56*$E$2 -> 3.86 | G56: =ROUND(2*F56,0)/2 -> 4
A57: 511/2004012 | E57: 4.1 | F57: =B57*$B$2+D57*$D$2+E57*$E$2 -> 2.46 | G57: =ROUND(2*F57,0)/2 -> 2.5
A58: 511/2004013 | D58: 8 | E58: 5.6 | F58: =B58*$B$2+D58*$D$2+E58*$E$2 -> 4.96 | G58: =ROUND(2*F58,0)/2 -> 5
A59: 511/2004014 | B59: 7 | C59: πηγες | D59: 7.5 | E59: 3.8 | F59: =B59*$B$2+D59*$D$2+E59*$E$2 -> 5.18 | G59: =ROUND(2*F59,0)/2 -> 5
A60: 511/2004015 | B60: 7 | C60: κοπι&παστε | D60: 7.5 | E60: 6.6 | F60: =B60*$B$2+D60*$D$2+E60*$E$2 -> 6.86 | G60: =ROUND(2*F60,0)/2 -> 7
A61: 511/2004016 | B61: 8.5 | D61: 7.5 | E61: 4.5 | F61: =B61*$B$2+D61*$D$2+E61*$E$2 -> 5.9 | G61: =ROUND(2*F61,0)/2 -> 6
A62: 511/2004017 | E62: 5.4 | F62: =B62*$B$2+D62*$D$2+E62*$E$2 -> 3.24 | G62: =ROUND(2*F62,0)/2 -> 3
A63: 511/2004019 | B63: 6 | E63: 4.1 | F63: =B63*$B$2+D63*$D$2+E63*$E$2 -> 3.66 | G63: =ROUND(2*F63,0)/2 -> 3.5
A64: 511/2004021 | B64: 10 | D64: 7.5 | E64: 6.1 | F64: =B64*$B$2+D64*$D$2+E64*$E$2 -> 7.16 | G64: =ROUND(2*F64,0)/2 -> 7
A65: 511/2004022 | B65: 7.5 | D65: 7 | E65: 4.2 | F65: =B65*$B$2+D65*$D$2+E65*$E$2 -> 5.42 | G65: =ROUND(2*F65,0)/2 -> 5.5
A66: 511/2004023 | B66: 8 | D66: 7 | E66: 5.5 | F66: =B66*$B$2+D66*$D$2+E66*$E$2 -> 6.3 | G66: =ROUND(2*F66,0)/2 -> 6.5
A67: 511/2004024 | B67: 7 | D67: 6 | E67: 3.8 | F67: =B67*$B$2+D67*$D$2+E67*$E$2 -> 4.88 | G67: =ROUND(2*F67,0)/2 -> 5
A68: 511/2004025 | B68: 8.5 | D68: 7.5 | E68: 6.2 | F68: =B68*$B$2+D68*$D$2+E68*$E$2 -> 6.92 | G68: =ROUND(2*F68,0)/2 -> 7
A69: 511/2004026 | F69: =B69*$B$2+D69*$D$2+E69*$E$2 -> 0 | G69: =ROUND(2*F69,0)/2 -> 0
A70: 511/2004027 | B70: 6.5 | D70: 8 | E70: 5.5 | F70: =B70*$B$2+D70*$D$2+E70*$E$2 -> 6.2 | G70: =ROUND(2*F70,0)/2 -> 6
A71: 511/2004030 | B71: 9 | D71: 7.5 | E71: 4 | F71: =B71*$B$2+D71*$D$2+E71*$E$2 -> 5.7 | G71: =ROUND(2*F71,0)/2 -> 5.5
A72: 511/2004031 | B72: 8.5 | E72: 7.1 | F72: =B72*$B$2+D72*$D$2+E72*$E$2 -> 5.96 | G72: =ROUND(2*F72,0)/2 -> 6
A73: 511/2004032 | B73: 6.5 | C73: Καταλαβαινει τι γραφει; | D73: 7.5 | E73: 7.5 | F73: =B73*$B$2+D73*$D$2+E73*$E$2 -> 7.3 | G73: =ROUND(2*F73,0)/2 -> 7.5
A74: 511/2004033 | F74: =B74*$B$2+D74*$D$2+E74*$E$2 -> 0 | G74: =ROUND(2*F74,0)/2 -> 0
A75: 511/2004034 | B75: 7.5 | D75: 7.5 | E75: 6 | F75: =B75*$B$2+D75*$D$2+E75*$E$2 -> 6.6 | G75: =ROUND(2*F75,0)/2 -> 6.5
A76: 511/2004035 | E76: 3.2 | F76: =B76*$B$2+D76*$D$2+E76*$E$2 -> 1.92 | G76: =ROUND(2*F76,0)/2 -> 2
A77: 511/2004036 | B77: 5.5 | C77: Άλλη εταιρία, , όχι εντυπη | E77: 6.3 | F77: =B77*$B$2+D77*$D$2+E77*$E$2 -> 4.88 | G77: =ROUND(2*F77,0)/2 -> 5
A78: 511/2004038 | B78: 9 | D78: 7 | E78: 6.6 | F78: =B78*$B$2+D78*$D$2+E78*$E$2 -> 7.16 | G78: =ROUND(2*F78,0)/2 -> 7
A79: 511/2004039 | B79: 9 | D79: 7 | E79: 5.6 | F79: =B79*$B$2+D79*$D$2+E79*$E$2 -> 6.56 | G79: =ROUND(2*F79,0)/2 -> 6.5
A80: 511/2004040 | B80: 9.5 | C80: Καλη ερευνα, φτωχο ΠΠΤ | D80: 7.5 | E80: 4.1 | F80: =B80*$B$2+D80*$D$2+E80*$E$2 -> 5.86 | G80: =ROUND(2*F80,0)/2 -> 6
A81: 511/2004041 | B81: 8.5 | D81: 7.5 | E81: 6.3 | F81: =B81*$B$2+D81*$D$2+E81*$E$2 -> 6.98 | G81: =ROUND(2*F81,0)/2 -> 7
A82: 511/2004042 | B82: 5.5 | C82: μικρη, χωρις πηγες | D82: 7 | E82: 4.6 | F82: =B82*$B$2+D82*$D$2+E82*$E$2 -> 5.26 | G82: =ROUND(2*F82,0)/2 -> 5.5
A83: 511/2004044 | B83: 9.5 | D83: 8 | E83: 5.3 | F83: =B83*$B$2+D83*$D$2+E83*$E$2 -> 6.68 | G83: =ROUND(2*F83,0)/2 -> 6.5
A84: 511/2004045 | F84: =B84*$B$2+D84*$D$2+E84*$E$2 -> 0 | G84: =ROUND(2*F84,0)/2 -> 0
A85: 511/2004046 | B85: 8.5 | D85: 7.5 | E85: 5.5 | F85: =B85*$B$2+D85*$D$2+E85*$E$2 -> 6.5 | G85: =ROUND(2*F85,0)/2 -> 6.5
A86: 511/2004047 | F86: =B86*$B$2+D86*$D$2+E86*$E$2 -> 0 | G86: =ROUND(2*F86,0)/2 -> 0
A87: 511/2004048 | B87: 7.5 | C87: To the point, χωρις πηγες, χωρις φωτο | D87: 8 | E87: 4 | F87: =B87*$B$2+D87*$D$2+E87*$E$2 -> 5.5 | G87: =ROUND(2*F87,0)/2 -> 5.5
A88: 511/2004049 | F88: =B88*$B$2+D88*$D$2+E88*$E$2 -> 0 | G88: =ROUND(2*F88,0)/2 -> 0
A89: 511/2004050 | F89: =B89*$B$2+D89*$D$2+E89*$E$2 -> 0 | G89: =ROUND(2*F89,0)/2 -> 0
A90: 511/2004051 | B90: 7 | D90: 7.5 | E90: 6 | F90: =B90*$B$2+D90*$D$2+E90*$E$2 -> 6.5 | G90: =ROUND(2*F90,0)/2 -> 6.5
A91: 511/2004052 | F91: =B91*$B$2+D91*$D$2+E91*$E$2 -> 0 | G91: =ROUND(2*F91,0)/2 -> 0
A92: 511/2004053 | B92: 8.5 | D92: 8 | E92: 5.2 | F92: =B92*$B$2+D92*$D$2+E92*$E$2 -> 6.42 | G92: =ROUND(2*F92,0)/2 -> 6.5
A93: 511/2004054 | B93: 5.5 | C93: μισο εκτος θεματος, καθολου πηγες, ΠΠΤ | D93: 7.5 | E93: 3.6 | F93: =B93*$B$2+D93*$D$2+E93*$E$2 -> 4.76 | G93: =ROUND(2*F93,0)/2 -> 5
A94: 511/2004055 | F94: =B94*$B$2+D94*$D$2+E94*$E$2 -> 0 | G94: =ROUND(2*F94,0)/2 -> 0
A95: 511/2004056 | B95: 7.5 | D95: 7.5 | E95: 7.4 | F95: =B95*$B$2+D95*$D$2+E95*$E$2 -> 7.44 | G95: =ROUND(2*F95,0)/2 -> 7.5
A96: 511/2004057 | F96: =B96*$B$2+D96*$D$2+E96*$E$2 -> 0 | G96: =ROUND(2*F96,0)/2 -> 0
A97: 511/2004058 | B97: 9 | E97: 5.5 | F97: =B97*$B$2+D97*$D$2+E97*$E$2 -> 5.1 | G97: =ROUND(2*F97,0)/2 -> 5
A98: 511/2004059 | F98: =B98*$B$2+D98*$D$2+E98*$E$2 -> 0 | G98: =ROUND(2*F98,0)/2 -> 0
A99: 511/2004060 | F99: =B99*$B$2+D99*$D$2+E99*$E$2 -> 0 | G99: =ROUND(2*F99,0)/2 -> 0
A100: 511/2004061 | B100: 3.5 | C100: Μικρο, χωρις πηγες, όχι εντυπη | F100: =B100*$B$2+D100*$D$2+E100*$E$2 -> 0.7 | G100: =ROUND(2*F100,0)/2 -> 0.5
A101: 511/2004062 | F101: =B101*$B$2+D101*$D$2+E101*$E$2 -> 0 | G101: =ROUND(2*F101,0)/2 -> 0
A102: 511/2004063 | F102: =B102*$B$2+D102*$D$2+E102*$E$2 -> 0 | G102: =ROUND(2*F102,0)/2 -> 0
A103: 511/2004064 | F103: =B103*$B$2+D103*$D$2+E103*$E$2 -> 0 | G103: =ROUND(2*F103,0)/2 -> 0
A104: 511/2004065 | B104: 7.5 | D104: 6 | E104: 6.8 | F104: =B104*$B$2+D104*$D$2+E104*$E$2 -> 6.78 | G104: =ROUND(2*F104,0)/2 -> 7
A105: 511/2004066 | B105: 7.5 | D105: 6 | E105: 3.6 | F105: =B105*$B$2+D105*$D$2+E105*$E$2 -> 4.86 | G105: =ROUND(2*F105,0)/2 -> 5
A106: 511/2004067 | B106: 6 | C106: Ορθογραφικα, συνταξη, περιεχομενο, ΠΠΤ, μεγεθος | D106: 6 | E106: 1.9 | F106: =B106*$B$2+D106*$D$2+E106*$E$2 -> 3.54 | G106: =ROUND(2*F106,0)/2 -> 3.5
A107: 511/2004068 | B107: 8 | D107: 7.5 | E107: 5.3 | F107: =B107*$B$2+D107*$D$2+E107*$E$2 -> 6.28 | G107: =ROUND(2*F107,0)/2 -> 6.5
E108: =COUNT(E3:E107) -> 75