A1: ΑρΜητρ | B1: Ασκ1 | C1: Ασκ2 | D1: ΔιαγΙαν | E1: Βαθμός | F1: Πριμ | G1: Τελικός
B2: 0.2 | C2: 0.2 | D2: 0.6 | E2: 1 | F2: ="+10%" -> +10% | G2: βαθμός
A3: 01/074 | B3: 5 | C3: 6.5 | D3: 5.9 | E3: =B3*$B$2+C3*$C$2+D3*$D$2 -> 5.84 | G3: =ROUND(2*(E3+F3),0)/2 -> 6
A4: 02/022 | B4: 6 | C4: 6 | D4: 4.9 | E4: =B4*$B$2+C4*$C$2+D4*$D$2 -> 5.34 | G4: =ROUND(2*(E4+F4),0)/2 -> 5.5
A5: 03/002 | B5: 7 | C5: 5.5 | D5: 6.1 | E5: =B5*$B$2+C5*$C$2+D5*$D$2 -> 6.16 | G5: =ROUND(2*(E5+F5),0)/2 -> 6
A6: 03/041 | B6: 8 | C6: 6 | D6: 3.5 | E6: =B6*$B$2+C6*$C$2+D6*$D$2 -> 4.9 | G6: =ROUND(2*(E6+F6),0)/2 -> 5
A7: 03/052 | B7: 6 | C7: 5.5 | D7: 3.8 | E7: =B7*$B$2+C7*$C$2+D7*$D$2 -> 4.58 | G7: =ROUND(2*(E7+F7),0)/2 -> 4.5
A8: 03/059 | B8: 9 | C8: 5.5 | E8: =B8*$B$2+C8*$C$2+D8*$D$2 -> 2.9 | G8: =ROUND(2*(E8+F8),0)/2 -> 3
A9: 04/003 | B9: 8.5 | C9: 6 | D9: 4.7 | E9: =B9*$B$2+C9*$C$2+D9*$D$2 -> 5.72 | G9: =ROUND(2*(E9+F9),0)/2 -> 5.5
A10: 04/004 | B10: 5.5 | C10: 6 | D10: 4.6 | E10: =B10*$B$2+C10*$C$2+D10*$D$2 -> 5.06 | G10: =ROUND(2*(E10+F10),0)/2 -> 5
A11: 04/007 | C11: 7.5 | D11: 7 | E11: =B11*$B$2+C11*$C$2+D11*$D$2 -> 5.7 | G11: =ROUND(2*(E11+F11),0)/2 -> 5.5
A12: 04/011 | B12: 9 | C12: 7.5 | D12: 5.7 | E12: =B12*$B$2+C12*$C$2+D12*$D$2 -> 6.72 | G12: =ROUND(2*(E12+F12),0)/2 -> 6.5
A13: 04/012 | B13: 8 | C13: 8 | D13: 3.3 | E13: =B13*$B$2+C13*$C$2+D13*$D$2 -> 5.18 | G13: =ROUND(2*(E13+F13),0)/2 -> 5
A14: 04/017 | B14: 8 | C14: 6 | D14: 5.9 | E14: =B14*$B$2+C14*$C$2+D14*$D$2 -> 6.34 | G14: =ROUND(2*(E14+F14),0)/2 -> 6.5
A15: 04/019 | B15: 8 | C15: 6 | D15: 5.3 | E15: =B15*$B$2+C15*$C$2+D15*$D$2 -> 5.98 | G15: =ROUND(2*(E15+F15),0)/2 -> 6
A16: 04/026 | B16: 9 | C16: 7.5 | D16: 5.5 | E16: =B16*$B$2+C16*$C$2+D16*$D$2 -> 6.6 | G16: =ROUND(2*(E16+F16),0)/2 -> 6.5
A17: 04/035 | C17: 7.5 | D17: 3.6 | E17: =B17*$B$2+C17*$C$2+D17*$D$2 -> 3.66 | G17: =ROUND(2*(E17+F17),0)/2 -> 3.5
A18: 04/050 | B18: 6 | C18: 7.5 | D18: 4.9 | E18: =B18*$B$2+C18*$C$2+D18*$D$2 -> 5.64 | G18: =ROUND(2*(E18+F18),0)/2 -> 5.5
A19: 04/059 | B19: 5 | C19: 7.5 | D19: 6 | E19: =B19*$B$2+C19*$C$2+D19*$D$2 -> 6.1 | G19: =ROUND(2*(E19+F19),0)/2 -> 6
A20: 05/001 | B20: 9 | C20: 9 | D20: 7 | E20: =B20*$B$2+C20*$C$2+D20*$D$2 -> 7.8 | G20: =ROUND(2*(E20+F20),0)/2 -> 8
A21: 05/002 | B21: 10 | C21: 8.5 | D21: 6.7 | E21: =B21*$B$2+C21*$C$2+D21*$D$2 -> 7.72 | G21: =ROUND(2*(E21+F21),0)/2 -> 7.5
A22: 05/003 | B22: 6 | D22: 2 | E22: =B22*$B$2+C22*$C$2+D22*$D$2 -> 2.4 | G22: =ROUND(2*(E22+F22),0)/2 -> 2.5
A23: 05/004 | B23: 7 | C23: 8.5 | D23: 5.4 | E23: =B23*$B$2+C23*$C$2+D23*$D$2 -> 6.34 | G23: =ROUND(2*(E23+F23),0)/2 -> 6.5
A24: 05/006 | B24: 5 | C24: 7 | D24: 5.2 | E24: =B24*$B$2+C24*$C$2+D24*$D$2 -> 5.52 | G24: =ROUND(2*(E24+F24),0)/2 -> 5.5
A25: 05/007 | C25: 5.5 | D25: 3.6 | E25: =B25*$B$2+C25*$C$2+D25*$D$2 -> 3.26 | F25: =E25*10% -> 0.32600000000000007 | G25: =ROUND(2*(E25+F25),0)/2 -> 3.5
A26: 05/008 | B26: 9 | C26: 9 | D26: 5.5 | E26: =B26*$B$2+C26*$C$2+D26*$D$2 -> 6.9 | G26: =ROUND(2*(E26+F26),0)/2 -> 7
A27: 05/009 | C27: 8 | D27: 4.8 | E27: =B27*$B$2+C27*$C$2+D27*$D$2 -> 4.48 | G27: =ROUND(2*(E27+F27),0)/2 -> 4.5
A28: 05/010 | B28: 6 | C28: 7 | D28: 4.9 | E28: =B28*$B$2+C28*$C$2+D28*$D$2 -> 5.54 | G28: =ROUND(2*(E28+F28),0)/2 -> 5.5
A29: 05/011 | B29: 9 | C29: 7 | D29: 4.6 | E29: =B29*$B$2+C29*$C$2+D29*$D$2 -> 5.96 | G29: =ROUND(2*(E29+F29),0)/2 -> 6
A30: 05/012 | B30: 6 | C30: 8 | D30: 3.8 | E30: =B30*$B$2+C30*$C$2+D30*$D$2 -> 5.08 | G30: =ROUND(2*(E30+F30),0)/2 -> 5
A31: 05/013 | B31: 9 | C31: 8 | D31: 4.5 | E31: =B31*$B$2+C31*$C$2+D31*$D$2 -> 6.1 | G31: =ROUND(2*(E31+F31),0)/2 -> 6
A32: 05/014 | B32: 7 | C32: 8 | D32: 7 | E32: =B32*$B$2+C32*$C$2+D32*$D$2 -> 7.2 | G32: =ROUND(2*(E32+F32),0)/2 -> 7
A33: 05/015 | B33: 6 | D33: 1 | E33: =B33*$B$2+C33*$C$2+D33*$D$2 -> 1.8 | G33: =ROUND(2*(E33+F33),0)/2 -> 2
A34: 05/020 | B34: 7 | C34: 7 | D34: 5.1 | E34: =B34*$B$2+C34*$C$2+D34*$D$2 -> 5.86 | G34: =ROUND(2*(E34+F34),0)/2 -> 6
A35: 05/021 | B35: 6 | C35: 7.5 | D35: 5.7 | E35: =B35*$B$2+C35*$C$2+D35*$D$2 -> 6.12 | G35: =ROUND(2*(E35+F35),0)/2 -> 6
A36: 05/022 | B36: 6 | C36: 5.5 | D36: 3.2 | E36: =B36*$B$2+C36*$C$2+D36*$D$2 -> 4.22 | G36: =ROUND(2*(E36+F36),0)/2 -> 4
A37: 05/023 | B37: 8 | C37: 9 | D37: 5.1 | E37: =B37*$B$2+C37*$C$2+D37*$D$2 -> 6.46 | G37: =ROUND(2*(E37+F37),0)/2 -> 6.5
A38: 05/025 | B38: 9 | C38: 9 | D38: 7.6 | E38: =B38*$B$2+C38*$C$2+D38*$D$2 -> 8.16 | G38: =ROUND(2*(E38+F38),0)/2 -> 8
A39: 05/026 | B39: 8 | C39: 7.5 | D39: 6 | E39: =B39*$B$2+C39*$C$2+D39*$D$2 -> 6.7 | G39: =ROUND(2*(E39+F39),0)/2 -> 6.5
A40: 05/027 | B40: 8 | C40: 7 | D40: 4.9 | E40: =B40*$B$2+C40*$C$2+D40*$D$2 -> 5.94 | G40: =ROUND(2*(E40+F40),0)/2 -> 6
A41: 05/028 | B41: 5 | D41: 3.6 | E41: =B41*$B$2+C41*$C$2+D41*$D$2 -> 3.16 | G41: =ROUND(2*(E41+F41),0)/2 -> 3
A42: 05/029 | B42: 9 | C42: 5.5 | D42: 5.1 | E42: =B42*$B$2+C42*$C$2+D42*$D$2 -> 5.96 | G42: =ROUND(2*(E42+F42),0)/2 -> 6
A43: 05/030 | B43: 5 | C43: 8 | D43: 8 | E43: =B43*$B$2+C43*$C$2+D43*$D$2 -> 7.4 | G43: =ROUND(2*(E43+F43),0)/2 -> 7.5
A44: 05/032 | B44: 8 | C44: 7.5 | E44: =B44*$B$2+C44*$C$2+D44*$D$2 -> 3.1 | G44: =ROUND(2*(E44+F44),0)/2 -> 3
A45: 05/033 | B45: 9 | D45: 6.2 | E45: =B45*$B$2+C45*$C$2+D45*$D$2 -> 5.52 | G45: =ROUND(2*(E45+F45),0)/2 -> 5.5
A46: 05/036 | B46: 9 | C46: 5.5 | D46: 3.2 | E46: =B46*$B$2+C46*$C$2+D46*$D$2 -> 4.82 | G46: =ROUND(2*(E46+F46),0)/2 -> 5
A47: 05/037 | B47: 6 | C47: 8.5 | D47: 8.3 | E47: =B47*$B$2+C47*$C$2+D47*$D$2 -> 7.88 | F47: =E47*10% -> 0.78800000000000014 | G47: =ROUND(2*(E47+F47),0)/2 -> 8.5
A48: 05/038 | B48: 9 | C48: 9 | D48: 7.1 | E48: =B48*$B$2+C48*$C$2+D48*$D$2 -> 7.86 | G48: =ROUND(2*(E48+F48),0)/2 -> 8
A49: 05/039 | B49: 6 | C49: 7 | D49: 4.1 | E49: =B49*$B$2+C49*$C$2+D49*$D$2 -> 5.06 | G49: =ROUND(2*(E49+F49),0)/2 -> 5
A50: 05/040 | B50: 8 | C50: 8 | D50: 5.4 | E50: =B50*$B$2+C50*$C$2+D50*$D$2 -> 6.44 | G50: =ROUND(2*(E50+F50),0)/2 -> 6.5
A51: 05/042 | B51: 9 | C51: 8 | D51: 4.9 | E51: =B51*$B$2+C51*$C$2+D51*$D$2 -> 6.34 | G51: =ROUND(2*(E51+F51),0)/2 -> 6.5
A52: 05/043 | C52: 9 | D52: 7.3 | E52: =B52*$B$2+C52*$C$2+D52*$D$2 -> 6.18 | G52: =ROUND(2*(E52+F52),0)/2 -> 6
A53: 05/046 | B53: 8 | D53: 4.7 | E53: =B53*$B$2+C53*$C$2+D53*$D$2 -> 4.42 | G53: =ROUND(2*(E53+F53),0)/2 -> 4.5
A54: 05/047 | B54: 9 | C54: 7 | D54: 5.1 | E54: =B54*$B$2+C54*$C$2+D54*$D$2 -> 6.26 | G54: =ROUND(2*(E54+F54),0)/2 -> 6.5
A55: 05/048 | B55: 6 | C55: 7.5 | D55: 5.6 | E55: =B55*$B$2+C55*$C$2+D55*$D$2 -> 6.06 | G55: =ROUND(2*(E55+F55),0)/2 -> 6
A56: 05/049 | B56: 7 | C56: 9 | D56: 3.8 | E56: =B56*$B$2+C56*$C$2+D56*$D$2 -> 5.48 | G56: =ROUND(2*(E56+F56),0)/2 -> 5.5
A57: 05/050 | B57: 9 | D57: 6.2 | E57: =B57*$B$2+C57*$C$2+D57*$D$2 -> 5.52 | G57: =ROUND(2*(E57+F57),0)/2 -> 5.5
A58: 05/051 | B58: 7 | D58: 4.7 | E58: =B58*$B$2+C58*$C$2+D58*$D$2 -> 4.22 | G58: =ROUND(2*(E58+F58),0)/2 -> 4
A59: 05/052 | B59: 8 | C59: 8 | D59: 5.3 | E59: =B59*$B$2+C59*$C$2+D59*$D$2 -> 6.38 | G59: =ROUND(2*(E59+F59),0)/2 -> 6.5
A60: 05/053 | B60: 10 | C60: 8 | D60: 7.8 | E60: =B60*$B$2+C60*$C$2+D60*$D$2 -> 8.28 | G60: =ROUND(2*(E60+F60),0)/2 -> 8.5
A61: 05/054 | B61: 9 | C61: 9 | D61: 6.4 | E61: =B61*$B$2+C61*$C$2+D61*$D$2 -> 7.44 | G61: =ROUND(2*(E61+F61),0)/2 -> 7.5
A62: 05/059 | B62: 8 | C62: 9 | D62: 5.8 | E62: =B62*$B$2+C62*$C$2+D62*$D$2 -> 6.88 | F62: =E62*10% -> 0.68800000000000017 | G62: =ROUND(2*(E62+F62),0)/2 -> 7.5
B63: =COUNTA(B3:B62) -> 55 | C63: =COUNTA(C3:C62) -> 53 | D63: =COUNTA(D3:D62) -> 58 | E63: =AVERAGE(E3:E62) -> 5.7106666666666666 | G63: =COUNTIF(G3:G62,">=5") -> 48 | H63: =SUM(G3:G62) -> 343.5
B64: Πλήθος | C64: Πλήθος | D64: Πλήθος | E64: Μέσος όρος βαθμολογίας | F64: Προσαύξηση | G64: Πλήθος προβιβασθέντων