A1: Ενημερώθηκε: | B1: =NOW() -> 40597.995020601855
A3: ΑρΜητρ | B3: Ασκ1 | C3: Ασκ2 | D3: ΔιαγΙαν | E3: Βαθμός | F3: Τελικός
B4: 0.2 | C4: 0.2 | D4: 0.6 | E4: 1 | F4: βαθμός
A5: 511/2000033 | E5: =$B$4*B5+$C$4*C5+$D$4*D5 -> 0 | F5: =ROUND(2*(E5),0)/2 -> 0
A6: 511/2000062 | E6: =$B$4*B6+$C$4*C6+$D$4*D6 -> 0 | F6: =ROUND(2*(E6),0)/2 -> 0
A7: 511/2000068 | E7: =$B$4*B7+$C$4*C7+$D$4*D7 -> 0 | F7: =ROUND(2*(E7),0)/2 -> 0
A8: 511/2000073 | E8: =$B$4*B8+$C$4*C8+$D$4*D8 -> 0 | F8: =ROUND(2*(E8),0)/2 -> 0
A9: 511/2000077 | E9: =$B$4*B9+$C$4*C9+$D$4*D9 -> 0 | F9: =ROUND(2*(E9),0)/2 -> 0
A10: 511/2001003 | D10: 6.4 | E10: =$B$4*B10+$C$4*C10+$D$4*D10 -> 3.84 | F10: =ROUND(2*(E10),0)/2 -> 4
A11: 511/2001019 | B11: 5.5 | D11: 6.1 | E11: =$B$4*B11+$C$4*C11+$D$4*D11 -> 4.76 | F11: =ROUND(2*(E11),0)/2 -> 5
A12: 511/2001034 | B12: 5.5 | D12: 5.1 | E12: =$B$4*B12+$C$4*C12+$D$4*D12 -> 4.16 | F12: =ROUND(2*(E12),0)/2 -> 4
A13: 511/2002024 | E13: =$B$4*B13+$C$4*C13+$D$4*D13 -> 0 | F13: =ROUND(2*(E13),0)/2 -> 0
A14: 511/2003036 | B14: 5.5 | D14: 4.5 | E14: =$B$4*B14+$C$4*C14+$D$4*D14 -> 3.8 | F14: =ROUND(2*(E14),0)/2 -> 4
A15: 511/2004010 | B15: 2.5 | E15: =$B$4*B15+$C$4*C15+$D$4*D15 -> 0.5 | F15: =ROUND(2*(E15),0)/2 -> 0.5
A16: 511/2004018 | B16: 6 | C16: 6 | D16: 4.8 | E16: =$B$4*B16+$C$4*C16+$D$4*D16 -> 5.28 | F16: =ROUND(2*(E16),0)/2 -> 5.5
A17: 511/2004033 | B17: 8 | C17: 9 | D17: 4.1 | E17: =$B$4*B17+$C$4*C17+$D$4*D17 -> 5.86 | F17: =ROUND(2*(E17),0)/2 -> 6
A18: 511/2004037 | B18: 5.5 | C18: 6 | D18: 5.5 | E18: =$B$4*B18+$C$4*C18+$D$4*D18 -> 5.6 | F18: =ROUND(2*(E18),0)/2 -> 5.5
A19: 511/2004061 | B19: 8 | C19: 9 | D19: 5.1 | E19: =$B$4*B19+$C$4*C19+$D$4*D19 -> 6.46 | F19: =ROUND(2*(E19),0)/2 -> 6.5
A20: 511/2004062 | E20: =$B$4*B20+$C$4*C20+$D$4*D20 -> 0 | F20: =ROUND(2*(E20),0)/2 -> 0
A21: 511/2004063 | E21: =$B$4*B21+$C$4*C21+$D$4*D21 -> 0 | F21: =ROUND(2*(E21),0)/2 -> 0
A22: 511/2004067 | B22: 3.5 | C22: 7.5 | D22: 2.2 | E22: =$B$4*B22+$C$4*C22+$D$4*D22 -> 3.52 | F22: =ROUND(2*(E22),0)/2 -> 3.5
A23: 511/2005033 | B23: 8 | C23: 9 | D23: 7.3 | E23: =$B$4*B23+$C$4*C23+$D$4*D23 -> 7.78 | F23: =ROUND(2*(E23),0)/2 -> 8
A24: 511/2005034 | B24: 5.5 | D24: 8.2 | E24: =$B$4*B24+$C$4*C24+$D$4*D24 -> 6.02 | F24: =ROUND(2*(E24),0)/2 -> 6
A25: 511/2005068 | E25: =$B$4*B25+$C$4*C25+$D$4*D25 -> 0 | F25: =ROUND(2*(E25),0)/2 -> 0
A26: 511/2006002 | E26: =$B$4*B26+$C$4*C26+$D$4*D26 -> 0 | F26: =ROUND(2*(E26),0)/2 -> 0
A27: 511/2006004 | E27: =$B$4*B27+$C$4*C27+$D$4*D27 -> 0 | F27: =ROUND(2*(E27),0)/2 -> 0
A28: 511/2006009 | E28: =$B$4*B28+$C$4*C28+$D$4*D28 -> 0 | F28: =ROUND(2*(E28),0)/2 -> 0
A29: 511/2006017 | B29: 8 | C29: 9 | D29: 4.9 | E29: =$B$4*B29+$C$4*C29+$D$4*D29 -> 6.34 | F29: =ROUND(2*(E29),0)/2 -> 6.5
A30: 511/2006018 | B30: 2.5 | E30: =$B$4*B30+$C$4*C30+$D$4*D30 -> 0.5 | F30: =ROUND(2*(E30),0)/2 -> 0.5
A31: 511/2006020 | C31: 5 | D31: 6.7 | E31: =$B$4*B31+$C$4*C31+$D$4*D31 -> 5.02 | F31: =ROUND(2*(E31),0)/2 -> 5
A32: 511/2006023 | E32: =$B$4*B32+$C$4*C32+$D$4*D32 -> 0 | F32: =ROUND(2*(E32),0)/2 -> 0
A33: 511/2006025 | C33: 5 | D33: 3.6 | E33: =$B$4*B33+$C$4*C33+$D$4*D33 -> 3.16 | F33: =ROUND(2*(E33),0)/2 -> 3
A34: 511/2006034 | E34: =$B$4*B34+$C$4*C34+$D$4*D34 -> 0 | F34: =ROUND(2*(E34),0)/2 -> 0
A35: 511/2006038 | C35: 5 | D35: 4.5 | E35: =$B$4*B35+$C$4*C35+$D$4*D35 -> 3.7 | F35: =ROUND(2*(E35),0)/2 -> 3.5
A36: 511/2006039 | B36: 6.5 | C36: 5.5 | D36: 3.6 | E36: =$B$4*B36+$C$4*C36+$D$4*D36 -> 4.56 | F36: =ROUND(2*(E36),0)/2 -> 4.5
A37: 511/2006042 | B37: 2.5 | E37: =$B$4*B37+$C$4*C37+$D$4*D37 -> 0.5 | F37: =ROUND(2*(E37),0)/2 -> 0.5
A38: 511/2007005 | B38: 5.5 | E38: =$B$4*B38+$C$4*C38+$D$4*D38 -> 1.1 | F38: =ROUND(2*(E38),0)/2 -> 1
A39: 511/2007008 | B39: 5.5 | C39: 6.5 | D39: 7.1 | E39: =$B$4*B39+$C$4*C39+$D$4*D39 -> 6.66 | F39: =ROUND(2*(E39),0)/2 -> 6.5
A40: 511/2007009 | B40: 6 | C40: 5.5 | D40: 5.4 | E40: =$B$4*B40+$C$4*C40+$D$4*D40 -> 5.54 | F40: =ROUND(2*(E40),0)/2 -> 5.5
A41: 511/2007017 | B41: 4.5 | D41: 5 | E41: =$B$4*B41+$C$4*C41+$D$4*D41 -> 3.9 | F41: =ROUND(2*(E41),0)/2 -> 4
A42: 511/2007021 | B42: 5.5 | C42: 6 | D42: 4.3 | E42: =$B$4*B42+$C$4*C42+$D$4*D42 -> 4.88 | F42: =ROUND(2*(E42),0)/2 -> 5
A43: 511/2007022 | B43: 6 | C43: 5.5 | D43: 4.1 | E43: =$B$4*B43+$C$4*C43+$D$4*D43 -> 4.76 | F43: =ROUND(2*(E43),0)/2 -> 5
A44: 511/2007026 | B44: 8 | C44: 9 | D44: 7 | E44: =$B$4*B44+$C$4*C44+$D$4*D44 -> 7.6 | F44: =ROUND(2*(E44),0)/2 -> 7.5
A45: 511/2007040 | B45: 5.5 | C45: 6.5 | D45: 6.5 | E45: =$B$4*B45+$C$4*C45+$D$4*D45 -> 6.3 | F45: =ROUND(2*(E45),0)/2 -> 6.5
A46: 511/2007041 | E46: =$B$4*B46+$C$4*C46+$D$4*D46 -> 0 | F46: =ROUND(2*(E46),0)/2 -> 0
A47: 511/2007042 | B47: 6 | C47: 5.5 | D47: 5.8 | E47: =$B$4*B47+$C$4*C47+$D$4*D47 -> 5.78 | F47: =ROUND(2*(E47),0)/2 -> 6
A48: 511/2007043 | B48: 6.5 | C48: 5 | D48: 4.7 | E48: =$B$4*B48+$C$4*C48+$D$4*D48 -> 5.12 | F48: =ROUND(2*(E48),0)/2 -> 5
A49: 511/2007045 | B49: 6 | C49: 6 | D49: 5.7 | E49: =$B$4*B49+$C$4*C49+$D$4*D49 -> 5.82 | F49: =ROUND(2*(E49),0)/2 -> 6
A50: 511/2007059 | B50: 6 | C50: 5.5 | D50: 5.2 | E50: =$B$4*B50+$C$4*C50+$D$4*D50 -> 5.42 | F50: =ROUND(2*(E50),0)/2 -> 5.5
A51: 511/2007061 | B51: 6 | C51: 6 | D51: 4.7 | E51: =$B$4*B51+$C$4*C51+$D$4*D51 -> 5.22 | F51: =ROUND(2*(E51),0)/2 -> 5
A52: 511/2007066 | B52: 6 | C52: 6 | D52: 5.7 | E52: =$B$4*B52+$C$4*C52+$D$4*D52 -> 5.82 | F52: =ROUND(2*(E52),0)/2 -> 6
A53: 511/2008002 | B53: 6 | C53: 6 | D53: 4 | E53: =$B$4*B53+$C$4*C53+$D$4*D53 -> 4.8 | F53: =ROUND(2*(E53),0)/2 -> 5
A54: 511/2008003 | B54: 5.5 | C54: 5.5 | D54: 3.7 | E54: =$B$4*B54+$C$4*C54+$D$4*D54 -> 4.42 | F54: =ROUND(2*(E54),0)/2 -> 4.5
A55: 511/2008004 | B55: 4 | C55: 6 | D55: 5.8 | E55: =$B$4*B55+$C$4*C55+$D$4*D55 -> 5.48 | F55: =ROUND(2*(E55),0)/2 -> 5.5
A56: 511/2008005 | E56: =$B$4*B56+$C$4*C56+$D$4*D56 -> 0 | F56: =ROUND(2*(E56),0)/2 -> 0
A57: 511/2008006 | B57: 6 | C57: 6 | D57: 3.1 | E57: =$B$4*B57+$C$4*C57+$D$4*D57 -> 4.26 | F57: =ROUND(2*(E57),0)/2 -> 4.5
A58: 511/2008007 | E58: =$B$4*B58+$C$4*C58+$D$4*D58 -> 0 | F58: =ROUND(2*(E58),0)/2 -> 0
A59: 511/2008009 | B59: 5 | C59: 7 | D59: 4 | E59: =$B$4*B59+$C$4*C59+$D$4*D59 -> 4.8 | F59: =ROUND(2*(E59),0)/2 -> 5
A60: 511/2008011 | B60: 3.5 | C60: 7.5 | D60: 6.7 | E60: =$B$4*B60+$C$4*C60+$D$4*D60 -> 6.22 | F60: =ROUND(2*(E60),0)/2 -> 6
A61: 511/2008012 | C61: 6 | D61: 4.9 | E61: =$B$4*B61+$C$4*C61+$D$4*D61 -> 4.14 | F61: =ROUND(2*(E61),0)/2 -> 4
A62: 511/2008016 | C62: 6 | D62: 4.1 | E62: =$B$4*B62+$C$4*C62+$D$4*D62 -> 3.66 | F62: =ROUND(2*(E62),0)/2 -> 3.5
A63: 511/2008018 | B63: 6 | C63: 8.5 | D63: 4.8 | E63: =$B$4*B63+$C$4*C63+$D$4*D63 -> 5.78 | F63: =ROUND(2*(E63),0)/2 -> 6
A64: 511/2008019 | B64: 5 | C64: 7 | D64: 4 | E64: =$B$4*B64+$C$4*C64+$D$4*D64 -> 4.8 | F64: =ROUND(2*(E64),0)/2 -> 5
A65: 511/2008021 | E65: =$B$4*B65+$C$4*C65+$D$4*D65 -> 0 | F65: =ROUND(2*(E65),0)/2 -> 0
A66: 511/2008022 | B66: 3.5 | C66: 7.5 | E66: =$B$4*B66+$C$4*C66+$D$4*D66 -> 2.2 | F66: =ROUND(2*(E66),0)/2 -> 2
A67: 511/2008023 | B67: 6.5 | C67: 5 | D67: 6.9 | E67: =$B$4*B67+$C$4*C67+$D$4*D67 -> 6.44 | F67: =ROUND(2*(E67),0)/2 -> 6.5
A68: 511/2008026 | B68: 2.5 | C68: 6 | D68: 5.3 | E68: =$B$4*B68+$C$4*C68+$D$4*D68 -> 4.88 | F68: =ROUND(2*(E68),0)/2 -> 5
A69: 511/2008027 | B69: 5 | C69: 7 | D69: 5.3 | E69: =$B$4*B69+$C$4*C69+$D$4*D69 -> 5.58 | F69: =ROUND(2*(E69),0)/2 -> 5.5
A70: 511/2008028 | B70: 4 | C70: 6 | D70: 7.5 | E70: =$B$4*B70+$C$4*C70+$D$4*D70 -> 6.5 | F70: =ROUND(2*(E70),0)/2 -> 6.5
A71: 511/2008030 | B71: 5.5 | C71: 6.5 | D71: 4.3 | E71: =$B$4*B71+$C$4*C71+$D$4*D71 -> 4.98 | F71: =ROUND(2*(E71),0)/2 -> 5
A72: 511/2008031 | B72: 5.5 | C72: 5.5 | D72: 4.5 | E72: =$B$4*B72+$C$4*C72+$D$4*D72 -> 4.9 | F72: =ROUND(2*(E72),0)/2 -> 5
A73: 511/2008033 | B73: 5 | C73: 7 | D73: 5.7 | E73: =$B$4*B73+$C$4*C73+$D$4*D73 -> 5.82 | F73: =ROUND(2*(E73),0)/2 -> 6
A74: 511/2008034 | B74: 6.5 | C74: 5 | D74: 4.9 | E74: =$B$4*B74+$C$4*C74+$D$4*D74 -> 5.24 | F74: =ROUND(2*(E74),0)/2 -> 5
A75: 511/2008035 | B75: 4 | C75: 6 | D75: 4.9 | E75: =$B$4*B75+$C$4*C75+$D$4*D75 -> 4.94 | F75: =ROUND(2*(E75),0)/2 -> 5
A76: 511/2008036 | B76: 4.5 | E76: =$B$4*B76+$C$4*C76+$D$4*D76 -> 0.9 | F76: =ROUND(2*(E76),0)/2 -> 1
A77: 511/2008037 | B77: 6 | C77: 8.5 | D77: 5.9 | E77: =$B$4*B77+$C$4*C77+$D$4*D77 -> 6.44 | F77: =ROUND(2*(E77),0)/2 -> 6.5
A78: 511/2008038 | C78: 6 | D78: 5.2 | E78: =$B$4*B78+$C$4*C78+$D$4*D78 -> 4.32 | F78: =ROUND(2*(E78),0)/2 -> 4.5
A79: 511/2008039 | B79: 6.5 | C79: 5 | D79: 4.9 | E79: =$B$4*B79+$C$4*C79+$D$4*D79 -> 5.24 | F79: =ROUND(2*(E79),0)/2 -> 5
A80: 511/2008040 | B80: 6.5 | C80: 5.5 | D80: 4.5 | E80: =$B$4*B80+$C$4*C80+$D$4*D80 -> 5.1 | F80: =ROUND(2*(E80),0)/2 -> 5
A81: 511/2008043 | B81: 5.5 | C81: 6 | D81: 5.8 | E81: =$B$4*B81+$C$4*C81+$D$4*D81 -> 5.78 | F81: =ROUND(2*(E81),0)/2 -> 6
A82: 511/2008044 | B82: 5 | C82: 8 | D82: 6.4 | E82: =$B$4*B82+$C$4*C82+$D$4*D82 -> 6.44 | F82: =ROUND(2*(E82),0)/2 -> 6.5
A83: 511/2008045 | B83: 6 | C83: 6.5 | D83: 2.7 | E83: =$B$4*B83+$C$4*C83+$D$4*D83 -> 4.12 | F83: =ROUND(2*(E83),0)/2 -> 4
A84: 511/2008046 | B84: 6 | C84: 8.5 | D84: 5.4 | E84: =$B$4*B84+$C$4*C84+$D$4*D84 -> 6.14 | F84: =ROUND(2*(E84),0)/2 -> 6
A85: 511/2008048 | B85: 6 | C85: 6.5 | D85: 6.2 | E85: =$B$4*B85+$C$4*C85+$D$4*D85 -> 6.22 | F85: =ROUND(2*(E85),0)/2 -> 6
A86: 511/2008049 | B86: 3.5 | C86: 7.5 | D86: 4.9 | E86: =$B$4*B86+$C$4*C86+$D$4*D86 -> 5.14 | F86: =ROUND(2*(E86),0)/2 -> 5
A87: 511/2008051 | B87: 6 | C87: 6 | D87: 5 | E87: =$B$4*B87+$C$4*C87+$D$4*D87 -> 5.4 | F87: =ROUND(2*(E87),0)/2 -> 5.5
A88: 511/2008052 | B88: 8 | C88: 9 | D88: 3.4 | E88: =$B$4*B88+$C$4*C88+$D$4*D88 -> 5.44 | F88: =ROUND(2*(E88),0)/2 -> 5.5
A89: 511/2008053 | B89: 6 | C89: 6 | D89: 6.8 | E89: =$B$4*B89+$C$4*C89+$D$4*D89 -> 6.48 | F89: =ROUND(2*(E89),0)/2 -> 6.5
A90: 511/2008054 | B90: 8 | C90: 9 | D90: 4.9 | E90: =$B$4*B90+$C$4*C90+$D$4*D90 -> 6.34 | F90: =ROUND(2*(E90),0)/2 -> 6.5
A91: 511/2008055 | E91: =$B$4*B91+$C$4*C91+$D$4*D91 -> 0 | F91: =ROUND(2*(E91),0)/2 -> 0
A92: 511/2008056 | E92: =$B$4*B92+$C$4*C92+$D$4*D92 -> 0 | F92: =ROUND(2*(E92),0)/2 -> 0
A93: 511/2008057 | B93: 6 | C93: 6.5 | D93: 4.8 | E93: =$B$4*B93+$C$4*C93+$D$4*D93 -> 5.38 | F93: =ROUND(2*(E93),0)/2 -> 5.5
A94: 511/2008058 | B94: 5.5 | C94: 6.5 | D94: 5.6 | E94: =$B$4*B94+$C$4*C94+$D$4*D94 -> 5.76 | F94: =ROUND(2*(E94),0)/2 -> 6
A95: 511/2008059 | B95: 5 | C95: 7 | D95: 8.5 | E95: =$B$4*B95+$C$4*C95+$D$4*D95 -> 7.5 | F95: =ROUND(2*(E95),0)/2 -> 7.5
A96: 511/2008061 | E96: =$B$4*B96+$C$4*C96+$D$4*D96 -> 0 | F96: =ROUND(2*(E96),0)/2 -> 0
A97: 511/2008062 | B97: 5.5 | C97: 5.5 | D97: 3.7 | E97: =$B$4*B97+$C$4*C97+$D$4*D97 -> 4.42 | F97: =ROUND(2*(E97),0)/2 -> 4.5
A98: 511/2008063 | B98: 6 | C98: 6 | D98: 7.6 | E98: =$B$4*B98+$C$4*C98+$D$4*D98 -> 6.96 | F98: =ROUND(2*(E98),0)/2 -> 7
A99: 511/2008065 | E99: =$B$4*B99+$C$4*C99+$D$4*D99 -> 0 | F99: =ROUND(2*(E99),0)/2 -> 0
A100: 511/2008066 | B100: 4.5 | E100: =$B$4*B100+$C$4*C100+$D$4*D100 -> 0.9 | F100: =ROUND(2*(E100),0)/2 -> 1
A101: 511/2008067 | B101: 6 | C101: 8.5 | D101: 3.5 | E101: =$B$4*B101+$C$4*C101+$D$4*D101 -> 5 | F101: =ROUND(2*(E101),0)/2 -> 5
A102: 511/2008068 | B102: 6 | C102: 6.5 | D102: 6.6 | E102: =$B$4*B102+$C$4*C102+$D$4*D102 -> 6.46 | F102: =ROUND(2*(E102),0)/2 -> 6.5
A103: 511/2008069 | B103: 5.5 | C103: 5.5 | D103: 3.9 | E103: =$B$4*B103+$C$4*C103+$D$4*D103 -> 4.54 | F103: =ROUND(2*(E103),0)/2 -> 4.5
A104: 511/2008070 | E104: =$B$4*B104+$C$4*C104+$D$4*D104 -> 0 | F104: =ROUND(2*(E104),0)/2 -> 0
A105: 511/2008071 | B105: 6 | C105: 6 | D105: 6 | E105: =$B$4*B105+$C$4*C105+$D$4*D105 -> 6 | F105: =ROUND(2*(E105),0)/2 -> 6
A106: 511/2008075 | B106: 6.5 | C106: 5.5 | D106: 4.8 | E106: =$B$4*B106+$C$4*C106+$D$4*D106 -> 5.28 | F106: =ROUND(2*(E106),0)/2 -> 5.5
A107: 511/2008076 | B107: 5.5 | C107: 6.5 | D107: 6.9 | E107: =$B$4*B107+$C$4*C107+$D$4*D107 -> 6.54 | F107: =ROUND(2*(E107),0)/2 -> 6.5
A108: 511/2008079 | B108: 6.5 | C108: 5.5 | D108: 5.8 | E108: =$B$4*B108+$C$4*C108+$D$4*D108 -> 5.88 | F108: =ROUND(2*(E108),0)/2 -> 6
A109: 511/2008080 | B109: 5 | C109: 8 | D109: 4.2 | E109: =$B$4*B109+$C$4*C109+$D$4*D109 -> 5.12 | F109: =ROUND(2*(E109),0)/2 -> 5
A110: 511/2008081 | E110: =$B$4*B110+$C$4*C110+$D$4*D110 -> 0 | F110: =ROUND(2*(E110),0)/2 -> 0
A111: 511/2008082 | B111: 5 | C111: 8 | D111: 5.5 | E111: =$B$4*B111+$C$4*C111+$D$4*D111 -> 5.9 | F111: =ROUND(2*(E111),0)/2 -> 6
A112: 511/2008085 | B112: 5 | C112: 8 | D112: 4.1 | E112: =$B$4*B112+$C$4*C112+$D$4*D112 -> 5.06 | F112: =ROUND(2*(E112),0)/2 -> 5
A113: 511/2008086 | C113: 6 | E113: =$B$4*B113+$C$4*C113+$D$4*D113 -> 1.2 | F113: =ROUND(2*(E113),0)/2 -> 1
A114: 511/2008088 | B114: 8 | C114: 9 | D114: 7 | E114: =$B$4*B114+$C$4*C114+$D$4*D114 -> 7.6 | F114: =ROUND(2*(E114),0)/2 -> 7.5
A115: 511/2009016 | E115: =$B$4*B115+$C$4*C115+$D$4*D115 -> 0 | F115: =ROUND(2*(E115),0)/2 -> 0
A116: Πλήθος | B116: =COUNTA(B5:B115) -> 78 | C116: =COUNTA(C5:C115) -> 74 | D116: =COUNTA(D5:D115) -> 78 | E116: =COUNTA(E5:E115) -> 111 | F116: =COUNTIF(F5:F115,">=5") -> 62
A117: Μέσος όρος | B117: =AVERAGE(B5:B115) -> 5.5897435897435894 | C117: =AVERAGE(C5:C115) -> 6.6013513513513518 | D117: =AVERAGE(D5:D115) -> 5.239743589743588 | E117: =AVERAGE(E5:E115) -> 3.874954954954954 | F117: =AVERAGE(F5:F115) -> 3.8963963963963963